tweets,type,class_name
السلام عليكم ورحمة الله اللهم ياعالم السر والنجوى ياكاشف الضر والبلوى نسألك أن تفتح لنا أبواب الخير والتيسير وتسد عنا أبواب الشر والتعسير اللهم تسلمنا إلى عدو يؤذينا و إلى شيطان يردينا ويخزينا وأرزقنا اللهم رزقا حلالا يغنينا وأبعد عنا شر ما يؤلمنا ويؤذينا,0,0
ليس هذا ما تم تداوله السيد كان جالس بجانب ماكرون و لما فطن لغياب زوجة الرئيس الفرنسي قام و ترك المكان لها,0,1
,1,1
كن ك زيت ف محيط لم تعتزل الاخرين ولم تختلط بهم,0,0
لا تحزن ان الله معنا,1,0
قطعة الخبز التي تصلك زرعت ثم سقيت ثم حصدت ثم طحنت ثم عجنت ثم خبزت ثم بيعت حتى تستشعر قول من غير حول مني ولا قوة فقل الحمدلله ف بالشكر تدوم النعم,0,0
انا جربت هاد المسألة و عشتها و يكفي ان اشغال البيت من اصعب ما يكون,-1,0
صدق قائلها و من لم يجرب غ تجيه الهضرة ساهلة,0,1
مساء النور,1,0
آميين كل واحد و كيف يفكر كل واحد و العقلية اللي تحكمو,0,0
احسن الله عوان هاد الجيل,-1,1
سبحان الله و بحمده سبحان الله العظيم عدد خلقه و رضا نفسه و زنة عرشه و مداد كلماته,1,0
ان شاء الله,0,0
الأخت نعمة من الله فهي الام الثانية أدامها الله نعمة علينا و عليكم,1,0
للاسف سيأتي يوم ستصفى فيه الحسابات,-1,0
اللهم امييين يا رب العالمين,0,0
الشعب في واد يعاني الويلات و هاد الناس في واد يخططون و يعيشون حياتهم دون مراعاة للطرف الاخر,-1,0
اللهم امين حسبنا الله و نعم الوكيل,-1,0
شهد اليوم مستشفى الحسن الثاني باگادير اضرابا للممرضين مطالبين بحقوقهم,0,0
دعواتنا لهم بالفرج,1,0
اموال طائلة تدفع لقاء هذا السكوت و غض الطرف اختي فتمت من يمهد لبيع ما تبقى من تلك البقاع,0,0
امين,1,0
مما جاءفي كتاب فك الله اسره انظر مثلا كيف لو أن المليارات التي قبضها المخلوع صالح أنفقوها على الشعب اليمني مباشرة وكيف لوأن المليارات التي أعطوها السيسي وبن علي وبن جديد وحفتر أنفقوها مباشرة على الشعوب ودعوها إلى الله لا إلى القومية ولاإلى التعري والدياثة والسياحة,0,0
و نعم بالله,1,0
اااه هادشي فاش يعجبوك يراعون مصالحهم فقط,-1,1
مما جاء في كتاب فك الله اسره قوله ولو أن المليارات الفلكية التي أعطيت لترامب وشركاته غير ما أعطي من الهدايا أنفقت لقضايا المسلمين وفكاك أسراهم لكان خيرا حتى في السياسة الدنيوية,0,0
امين,1,0
تم توقيع اتفاقية بين وزير الصحة أنس الدكالي و وزير الفلاحة عزيز أخنوش تقضي برفع مدة صلاحية الحليب المبستر من ايام الى ايام كما تم رفع مدة صلاحية الارانب و الطرائد المثلجة من اشهر الى شهر رغم هادشي كامل حنا واخا ديرو فيه حتى شهر,0,0
حشومة عليكم ا,-1,1
اسعد الله مساءكم,1,0
جميلة مساءكم ورد,1,0
امين,0,0
إن أحسنتم أحسنتم لأنفسكم اجعلها قاعدة في حياتك أسعد مساءكم بكل خير,1,0
فعلا و كلامك صحيح الامن و الصحة بالدرجة الاولى,1,0
ان شاء الله,0,0
بالصح لكن ماشي للسباحة,0,1
على سبيل الترفيه و الضحك,1,0
ما تفكر فيه ان تنفذ منه و لو جزءا قليلا,0,0
غ يتصلح الحال ان شاء الله غير كوني متفائلة,1,1
فعلا هو كذلك لاخذ العبرة لا غير,0,0
الحمد لله فيها خير,1,0
بوركت سيدي محمد,1,0
السؤال هل يستحق هذا العناء قصدي هذا التاريخ هلي يستحق ان يوثق,0,0
اوافقك الرأي لكني لا اريد مناصب خليني هاني و مهني احسن,1,1
صافي كوني هانية,1,1
هذا قرار سيسبب فوضى عارمة في البلاد قرار صائب لكن يحتاج الى خطة محكمة,0,0
و لله الحمد بعض المرات يبقى فيك الحال على شي حاجة لكن مع مرور الوقت تدرك ان ابتعادها كان فيه خير كثير,1,0
الى الامام سر,1,0
فيها خير,1,1
اااه الشوارع و الازقة التابعة لحي القدس وجهة نظري كانت ترمي الى اشراك بعضى اسماء ابناء المنطقة اللي كان لهم الفضل في ازدهار المنطقة هذا كل ما في الامر و عليكم السلام ورحمة الله,0,0
هذا كله و لست من هواة التصوير فماذا لو كنت كذلك,0,0
كلامك في محله الاسماء ليست بمقياس انا كان عندي تحفظ من تسمية اغلب الاحياء باسماء فلسطينية و عدم ورود اسماء من المنطقة و سعيد بمناقشتك للفكرة و ابداء رأيك المحترم,0,0
هذا عندنا نحن اما هم فلا اعلم كيف يتعاملون مع اسماء من عندنا,0,0
فكرة جميلة لو تم دمج الاسماء فيما بينها نحن لسنا ضد الاسماء الفلسطينية و لكن انصافا لمن كانو سببا في ازدهار المنطقة,1,0
كان احسن لو دمجو بعض الاسماء من هنا و هناك,0,0
اااه سازورها عما قريب ان شاء الله الاسم لو سمحت,0,0
انت الان خلطت بين الامور انا قلت باللي الاسماء هي اللي اجنبية اما الدين فهو واحد منذ بعث الله آدم و لن ادعي بانه اجنبي اذا اصر كل منا على موقفه لن نصل الى نقطة تفاهم عندي سؤال اختي الكريمة لماذا لا يقبلون في الحالة المدنية ان نسمي ا,0,0
كلمة اجنبي تطلق على اي شيء دخيل و لا وطني يعني اي شيء لا ينتمي لوطني المغرب فهو اجنبي اما الهوية الاسلامية فهي توحد الاوطان بغض النظر عن ثقافتهم و ووو ان كان لك تفسير آخر فمرحبا به,0,0
كلمة اجنبية في محلها و لا تستفز اي فئة دون اخرى و انا ابن المنطقة و اعرفها جيدا فهذه اسماء اجنبية علينا شارع بيت حانون,0,0
تريدين توريطي رأيك و يحترم انا قلت لو تم دمجهم كان أحسن عموما لقد تم اقرار المشروع و سنتعود على الاسماء لأنهم من هويتنا الاسلامية كما قلت,0,0
هناك من يشتهي المجاملة ويكره الحقيقة إن وافيته بالأولى ضحك و إنبسط وإن أنرته بالثانية سبك و إنقلب,0,0
هل مدينة أكادير المغربية ليس لها تاريخ و شخصيات تاريخية لتطلق اسماءهم على شوارعها بدل أسماء أجنيبة مع احترامي للاسماء الفلسطينية لكن كان احسن لو تم دمج بعض الاسماء,0,0
كلنا في الهوى سوى فصبر جميل,1,0
اللهم صل و سلم على سيدنا محمد وعلى آله وصحبه أجمعين,0,0
عندي تجربة فهاد الميدان,0,0
صلوات ربي و سلامه عليه,0,0
صلوات ربي و سلامه عليه,0,0
إن الله وملائكته يصلون على النبي يا أيها الذين آمنوا صلوا عليه وسلموا تسليما,0,0
اللهم امين يارب و لكم بالمثل ان شاء الله و جزاكم الله خيرا,1,0
جزاك الله خيرا,1,0
في امان الله,1,0
و جزاك الله بالمثل و كثر من امثالك دمت طيبة,1,0
اللهم آمييين يا رب العالمين,0,0
الجمعة الى الجمعة مكفرة لما بينها اذا اجتنبت الكبائر,0,0
تعلمين انه اخطر فخذي حذرك,0,0
اوا الله يدير اللي فيها خير,1,1
دعواتكم لعل دعوة في ظهر الغيب مستجابة و اعلم بان هناك ملك يدعو لك بالمثل ياارب فرج قريب بإذنك,1,0
معذور بصح هو ترويح عن النفس الى الانسان عدو فائض دالوقت,1,1
يمكن جات عليها مقولة فيها خير خير للنفس ترتاح و تسترجع الطاقة,1,1
اتفق معك هو قرب المسافات و خلانا ننساو الاشتياق الى درجة معينة,1,1
ساتأقلم مع التغيير لاننا نحب التغيير,1,0
ما يساعدني على التغيب هو السفر و العمل,0,0
يمكن عندك حق من واحد الناحية و لكن كيقولو زور و خفف,0,1
بصح الهاتف اصبح معيار لشعبية الانسان,0,1
بعض العلاقات تكون كما في الصورة لهذا لا ترضى بما كان و تحاول فقط سد الفراغ,0,0
بعض المرات يكون الهاتف سبب بعض المشاكل لهذا الى ما وصلك منو تا حاجة كتهنى,0,1
شعور غريب ان تغلق هاتفك ساعه وعند فتحه لا تجد رسالة ولا اتصال شي محزن ومفرح بنفس الوقت لك الله ياقلبي,-1,0
راه ماشي سهل باش يخاف منك بنادم,0,1
ثمن الدخول بوحدو و ثمن الاكل بوحدو اللي بغا يتقهوا بلا ما يدخل للداخل كيخلص ثمن القهوة فقط,0,1
اسعد الله مساءكم,1,0
ااه غالية بزاف حيت كيحسبو درهم للفرد بمعنى اللي غ يمشي مع العائلة صعيب له,-1,1
يا أبت لا تعبد الشيطان قالها إبراهيم متلطفا لأبيه فجاء رد ابنه إسماعيل بنفس التلطف يا أبت افعل ماتؤمر بروا آباءكم تبركم أبناؤكم أسعد الله يومكم بكل خير,1,0
نسأل الله العافية قال العلامة ابن عثيمين رحمہ الله تعال القلب وعاء إذا امتلأ بشيء لم يبق للشيء الآخر محل فإذا امتلأ بحب الدنيا انشغل عن حب الله عز وجل ورسوله صلى الله عليه وسلم وصار الإنسان ليس له هم إلا الكسب فتح ذي الجلال والإكرام,1,0
و الحسد انواع للاسف,-1,0
الانسان مليء بالمشاعر المشكل في توظيفها الزمان و المكان,0,0
ما اعجبني انه بعد انتهاء احتفالهم راحو يقبلون رأس الصحفي و يعتذرون منه,1,0
و لله الحمد و المنة,1,0
تحفيظ القرآن الكريم بأحد الكتاتيب,0,0
هذا ما يسمى زرع الخير اينما حليت و ارتحلت,1,0
اااه و جات عليها,1,1
الله اعلم هادي منين,0,1
من خشي الرحم ن بالغيب لا يظهر صدق التقوى والخشية إ حين تكون في الخلوة إذا ماخلوت بريبة في ظلمة والنفس داعية إلى العصيان فاستح من نظر الإله وقل لها إن الذي خلق الظلام يراني,0,0
و فيه شفاء لكم جميلة,1,0
راحة و طمأنينة لا يعرفها الا من جربها,1,0
سؤالي كان عفوي لا تؤاخذيني,1,0
لا شقاء لمن أستغفر الله العظيم الذي لا إله إلا هو الحي القيوم وأتوب إليه,1,0
صافي واخا,1,1
كيقولو سال المجرب و سال الطبيب,0,1
الى طلبتيها طلبها نيت كبيرة الله يرزقنا الصحة و السلامة,1,1
يهديهم الله و يشوفو من حالنا,1,1
الحرب الباردة ما زالت مستمرة,-1,0
جس النبض و لكن كيبان لي لا مجال للمقارنة,0,1
اغتنم الفرصة,1,0
عندك الحق,1,1
اش تتمناي,0,1
لا راه غ بالضحك ما قادين على حرب,1,1
بصح و الله,1,1
اللهم آمين,1,0
صلوات ربي و سلامه عليه,0,0
انا اصلا غ من المتفرجين النتيجة اللي كانت مرحبا,0,1
في ماليزيا قامت كل زوجة بتزويج زوجها بزوجة ثانية تعبيرا عن حبها له وقد تم ذلك بحفل جماعي راقي تناقلته وسائل الاعلام الله يهدي زوجاتنا لعمل خيري كهذا وانهم ان شاء الله لمهتدون وانا لهذا اليوم لمنتظرون,1,0
قال تعالى والله يختص برحمته من يشاء والله ذو الفضل العظيم اسأل الله العظيم رب العرش العظيم ان يختصكم ووالديكم واهلكم وذريتكم ومن تحبون برحمته وان يجعل لكم من كل هم فرجا ومن كل ضيق مخرجا ومن كل بلاء عافيه وان يرزقكم من حيث لا تحتسبون,0,0
و هل للمخلوق شأن في خلقه,0,0
و عليكم السلام ورحمة الله تعالى و بركاته صباح الورد,1,0
إن الله وملائكته يصلون على النبي يا أيها الذين آمنوا صلوا عليه وسلموا تسليما,0,0
هناك ولاء لللاعب اكثر من النادي,0,0
مرت مريم بنت عمران بموقف عصيب و مع ذلك قيل لها كلي و اشربي و قري عينا عش حياتك و لا ترهق نفسك بالتفكير فالله عنده حسن التدبير,1,0
الله يصلح احوال الامة,1,0
كل هم و لو يطول يزول كل وهم و لو يطول يزول,1,0
و سوى الروم فوق ارضك روم فعلى اي جانبيك تميل ماتت الروم لما كنا خيولا و كبونا فقامت إسرائيل و تحتسي قدسنا الدماء احتساء و ترتوي الأرض لما تصفو العقول,0,0
امين,1,0
في ذكرى استقلال الذي يصادف يوليوز الله يرحم شهداء جيش التحرير,1,0
آميين و جميع امهات المسلمين و ارحم الموتى منهم,1,0
آميين,0,0
إن قناة قرصنة تدعى قد وزعت بشكل غير شرعي المباريات الإفتتاحية لكأس العالم في منطقة الشرق الأوسط وشمال أفريقا و تبحت عن جميع الخيارات لوقف انتهاك حقوقها بما في ذلك الإجراءات المتخدة ضد المنظمات الشرعية التي ترى أنها تدعم مثل هذه الأنشطة الغير قانونية اللي ماقراها اليوم,0,0
المشكلة انهم يستقدمون مغنيين من الغرب باموال باهضة و ابناء الشعب في حاجة ماسة الى الصحة و التعليم وووو كما قلت الله يهدي ما خلق,-1,0
هذا حتى هو كيتقام كل سنة فاكادير و هناك دعوة لمقاطعته من قبل ابناء المنطقة,0,1
دمت طيبة,1,0
مهرجان يقام كل سنة يستقدمون فيه مجموعة من الفنانين لإقام سهرات الرقص على انغام معاناة الفقرء,-1,0
الى حضر المال غاب المبدأ و تسدو العينين,-1,1
حنا مالين الخير نجمعو الناس على الخير,1,1
المهم واخا هادشي كامل انا غنشهد لعل و عسى يصدق,0,1
معك حق اما حنا تشتتنا حتى ما بقا فينا ما يصلح,-1,1
دبا راه كاينين ناس في الواقع واخدين الزواج على اساس يقدر يصدق او مايصدقش لا اعمم طبعا و لكن فما بالك بشي حاجة اللي مبنية على المظاهر و الخداع لانه باش تحكم على ذكر او انثى من حساب او تعليق او او او قلة ما يدار هدك,0,1
وخصوصا هاد شعب بنو الاصفر خداو التربية و الاخلاق في المقام الاول و عطاو عناية من الصغر لهذل نجد ابناءهم يتفوقون في كل شيء,1,1
عاد مهرجان تيميتار بأكادير في دورته لدهس المبادئ و مسخ الأخلاق وقتل الأعراف و إحراق الأموال فقاطعوه لله بقلوبكم و قوالبكم,-1,0
آخر ما كاين في السوق الزواج عبر الخاص عش رجبا ترى عجبا من ورا هادشي كامل اللي بغاني نشهد له زرقلاف,0,1
و هذا من علامات تأثير الصلاة عليه الصلاة تأمرنا بان نتحلى باخلاق رفيعة و نتحلى بالاحترام و كف الأذى و الا فانها مجرد عادة اكتسبها المرء,1,0
تعلموا الاخلاق من اليابانيين,1,0
,1,1
جنة فوق الارض,1,0
اسعد الله يومكم بكل خير,1,0
اسعد الله يومكم بكل خير,1,0
صباح الورد,1,0
لا يشغلني من أساء إلي فلست أجاريه إنما يشغلني من أحسن إلي كيف أجازيه أسعد الله يومكم بكل خير,1,0
اميين,0,0
هده هي الحقيقة للاسف,-1,0
و حفظك الرحمان,1,0
للعلم نتكلم عن حالة واقعية,0,0
شيء مخزي و محزن,-1,0
هي دافعت عن شرفها و كانت النتيجة موت الضحية,-1,0
و عليكم يا رب,0,0
من حقها ان تدافع عن شرفها لكن القانون يتعامل بالدليل,0,0
نعم,1,0
هل يتساوى الشرف مع الروح إدا كان الجواب نعم فالسيدة الجانية فعلت ما يجب أن يفعل,0,0
بالتوفيق و ان شاء الله تحدو حدو مواطنك أزارو تهلاو لينا فيه يا شعب الزمالك,1,1
بوركتم,1,0
إذا ملأت عقلك بصغائر الأمور فلن يبقى مكان لكبارها فالعقل كالحقل إن لم تتعاهده بالنباتات الجيده نمت فيه حشائش ضاره,0,0
لكن هل المغرب لا يصدر منتوجاته للكيان,0,0
آمين,1,0
تحياتي تحياتي و نهرا من سلاماتي لمن في القلب مسكنها و تحيا ضمن آهاتي و يحكي عشقها شعري و نبضي قال رأفات,1,0
بخير و لله الحمد دمت طيبة,1,0
بصح كما كاين اللي يفرح كاين اللي يقلق فصبر جميل,1,0
اه بصح صعيب بزاف,-1,1
اسعد الله يومكم بكل خير,1,0
جميلة,1,0
الشيطان يأتي في أشكال كثيرة بما في ذلك الفخر,-1,0
في ميزان حسناتك,1,0
صدقت,1,0
اش غ تستافدي من وراها او بالاحرى علاش غ تغادري,0,1
الراس بزاف د الافكار يدورو فيه لكن الوقت و عدم الاهتمام يقتل تلك الافكار,-1,1
تبقى مجرد نوايا لا تلقي لها بالا,-1,0
هذا ما عطا الله,0,1
مساء الانوار بروح رياضية,1,0
حجي عندو خلاف شخصي و يقدر يتحل كما كان مع زياش,0,1
آمين,1,0
فنظري هادوك ماشي شروط تعجيزية و لامبالغ فيها بالعكس هو باغي يخدم و خاثو يخدم مرتاح نهار تكون شي حاجة اللي مبالغ فيها فالباب وسع من كتافو و يجي ما حسن منو اما الان فهو الانسب,0,1
تماما و الله خاصها تطبق حتى ف البيوت لان التكنولوجيا اصبحت سلبياتها تهدد مجتمعنا,0,1
أغلب المنتخبات اللي قدمت مستويات كبيرة فالمونديال كنلقاو عندها مدرب دوز معاها فترة طويلة و تأقلمو معاه اللاعابة و المحيطين بالمنتخب لهذا نطالب الجامعة بالعمل على ابقاء كمدرب لكتيبة الاسود حتى انتهاء عقده مع الاسود,0,1
الإخوان هاد الصحيفتان تعملان على إفشال المقاطعة و همهم مصلحتهم لهذا هناك دعوة من كل المغاربة لإلغاء الاشتراك و الإعجاب بهم,0,0
الله يهديه يبقى معانا و يخلوه يخدم,1,1
الله يعطيك الصحة والعافية,1,0
الشياطين تستعين بالاسود لتعطيل الحواسيب,0,0
أخلاق و روح رياضية,1,0
الحمد لله بخير تشكراتي,1,0
راه يرشحوهم للفوز باللقب و لكن عندهم البرازيل فالدور القادم تما يبينو لينا حنة اديهم,0,1
تبقى بصمة الدم المغربي حاضرة في المونديال بهدف ناصر الشادلي,1,0
و لله الحمد,1,0
و لله الحمد و المنة,1,0
حتى انا خليتهم متعادلين و لكن ملي رجعت قالو لي باللي بلجيكا ربحات,0,1
تغريدة للإطمئنان هل أنتم بخير,1,0
وفي ظلكم سيادة الرئيس أخبرنا عن حال القضاء,0,0
مبروك الهدف,1,0
معرفتش,0,1
آمييين و الله يديمها نعمة,1,0
للأم ان تفخر إن كانت تحت أيديها جوهرة كما في الصورة,1,0
تحريك عجلة الاقتصاد هذا ان كانت لاقتصادنا عجلة,0,0
صوت يعدل المزاج,1,0
واش ها التعليق يا عم يوسف مبدع,1,1
هل جربت دلك الإحساس تكون كتاكل و تفكر شي حد ولا شي هضرة و توحل لك و تسد لك الشهية,-1,1
هذا ما يراه الناس علينا للاسف,-1,0
بمجرد شفت التغريدة جاني الضحك تدوم الضحكة ان شاء الله,1,0
مفهوم الشرف والعار يسيطر على مفهوم الثقة في مجالات واسعة من الحياة العربية العرب مورست عليهم العنصرية ومع هذا فقد شعرت عميقا أنهم يمارسونها ضد بعضهم البعض,-1,0
حين يدمر العرب الممتلكات العامة فهم يعتقدون أنهم يدمرون ممتلكات الحكومة لا ممتلكاتهم و لازال العرب يستخدمون القمع والتهديد والضرب خلال التعليم ويسألون متى بدأ القمع أستغرب لماذا تستعمل كلمة ديمقراطية كثيرا في العالم العربي,-1,0
أبرز ما تناوله الكتاب المجتمع العربي عامة ليس عنده استعداد ليربي المواهب ويقويها السجناء السياسيون في البلاد العربية ضحوا من أجل الشعب ولكن الشعب نفسه يضحي بأولئك الشجعان انعدام حس المسؤولية طاغ في مجتمعاتهم,0,0
اما في الحياة العامة فهو يتصرف وفق قدراته وميزاته ونوع عمله وهذان الوجهان المتناقضان غالبا ينتج عنهما اشكال لا حصر لها من الرياء والخداع و القمع على العرب أن يفهموا التجربة اليابانية فسيطرة العسكر على الشعب هي سبب دخول البلاد في حروب مجنونة,0,0
اول ما اكتشفت في المجتمع العربي هو غياب العدالة الاجتماعية وهذا يعني غياب المبدأ الاساسي الذي يعتمد عليه الناس مما يؤدي الى الفوضى الرجل العربي له قيمتان واحدة في البيت واخرى في الحياة العامة الرجل العربي في البيت يلح على تعظيم نفسه ورفع قيمتها,0,0
الدين أهم ما يتم تعليمه لكنه لم يمنع الفساد وتدني قيمة الاحترام مشكلة العرب أنهم يعتقدون أن الدين أعطاهم كل العلم عرفت شخصا لمدة عشرين عاما ولم يكن يقرأ الا القرآن بقي هو ذاته ولم يتغير لكي نفهم سلوك الانسان العربي العادي علينا أن ننتبه دوما,0,0
اهم ما جاء في الكتاب العرب متدينون جدا وفاسدون جدا الحكومة لا تعامل الناس بجدية بل تسخر منهم وتضحك عليهم في مجتمع كمجتمعنا المجتمع الياباني نضيف حقائق جديدة بينما يكتفي العربي باستعادة الحقائق التي اكتشفها في الماضي البعيد,0,0
