tweets,type,class_name
لا أعلم مصدر الضوء في منزلنا أعتقد أنه قلب أمي,1,0
وبعض الكلمات خلقت لتقال مره واحده لشخص واحد ثم لا يكون لها معنى بعدها,1,0
ما أعظم أن يستطيع الإنسان أن يخفي مشاعره حتى عندما تنازعه نفسه لتفجيرها بعيون دامعة إنكسارا لأجل صمت أنيق,1,0
ما شاء الله شرحه جميييل ومفيد وفيه معلومات ما كنا نعرفها,1,1
نتمنى نشوف مبارة كبيرة تطغى فيها كرة القدم عن اي شيء ويكون الفور للأفضل,1,1
كن سببا في جعل شخص اخر يؤمن بوجود الخير في الناس,1,0
من اعتاد أن يوزع الورد فسيبقى شيء من العطر بيده,1,0
لم تكن جميلة تماما لكنها كانت مثل الفن لا ينبغي أن يكون جميلا على الدوام ولكن يجب أن يجعلك تشعر بشيء,1,0
الرضا نسمات تمر على القلب تلطفه و تخبرنا أن هنيئا لنا ما نحن فيه,1,0
مدينتي الحبيبة افران صور ارسلت الي اليوم للإشارة درجة الحرارة الان,1,0
حقيقة الأشخاص حولنا لا يعلمها إلا الله لذلك قل دائما اللهم دلني على من أراد بي خيرا ودله علي وإصرفني عمن أراد بي شرا وأصرفه عني,1,0
اعتقد بأن الإحساس الأروع في العالم أن يكون المرء مطمئنا مطمئن لا أكثر لا يشعر بالخوف او الريبة لا تعتليه الشكوك او الضيقة مطمئن فحسب,1,0
الوداد وكفى,0,0
اللهم جنبنا رفاق السوء اللهم سلمنا من الاشرار اناء الليل واطراف النهار في الاعلان والاسرار واهدنا لما تحبه منا واغفر لنا ياغفار,1,0
وليكن ما تريد يا سيدي,1,0
الحديث مع الغرباء مريح جدا,1,0
الجو زوين,1,1
ذمتي متألقة يا استاذة,1,0
هاذ النهار زوين و غدا حتى هو غادي يكون زوين و السيمانة كلها اتكون زوينة,1,1
غايجي واحد الوقت و غادي نحقق فيه كاع داكشي لي كانتمناه حيت حتى حاجة ما مستحيلة,1,1
مع لعزيمة الكل ممكن,1,0
من أجمل ما قرأت,1,0
اللهم إني اسألك طمأنينة دائمة وشغفا لا ينقطع,1,0
على كثر الظروف المتهاوية علينا لا زالت نفوسنا رحبه وضحكاتنا حاضره,1,0
اللهم بشرني بفرحه تسر خاطري للأبد,1,0
أحب الحديث معك رغم أني لا أملك ما أقوله أحيانا,1,0
حاول جاهدا في جميع علاقاتك إن لم تكن خيرا لا تكن شرا,1,0
عندما تعيش لتسعد الاخرين سيبعث الله لك من يعيش ليسعدك,1,0
ربي يدير لك لفيها الخير,1,1
نعم علينا أن نشجع مثل هذه المواهب التي هي مفخرة لنا جميعا و هذا الطفل سبق له أن ظهر في برامج تلفزيونية مغربية,1,0
فعلا الطفل ايدر من الأشخاص الذين يستحقون الإشادة والتنويه,1,0
حقا رواية رائعة جدا ليس لها وصف,1,0
شكرا اختي كنت ابحث عن كتاب شيق فقد أوشكت إنهاء كتابي انهض بذاتك وبدوري انصحك بقراءته,1,0
أنا من النوع الذي يقرأ عدة كتب في نفس الآن بسبب طباعي المشاكسة لكني أنصاع لقراءة كتابين شهريا واحد في تخصصي و الثاني ثقافة عامة,0,0
رواية لها معان عميقة حسب فهمي لمراجعتك الرائعة استاذي محمود,1,0
لم توضح اعتراضك على النقطة,0,0
ليس بالغريب عنكم هذا رائع,1,0
هل من لقاء مرتقب بمدينة اكادير ضمن برمجتكم وشكرا,1,0
لا اظن ان الجزء الاول موجود على الشكل الالكتروني,0,0
شكرا على توضيح,1,0
بالتوفيق ان شاء الله,1,0
الله يهدي ماخلق وصافي حتى شي وحدين مطيحين علينا الدل,-1,1
كلامي واضح ومفهوم مايحتاجش نترجم انا ماشي مترجمه,-1,1
لحسد ومايدير زريعة لقنب,-1,1
ايواا هادي خبار زينه,1,1
بعد اداءه الى بقا في مستواه يقدر في اقرب فرصه يحترف,1,1
كنهضر على الاصل ديالو ماقلتش زياش تزاد هنا,0,1
ماشي غريب على ولاد مدينتي من زياش وزيد وزيد,0,1
مزيدا من التألق ان شاء الله,1,0
في مثل هذا اليوم توج المنتخب الوطني ببطولة إفريقيا للمحليين التي نظمت بالمغرب بعد الفوز على نظيره النيجيري برباعية نظيفة سجل منها حدراف هدفين و وهدف لكل من الكرتي و الكعبي في مباراة احتضنها المركب الرياضي محمد الخامس,1,0
الوداد يا معذبهم,1,0
بالتوفيق ل قطر,1,0
مبروك لقطر لعقبه لكاس,1,1
الحمدلله ماشي غي انا لي لاحظت هادشي,1,1
رفض عرض الكفار وقبل عرض المسلمين الله على اخلاقك يا بنعطية,1,0
مباراة المغرب والارجنتين ستلعب يوم مارس على أرضية ملعب محمد الخامس بالدارالبيضاء,0,0
حنا ماشي عنصريين حنا شعب متعايش عزاز عليا اليهود المغاربة,1,1
فال خير اساط راهم رابحين,1,1
وفرو عليهم فلوس طيارة,0,1
النحس الرجاء و نهضة بركان و حسنية أكادير في مجموعة واحدة,-1,1
هادي البدايه ومزال مزال,1,1
مبروك التأهل,1,0
بالتوفيق ان شاء الله,1,0
تصبحون على واقع أجمل,1,0
هنااا حطييت لجديد,0,1
ايوا شكون بحالنا,0,1
اودي نسكت حسن لي,-1,1
بنعطيه اساسي,0,0
بوفال والمراوغات قصة حب لا تنتهي,1,0
شكرا على التوضيح,1,0
تصريحات عادية,0,1
جمعة مباركة على الجميع,1,0
بزااف عليك مكاينش شي كلب قدك,-1,1
أفضل مدرب في إفريقيا رونار,1,0
مابقينا فاهمين والو فهاد لبلاد,-1,1
اتكلو على الله,1,0
اودي لا تستغرب مابقاتش المصداقيه في كلشي المجالات,-1,1
الله اعلم خصوصا مع فرقه صغيره,-1,0
كنظن صعيب يوافق,0,1
كل واحد وميولاته ويوم تعلق عدل اسلووبك واحترم غيرك,1,1
مجرد التفكير في أحلامنا يسعدنا فكيف إذا تحققت,1,0
ايوااا لحمدوو الله مين هداهم الله ودخلوه,1,1
صفحاتكم للأسف هي من تنشر هذه الاخبار,-1,0
سبق وصرح انه لا يريد مغادرة اجاكس في يناير,0,0
طلب نادي الرجاء من النادي الأهلي السعودي منحه مليوني يورو للتخلي عن لاعب بدر بانون,0,0
زوجة رونالدو ترتدي القفطان المغربي بحفل,0,0
ضيع راسو براسو للأسف,-1,1
لاعب جيد وبالتوفيق له,1,0
اول مره كنسمع عليها كتبان زوينه,1,1
اللاعب مستمر مع ناديه لم يفسخ عقده,0,0
كان من بين احسن المدافعين في المنتخب نتمنى له توفيق في اي دوري كان,1,0
وضروري فينما شي مغربي انا معاه,1,1
بنسبة لي لاعب عادي,0,0
صافي بدات تعلن الحرب عليا من دبا,-1,1
ومازلت انتظر ان يهديني القدر هدية كهذه,1,0
ليس تصغير ولا حقد فقط انا اتكلم بالمنطق,1,0
كيرتكب الاخطاء بزاف,-1,1
وحتى لاننسى أن هناك مغاربة بعقول متنورة من نفس مكان و منطقة مقتل السائحتين قام مغربي إسمه عمر بإنقاد سائحة سويسرية من موت محقق,1,0
واش ناس دير على بحال هادو بلا عقل مساكين,1,1
لانك من طبيعتك انسان سافل و لي يدور على سفاله يلقاها الله يحرق لي امثالك شوهتو الدين الاسلامي,-1,1
الجمال جمال الاخلاق شنو ندير به الى هو زوين و اخلاقو,1,1
واخيراا الاعلام قالها زينه,1,1
ظلم كبيير ل زياش,-1,0
ولد خوه يمكن,0,1
مباراة ممتعه وماشاء الله على زياش و مزراوي كالعاده اداء رااائع,1,0
المغاربه وجزائريين دايما جايبين لعز,1,1
اللهم انصر إخواننا في فلسطين,1,0
وياه حتى انا بحالك فاش سمعتها تصدمت,-1,1
أسد من أسود الأطلس,1,0
جعل الله يوم الجمعه لكم نورا وظهره سرورا وعصره إستبشارا ومغربه غفرانا وجعل لكم دعوة لا ترد ووهبكم رزقا لا يعد وفتح لكم بابا إلى الجنة لا يسد,1,0
الف الف مبروووك ل رجااء,1,0
بداية المباراة بالتوفيق للرجاء,1,0
وزااايدها بساعة الصيفية في فصلالشتاء بغيت لك الغرق في الغرق,-1,1
فخرر المغرب,1,0
حنا فرحانين كثر من المصريين,1,1
عزائنا لأهالي ضحايا فاجعة القطار رحم الله الموتى والهم ذويهم الصبر والمصابون نسأل الله لهم الشفاء,1,0
ان شاء الله في مباراة الغذ يعطو افضل مالديهم,1,0
من حقك تعطي رأيك اخويا ولكن انا شفت مقارنة ب امرابط قديما اللاعب كان نااقص,-1,1
الحسد والحقد و النفاق والكذب,-1,0
دولتنا ليست دولة ديكتاتورية لحتى تشترط على شعبها الاسلام ف ديننا دين يسر لا دين عسر ونحن لسنا عنصريين بل نحن شعب متعايش,1,0
ربي سود وجكم بسبب افعالكم,-1,0
عبييد من درجة الاولى الله ينعل فلووس لي تخلي بنادم يركع لهااد لقوم,-1,1
بسبب القرار الخاطئ تراجع مستواه,-1,0
الله يفرحهم,1,0
شكرا ربي يخليك,1,0
الشعوب الواعية لا تفرق بينهم لا سياسة ولا رياضة,1,0
قمة الاخلاق,1,0
كنتم الافضل احنااا معااكم في الحلووه والمره ندعمكم نساندكم,1,1
من بعد ما شفت الوجه الثاني لبعض العرب الجهلاء المنافقين الخبيثين كنت أتمنى لو كانت الصورة حقيقية ويضربو راسهم مع أقرب حيط يلاااااه,-1,1
لا تصاحب إلا من يكتم سرك ويستر عيبك وينشر حسناتك ويطوي سيئاتك فإن لم تجده فلا تصاحب إلا نفسك,1,0
بلادي يازين البلدان,1,1
ولنا في القلب أمنيات إجعلها يارب واقعا يسعدنا,1,0
مغاربة بالدم بالروح بالعرق نفديك يامغرب,1,0
مدرب كبير ومثابر وطموح يستحق,1,0
إذا جاءك المهموم أنصت وإذا جاءك المعتدر اصفح وإذا قصدك المحتاج انفق ليس المطلوب أن يكون في جيبك مصحف ولكن المطلوب أن تكون في أخلاقك آية,1,0
انا كنشجع الفرقة ماشي البراهش,-1,1
مستهترين للاسف,-1,1
نعم أنا ضد هذه التقنية جملة وتفصيلا لأن أكبر مشاكلها هو التوقيت وهذا يؤثر سلبا,-1,0
يارب لك الحمد على هذا التقدم ستكون قصة كفاح كتبت بقلم الابداع الذي يصف التفاصيل باجمل طريقة متحمس لقراءتها عند نجاة البطل,1,0
مرحبا بكم في هذا الفضاء وفكرة جيدة أن تكونوا على تواصل معنا وحتى يكون التواصل على أتم وجه أقترح أن يكون التغريد باللغة العربية واللغة الأمازيغية لأنهم اللغات الرسمية في مغربنا الحبيب,1,0
اولا هذا ان دل يدل على نبلك و كرم اخلاقك و عظمة شخصيتك وروعة تفكيرك,1,0
ربي يحفظك اخي الغالي كلامك دائما مايخجلني,1,0
بالضبط هادا لي قصدت الله يصلح الحال,1,1
ان شاء الله غيمة سوداء وتمر باذن الله و يعود لكم سالما مشافى وليست على الله بصعبة اللهم يا الله اشف عبدك و امده بالقوة والصحة,1,0
هذه القصيدة للشاعر العباسي ابن الفارض,0,0
الله الله على الروح الرياضية في ابهى حللها,1,0
الله يقدرك على فعل الخير ختي فاطمة,1,1
الله يدوزها على خير,1,1
ان شاء الله غنعاودوها غدا,1,1
ومن ينسى تلك البطولة,1,0
الله ينجينا من هذه الاشكال التي بدات تنتشر كثيرا في مجتمعاتنا العتب على الاعلام الذي يستضيفهم ويجعلهم مشاهدون,1,0
هذا الشخص يسعى لنشر الفتنة فقط فكل تغريداته محرضة على الفتن ومعاكسة للعقل البشري,-1,0
واو صراحة شيء جديد أرفع لك القبعة,1,1
يعلم اننا عرب وكل الكتب تقول ذلك,0,0
نتمنى من الله العلي القدير ان يشفيه شفاء تاما ويلبسه ثوب الصحة والقوة ولا يريكم فيه مكروها باذن الله,1,0
متافق معاكم فهادا الشي كامل واكيد اي انسان في الدنيا غادي يسمح فكولشي ويتبع واليديه لكن كاينة حلول وسط باش الفرقة تحافظ على الاستقرار الفني ديالها السفري وجوده مهم في التواصل الفني مع اللعابة وتوضيح خطط المدرب الخوف الا ك,0,1
هو مازال ماعندوش الامكانيات باش يكون مدرب لفرقة كبيرة بحال الراجا,-1,1
ربي يحفظك ويبارك فيك,1,0
شكرا لك اختي اتشرف بمتابعتك,1,0
اللهم امين ولك اختي الراقية,1,0
يخرج بتعادل ايجابي من ارض اكادير بداية جيدة للنسور الخضر,1,0
بالتوفيق لفريق الافضل تمثيل للمغرب خارجيا,1,0
طيب مانوع الكمامة الذي يصد الفيروسات حتى ننشرها والجميع يستفيد,1,0
في ظل انتشار مرض في احب أن أنصح الجميع بارتداء الكمامة الطبية واستعمال معقم اليدين بشكل دائم خصوصا عند السلام او استعمال شيء عمومي انصحوا بها الجميع حتى نحد من خطورة المرض فالوقاية خير من العلاج أتمنى من الله أن تنتهي هذه الغمة بأسرع مايمكن,1,0
اللهم لاتدع لنا في يوم الجمعه ذنبا إلا غفرته ولا مريضا إلا شفيته ولا ميتا إلا رحمته ولا دعاء إلا استجبته ولا تائبا إلا قبلته وأكثرو من الصلاة على النبي,1,0
لا اعتقد ان ملك او حكومة المغرب ممكن ان يقبلو بزيارة النتن لانهم يعرفون الغضب الشعبي الذي سيجتاح المغرب جراء هذه الزيارة,-1,0
لاتوجد اي مشكلة وتشرفت بك,1,0
ما أجمل الصباح عندما يخبرنا أن الأماني مهما تأجلت سيأتي فجرها لتشرق فاستبشروا وتفاءلوا صباحكم تفاؤل وأمل وسعادة,1,0
الاستمرارية في الانتصارات مهمة وترفع معنويات اللاعبين الان وصلنا للنقطة وباقي عندنا ماتش مؤجل الا ربحناه غادي نوصلو نقطة في المركز الثاني والمتصدر بعيد علينا بثلاث نقاط الامال قائمة ان شاء الله في تحقيق لقب هذا الموسم ولازال الطريق طويل,1,1
ان شاء الله يتم التوقيع معاه اجمل خبر سمعته هذا الصباح,1,1
خصك تشوف الطبيب حيت اقدر تكون لاسمح الله عظمة الكتف تحركت من بلاصتها ويكون خصها تثبيت و اكيد الراحة ماتهملهاش حيت لاسمح ممكن تضاعف معاك مستقبلا,1,1
و منكم نستفيد,1,0
المهم يكون البديل المميز حيت البطولة خصها نفس طويييييل,1,1
طبعا هو المتسبب في الخسارة بسبب قناعاته السيئة ودخل في تصادم مع لاعبين مهمين مثل بنحليب والحافيظي و مابيدي صفحة وطويت لكن كنت اود ان يجهزو البديل ومن بعد يستغنوا عن خدماته السفري و المباركي بلا اي خبرة او شواهد فنية,-1,0
غير مرحب بكم في الدول الإسلامية و من أشد الدول التي تكرهكم هذا الأمر لايتعلق بالإنسانية بل يتعلق بالمبدأ لأنهم يحترمون أوطانهم ولايريدون للنجاسة أن تدخلها ومن أنتم حتى تتكلمون عن الإنسانية تقتلون الأطفال والشيوخ والنساء رأينا انسانيتكم فلا داعي للتغني بالشعارات الفارغة,-1,0
ماشاء الله تبارك الله جمال حقيقي اجمل شيء الالوان وانتشار الأشرعة,1,0
ربي يحفظك اخي كلامك شرف كبير لي وكل يرى الناس بعين طبعه والطيب من اصلك,1,0
صباحك سعادة و نجاح وراحة بال,1,0
شكرا ليك بزاف اخي عزيز حتى حسابك غني بالمعلومات القيمة و كنتشرف بمتابعتك,1,1
الله يسلمك اخي العزيز,1,1
ان بعض الظن اثم يا حسان,0,0
الشكر لكم انتم على هذه المبادرة النبيلة التي اتمنى ان تحقق اهدافها المرجوة شكرا,1,0
لكن وقت الجد يعرفون من اين تؤكل الكتف,1,0
صباحك سعادة ونجاح صديقي العزيز,1,0
لأن الكثير يحتاجون هذه المبادرة الخيرة اتمنى من الله يوفقكم اكثر و اكثر في فعل الخير ويجعله في ميزان حسناتكم كل التحية والاحترام,1,0
من أجمل وأفصح وأبلغ ما قرأت سلمت أناملك,1,0
اقبل بالمكان الذي أنت به تذكر أين كنت ولكن الأكثر أهمية أن تعلم المكان الذي تريد الذهاب إليه أتمنى لك بداية جميلة ويوم رائع,1,0
لا لا بالعكس هكاك افضل من ناحية التكاليف المادية وفنفس الوقت عارفين الحسنية وبركان تبقى كل الاحتمالات واردة لكن ان شاء الله التاهل من نصيب الخضرا,1,1
عموما هادي النتائج من الاتحاد الدولي للتاريخ والاحصاء يعني لا يمكن يكون فيها انحياز لأحد على احد و كما رأيت كل شيء محسوب بالنقاط,0,1
بالتوفيق ان شاء الله و اتمنى تكتب في ميزان حسنات من يشارك في هذه الحملة الرائعة التي تدعو للخير,1,0
ايييه للاسف,-1,1
صحيح عندك الحق,1,0
امممممم صراحة واحد الموقف صعيب والتفكير في هادي اللحظة باش تقرر القرار الصحيح لكن اتوقع ان الاعتذار وترك القرار له في التواصل هو الحل الصائب,1,1
وهادا القانون الاخرق مكاينش غير في المغرب,-1,1
اشكرك اختي نبيلة على كرم اخلاقك وكلامك الراقي واتشرف ان اكون في هذه القائمة مع اعلام تويتر في المغرب,1,0
لاشكرا على واجب خويا,1,1
هادا الحساب الجديد للاخ اسماعيل بعدما توقف حسابو القديم الدعم الدعم يامغاربة,1,1
و نقولك وجهة نظري بصراحة فوزي لقجع من افضل الكفاءات في الكرة المغربية والانتفاضة الأخيرة كانت بسبب عمله واخلاصه لكن لايمكن ان يكون رئيسا لنادي في البطولة الاحترافية وهو رئيسا للجامعة الملكية,1,1
انا معاكم تالموت,1,1
الله يستر وصافي راه حتى انا خايف من هادا الشي حيت ديما فمراكش كتكون الاستفزازات وتبدا المشاكل,-1,1
هذا القرار الصائب نتمنى من الجامعة ان تستجيب,1,0
من اجمل جزر العالم,1,0
تعادل اخر بشق الانفس واخر الدقائق مع فريق غير منافس سياسة الترقيع لن تنفع اسي خاريدو,-1,1
انتشر بسبب انتشار الجهل,-1,0
مكنهضرش معاه غير كيعجبني نبين للجاهل المدعي لشيء انه لايفقه شيء فيما يدعي,-1,1
أشد أنواع الجهل عندما يكون مغلف بغلاف ديني وهو مشوها له,-1,0
نتمنى ليك سنة سعيدة عامرة بالنجاح و الانجازات باذن الله ويكون مستقبلك مشرق,1,1
ان شاء الله سنة سعيدة وجميلة لكم وللجميع وربي يحفظكم,1,0
ربي يجعل عام الابداع والامتاع والبطولات المحلية والاقليمية والقارية للرجاء العالمي,1,0
شكرا للتوضيح اخي عادل لكن يبقى قانون غريب,1,0
معبرة وحق الله,1,1
الله الله قمة في الابداع تسلم الانامل اختي وشكرا بزاف على روحك الطيبة والاصيلة,1,0
ربي يبارك فيك ويسعدك ختي الكريمة,1,1
اللهم امين ختي ولك والجميع,1,1
عاجبك الحال,1,1
الحمد والشكر لك يارب على فضلك واحسانك اللهم تمم اللهم تمم,1,0
متهور جدا,-1,0
حسبي الله ونعم الوكيل ربي ينتقم وياخد الحق من لي كان السبب فهادا الشي,-1,1
الله يصلح الحال,1,1
حسبي الله ونعم الوكيل همهم غير الفلوس وومسوقينش لبنادم,-1,1
من البداية مارتحتش ليه الحاسة السادسة صدقات واقيلا,-1,1
اعلام ديال الزبل الى الزبل,-1,1
ربي يحفظك لي و مايحرمني منك,1,1
والشرف لهاد البلاد الكريمة يكون فيها شباب مخلصين بحالك ربي يرفع مقامك اكثر واكثر,1,1
اللهم اميييين ولك مثله واكثر يارب ربي يبارك فيك يارب ه المهم انك شاركتيني الفرحة وهذا شرف كبير ليا,1,1
شكرا بزاف ختي صراحة روعة كلامك لاتوصف ومتابعتك لنا شرف كبير وردك فعلا يدخل السرور والفرح على القلب,1,1
شكرا بزاف اخي نادر بارك الله فيك ويوفقك حتى نتا ويسعدك ويكبر بيك,1,1
جميلة و عظيمة بوجودك فيها يا جميل,1,0
نصيحة من اجمل مايكون ولهذا السبب الجميع يتبدلون في حياتي وانتي ثابتة فوق عرش قلبي انظر لك فقط ولا اكترث بمن يذهب او يأتي,1,0
كان عزيز على الناس بزاف شوفي الردود على تغريداته ونتي تعرفي,1,1
شكرا بزاف خويا وربي يبارك فيك ويسعدك,1,1
العفو تستحق كل الخير,1,0
اللهم امين ولك ولجميع المغاربة والمسلمين شكرا بزاف,1,0
ربي يسلمك اخي ويحفظك ويحفظ ليك ولدك وتشوفه ان شاء الله في اعلى المراتب وتفرح فيه ان شاء الله يختار الانسب له ويبدع فيه والا كاين اي مساعدة نقدر نقدمها انا على اتم الاستعداد,1,1
ربي يخليك هادا حفل تخرجي من ماليزيا,1,1
بارك الله فيك اخي رحيم الغالي ورفع من قدرك اكثر واكثر ياراقي شكرا الف الف الف شكر على تهنئتك الجميلة وربي يحميك وينجحك ويوصلك مرادك وطموحك و انت تستحق كل الخير لانك من ارقى الناس واكثرهم احتراما ولك في نفسي قدر وشان كبير شكر,1,0
