tweets,type,class_name
لا تغضب والديك لترضي الآخرين ف الآخرين لم يفنوا حياتهم من أجلك,1,0
ماننساش الصحراء حيت فيها دوزت أجمل أيام العطلة,1,1
دقيقة صمت حبايبي,1,1
لهجتها هي بصمتها حبيبتي,1,0
يوما ما ستصبح مجرد ذكرى لبعض الناس فافعل ما بوسعك لتكون ذكرى طيبة,1,0
رايكم بالبرنامج حتى الآن جماعة,0,0
الله على الصوت,1,0
اللهم لا تستدرجنا بالنعم ولا تقاجئنا بالنقم ولا تجعلنا عبرة للأمم وارفع عنا الألم والسقم وجد علينا بفضلك,1,0
ولو إني أملك قلب اخر لأحببت به صوتك,1,0
كانت مجرد صدفه وإنخلق لي من بعدها حياه,1,0
معنى الفخر,1,0
اللهم ارحم من ماتو بالدنيا ولم يموتو في قلوبنا واجمعنا بهم في جناتك,1,0
بكل أختصار كما بدأت ستنتهي,-1,0
عيدي مبارك يا عيد ألايام,1,0
الحمدلله الذي أتم علينا الشهر ونسأله القبول والعتق والعفو والمغفرة,1,0
فجر طويل اجمل تفاصيله عيونك,1,1
لؤ الحزام الناسف يدخل الجنه ماتركه اللذي ارسلك,-1,0
أشرس أعداء الإسلام,-1,0
مابعد حسنك كلام وماقبل وجهك غزل,1,0
اللهم اغسلني من الذنوب و طهرني من العيوب و امتحن قلبي بتقوى القلوب يا مجيب السائلين,1,0
ليت النوايا مثل ضحكاتهم سمحه,1,0
رب اجعل هذا البلد آمنا,1,0
اللهم إنك عفو كريم تحب العفو فاعف عنا,1,0
الله لو صار العمر كله عيونك,1,0
ثلاث ادعيه لاتنساها اللهم إني اسألك حسن الخاتمه اللهم ارزقني توبتة نصوحا قبل الموت اللهم يا مقلب القلوب ثبت قلبي على دينك,1,0
رسالة قصيرة لا تراقب حبيبا لم يعد لك,0,0
رمضان اكتبنا يالله من اصحاب اليمين الذين تقول لهم هذه الجنة التي كنتم بها توعدون فادخلوها سالمين,1,0
يغار من غيره و غيره مايسوى ثراه,1,0
اللهم ارزقنا حلو الحياة وخير العطاء وسعة الرزق وراحة البال ولباس العافية وحسن الخاتمة,1,0
ما يحس بقيمة الغالي الا فاقده,-1,0
لاتهجر قلبك اسقيه دائما بالقرآن,1,0
إذهب إلى الله بضعفك يأتيك بقوته اللهم ارزقني وارزق متابعيني الفردوس الاعلى,1,0
أقراها ثلاث وكأنك ختمت القرآن,0,0
اللهم إنا نسألك دعوة لا ترد ورزقا لا يعد وبابا إلى الجنة لا يسد,1,0
الا ياليت كل الهواء عطرك,1,0
ليت بعض المواقف مالها ذكرى,0,0
العمر والأحلام والغالين أشياء ما ترجع إذا راحت,-1,0
الصبر مهما طال له وقت محدود,0,0
القلوب الصادقة حظها قليل,-1,0
رسالة تختصر ألف شعور,1,0
اللهم ازقنا قلوب تتجلى بخشيتك و نعما تدوم بفضلك و أرواحا تهوى طاعتك و لسانا لا يمل من ذكرك,1,0
اي دين يقولك اذبح امك وابوك اعوذ بالله,-1,0
خيرت قلبي واختارك,1,0
فعلا,1,0
تذكر إنك قطعة مني لا مسك الضر مسني ضعفه,1,0
كل المشاعر هينه الا شعور الاحتياج,-1,0
اذا بانت البسمه على وجهك احس إني انا المسرور,1,0
انا من حزن حظي اذا احتجتك تغيب,-1,0
يا اجمل وجه مر بذاكرة عمري,1,0
السجادة التي نفترشهآ ل لقاء الله وطن لا يخذل ساكنيه,1,0
يا وجهك المملوح فيك النظر نعمه,1,0
سيد الاستغفار,1,0
اللهم اشف مرضانا ومرضى المسلمين وارحم موتانا وموتى المسلمين,1,0
اتشرف بالجميع,1,0
صوتك حياة و عمر ثاني,1,0
تشفي عليل النفس بسمة شفاها,1,0
اللهم لا تدع لنا ذنبا إلا غفرته و لا هما إلا فرجته و لاميتا إلارحمته و لا مريضا إلاشفيته و لا حاجة إلا قضيتها ياحي ياقيوم,1,0
عجز,-1,0
الذكريات التي لا تموت تميت,-1,0
أنا الدي يسعك صدره إذا ضاقت به الدنيا,1,0
اللهم انك عفو كريم تحب العفو فاعف عنا,1,0
اللهم ما ة ترد و لا,1,0
الله يرحم جميع اموات المسلمين,1,0
السكوت احيان وزنه من ذهب,1,0
اللهم ارحم من كانو يتشوقون لصوم رمضان وانتهى عمرهم قبل قدومه اللهم برد عليهم قبورهم وآنس وحشتهم,1,0
مرساك صدري لو تضيق المراسي قلبي عطاك الحب من غير منه,1,0
ألف مره قلت لك وجهك من أسباب المسره حتى صوتك أغنية,1,0
لم يعد بيننا وبين رمضان الا ايام معدودات اللهم بلغنا شهر التوبة والغفران لا فاقدين ولا مفقودين,1,0
ربي أوصيك ب أمي خيرا وعافيه وعمرا طويلا,1,0
أنا جاهل في العتاب أنا عتابي غياب,-1,0
واصدق التعبير نظرات العيون,1,0
الله ينزل لسماء الدنيا في الثلث الاخير من الليل اي هذا الوقت صادقه ل المرحوم اللي غدر فيه من قبل عماله الله يرحمه,0,0
جابك الله لي هدية من السماء,1,0
جرحوني يوم قالوا لو يحبك ما رحل,-1,0
للمحبة حدود وحبي لك سما,1,0
اوجعوك كنت لك سماء لكنك تعلقت بأرض السافلين,-1,0
بالتوفيق للي عندهم اختبارات,1,1
تشفي عليل النفس بسمة شفاها,1,0
خالق الزين ابدعك,1,0
لا يصفك كثر الكلام ولا يصفك كثر القصيد,1,1
ولغيرك القلب لا رحب ولا سلم,1,0
المعاملة بالمثل تغنيك عن الف عتاب,1,0
خالق الزين ابدعك,1,0
الا ياليل غيابه طالت ايامه علينا,-1,0
اللي يطيح برغبته صعب يرقى,-1,1
يشهد الله و الليالي و السنين ما وجد قلبي مثل قلبك أبد,1,0
اللهم ارحم موتانا وموتى المسلمين وتجاوز عنهم ونور قبورهم واجعل مسكنهم الجنة واجعلهم من أصحاب اليمين يارحمن يارحيم,1,0
ما يصفك كثر الكلام ولا يصفك كثر القصيد,1,0
انا ذاك البعيد اللي عطاك اصدق شعوره,1,1
أول محطات الفرح لقياك وأول علامات الجمال أنتي,1,0
العتب مرات من كبر المحبة,1,0
تغار منهم وأنت كلهم بعيوني,1,0
اعذريني في جمال عيونك ان طولت النظر,1,0
كل مالمحتك قلت يالذة المنظر,1,0
يا رب في هذه الجمعة اكتب لنا أياما مقبلة جميلة واسعدنا بتفاصيلها واغمرنا بخيرك الذي لا يفنى,1,0
كل الغياب أقواه إلا غيابك أنت,-1,0
شفت الهنا بكونك وامسيت بك مفتون,1,0
لايخدعك كثر القصيد أنا فارغ العاطفه,-1,0
ملامحك في خاطري ما تغيب,1,0
أشوفك للدروب المعتمة نور وملاذ وضي,1,0
لا تهمك شمسنا أنت الصباح,1,0
المعاملة بالمثل تغنيك عن الف عتاب,1,0
يا ناعم العود يا سيد الملاح,1,0
فرحتي قربك ولو حولي كثير,1,0
وأن غاب طيفه في قلبي مايغيب,1,0
نصيب الغير وانا اللي زارع وساقي,-1,0
إن الله يديم نعم الحامدين فالحمدلله كثيرا,1,0
يا ناعم العود يا سيد الملاح,1,0
اذا نامت عيونك اصير بليلي يتيم,-1,0
ليت لي حظ يشابه حظهم في لقاك,0,0
عيونك ليل وانا احب السهر فيها,1,0
يا لذة الليل الطويل,1,0
ما تركتك قلبك البارد جبرني,-1,0
لعل الله يجلب بعد هذا البعد قربا دائما,1,0
أحيانا نحتاج لمن يشعر بنا وليس لمن يسمعنا,0,0
رب الخير لا يأتي الا بخير,1,0
مهما حرصت واجتهدت في تدبير أمرك فإن حكمة الله نافذة وما يختاره لك فيه الخير,0,0
ما دام القادم في يد الله فالحمدلله كثيرا,1,0
إن الحب هدية من عند الله والهدايا لا ترد,1,0
تمسك بالأمل إلى آخر لحظة,1,0
عندما تكون مع الشخص المناسب لا تضطر لأن تجتهد لإسعاد نفسك وإسعاده الأمر يحدث بشكل عفوي,1,0
اللهم لا تحرمني وأنا أدعوك ولا تخيبني وأنا أرجوك,1,0
كل ما فكرت فيك ابتسمت,1,0
مادمت تشاهد بسمة أمك فالحياة لاتزال جميلة,1,0
كل شيء في الحياة سيكون أجمل,1,0
يعوضك الله و يعطيك الله و يغنيك الله و يجبر قلبك الله و لا يعلم ضعفك و حاجتك و قلة حيلتك إلا الله,1,0
ربي افتح لنا الخير في كل الأمور,1,0
كن بسيطا فإن البساطة بذاتها جمالا,1,0
كن جميلا في كل شيء صداقتك حبك أخلاقك تعاملك حتى في البعد كن جميلا,1,0
اكيد معك حق,1,0
اللهم أسعدنا في أبسط تفاصيل حياتنا وقرب لنا الخير حيث كان,1,0
الحمد لله حمدا كثيرا طيبا مباركا فيه,1,0
إن الله بك و بقلبك عليم رحيم فأطمئن,1,0
عظم الله اجركم,1,0
فاس مدينة زوينة ناقصها غير الأمن والله,1,0
روعة تبارك الله,1,0
مساء الورد و الحمد لله على سلامتك,1,0
الله يكرمك ويفتح لك أبواب الخير وأبواب الجنة يا رب,1,0
رأس مالي محبتكم وتشجيعاتكم أستاذي منكم أتعلم,1,0
تستاهل احسن منها,1,0
الحمد لله,1,0
شكرا هذا من طبعك الراقي والطيب,1,0
شكرا لجمال حضورك,1,0
فعلا صدقت الحمد لله,1,0
كلامك اروع واجمل,1,0
بدون كرامة الموت احسن,-1,0
و يسعدك ويحميك يا رب,1,0
تدوم افراحك يا رب,1,0
الصدق انتم عنوانه الف شكر,1,0
صباحكم ثقة في الله وتوفيق منه,1,0
الله يجمل حالك شكرا,1,0
الله كلام قمة في الروعة,1,0
فعلا كلام رائع,1,0
شكرا علي التوضيح والمهم الأخذ بالعبرة,1,0
الله يجزيك خير,1,0
صباح النور والسرور الله يسعد صباحك بكل خير,1,0
الله يغفر لها ويرحمها ويسكنها فسيح جناته,1,0
اختيار الالفاظ ضاعت للأسف,-1,0
اللهم إنا نسألك حبك وحب من يحبك وحب عمل يقربنا إلى حبك,1,0
يسعد مساك بكل خير,1,0
مرورك الأجمل,1,0
تمهل واحسن الاختيار,1,0
جمعة طيبه بذكر الله,1,0
ربما كتب الله لك نصيبا أفضل,1,0
بالصبر والتقوى يجعل الله العسر يسر,1,0
لعله خير,1,0
يعجبني أشخاص سلاحهم العقل وليس اللسان,1,0
الله يحفظكم جميعا,1,0
حتى تكون أسعد الناس إجعل الفرح شكرا لله,1,0
اللهم أحسن عاقبتنا في الأمور كلها,1,0
اللهم اشفها واشف مرضانا ومرضى المسلمين,1,0
الكبر أساس كل بلية ورأس كل مصيبة,-1,0
هناك من يسعدك ولو بكلمة,1,0
في صباح هذا اليوم أسأل الله أن يشملكم برحمته ويرزقكم ماتتمنون,1,0
اللهم اعنا علي ذكرك وشكرك وحسن عبادتك,1,0
أفرح بما لديك حتى يأتيك أكثر مما تتخيل,1,0
أسعد الله أوقاتكم بكل خير,1,0
فليكن قلبك طاهرا نقيا صافيا زكيا تنعم بحياتك كلها,1,0
تمضي الحياة و نمضي معها,0,0
إحرص على الأثر الطيب دوما,1,0
صباح النور والسرور,1,0
الله يرحمه ويغفر له ويسكنه فسيح جناته,1,0
تنقضي أيامنا دون أن نشعر,0,0
امثله بلادي صحيحه,1,0
سبحان الله على جمالها,1,0
عاصمة الجمال والإبداع فى المغرب,1,0
صفاء القلوب دليل على رقى الاخلاق,1,0
هي أكلة شعبية مشهورة,0,0
هذا هو جمال موسم الشتاء فى بلدى المغرب فيه تفيض الطبيعة بالخضرة وتكتسي بالبياض الساحر,1,0
باسمك يا الله نبدأ هذا اليوم فاعطنا خيره واكفنا شره يارب,1,0
شاطئ الواليديه شاطئ مميز والكثير من السياح يعرفونه بروعته ومكانته السياحية العظمى,1,0
صباح الخير عليكم,1,0
يكفى بريقه لتعرف الجمال فى المغرب,1,0
من اعرق مشاهد ومناظر بلادى,1,0
صباح الخير يومكم سعيد,1,0
الجمال لا يوصف,1,0
اطلالة رائعة,1,0
الله يحفظها لك,1,0
قال إن الله لا ينظر إلى جسامكم ولا إلى ولكن ينظر إلى لوبكم وأعمالكم,0,0
أجمل ليست أحلاها وإنما أكثرها جمال,1,0
جنوب المغرب جنه الله على الارض,1,0
تمنى الخير لغيرك يأتيك الخير من حيث لا تحتسب,1,0
رائعة,1,0
التحالف العربي والقوات اليمنية فخر الامم العربية,1,0
ايامنا الجميلة,1,0
اللهم آمنا في وأدم الأمن و في بلادنا وبلاد المسلمين يارب واحفظ مغربنا ومالكنا,1,0
جميل جدا,1,0
الصلاة نور فلا تتركها,1,0
المزيد من النجاح حبيبي,1,0
اللهم لك الحمد حمدا كثيرا طيبا مبارك فيه,1,0
جمال ورقى,1,0
أمم إفريقيا تحجز مكانها في النهائيات,0,0
افتتاح معرض الكتاب,0,0
اللهم اسعدني بقدر ما تألمت وأرحني بقدر ما تعبت اللهم لا تحرمني وانا أدعوك ولا تخيبني وأنا ارجوك,0,0
اللهم اغفر لكل امه محمد عليه افضل الصلاه والسلام,1,0
اللهم ردنى اليك رادا جميلا,1,0
البوم رائع,1,0
المدينة الاجمل ملكة البحيرات بتاجها الأخضر,1,0
رحم الله شهداء تعازينا للأشقاء في وإنا لله وإنا إليه راجعون,1,0
الجميله تتوفر على إرث ثقافي وفكري بارز يصفها سكانها بالمدينة الحصينة,1,0
ما أكرمهن إلا كريم وما أهانهن إلا لئيم,0,0
منتزه الرميلات الجميل,1,0
المذاق المغربي مختلف بكل المعاني وله جماله الخاص,1,0
صباح الخير عليكم يا اهل بلادى,1,0
فعلا,0,0
كل هذا من اجل مصلحتك فقط,1,0
الحبيب,1,0
ربي يحفظها,1,0
دمتم على خير,1,0
الطعام المغربي ليس له وصف,1,0
روعة و جمال الطراز المغربي يقطع الأنفاس ويسحر العقول الراقية,1,0
اكادير جمالها لا يتكرر ولا يقارن بأى جمال,1,0
صباح الجمال المغربي هذه الرائعة اسأل ألله منزل الأمطار لتروي الارض والقلوب,1,0
ما احلاه من اجمل ما خلق فى هذه الدنيا,1,0
حدائق المنارة من اجمل الاماكن السياحية في مراكش,1,0
اعشق بلدي,1,0
ما احلاها قديما وحديثا,1,0
مدينة هادئة,1,0
المغرب هى اصل الطراز والعراقه,1,0
دعوة الصباح ربي أكتب لنا يوما جميلا محاطا بالفرح والسرور والخير الدائم,1,0
المدينة الرقيقة الهادئة الجميلة,1,0
احلى مناظر ببلادى,1,0
سبحانك ما اعظمك يالله,1,0
الامارات دئما تحتضن الخير,1,0
ثق بالله فهو لا يخذل عباده,1,0
دامت ايامكم بالافراح والاعياد,1,0
تستحق الوصول لهذا,1,0
ما في اجمل من هذه الاجواء,1,0
يتميز بوجود صناعات يدوية بجودة عالية,1,0
كل عام وانتم بخير,1,0
وروعه جمالها,1,0
اللهم إني أحمدك حمدا كثيرا وأشكرك شكرا كثيرا يليق بجلال وجهك وعظيم سلطانك,1,0
اللهم إجعلنا ممن يقال لهم هذه الجنة التي كنتم بها توعدون,1,0
مصنوعة من نباتات طبيعية,0,0
سبحان اللي خلق الراحه والسعاده بابتسامتها,1,0
اللطافة في ابعد حدودها,1,0
لطافة لأبعد الحدود,1,0
اللون الأصفر يزيد من جمال الحياة,1,0
البحر اختصر كل معاني الجمال,1,0
اضيفو هذا الحساب مميز ورائع,1,0
صور توصف كل معاني الحب,1,0
وما اكثر الجمال في جوفك يا سماء,1,0
سبحان من خلق هذا الجمال,1,0
ثنائي لطيف,1,0
سبحان خالق الجمال ماشاءالله,1,0
امنح كل يوم الفرصة لأن يكون أجمل أيام حياتك,1,0
هذا الفديو مريح جدا,1,0
بعض الصحبة تأتي مثل طوق الورد على القلب,1,0
جلسة مشبعة بالجمال,1,0
براءة في وسط ماء نقاء في نقاء,1,0
وبعضهم فضل العزلة على ضجيج المنافقين,0,0
ليل وبحر وقمر أكتمل الجمال,1,0
وتجسدت الطبيعة في صورتها الكاملة,0,0
أكمل في الطريق الذي انشرح صدرك له,0,0
أنت تزهرين كل مكان تمرين به أنت جميلة جدا,1,0
البساطة هي قطعة من الجمال,1,0
سبحان خالق هذا الجمال,1,0
عندما يبدع الفنان,1,0
التفاصيل الصغيرة تجعل من المكان جميل,1,0
افضل منظر ممكن تشوفه اليوم,1,0
بعيدا عن صخب المدينة وجدت حياتها المبهجة,1,0
لحظة من خيال,0,0
ثم يأتي هدوء الليل ليثبت لك أن الضجه بداخلك وليست من حولك,0,0
فتبارك الله أحسن الخالقين,1,0
يا الله على الجمال,1,0
تتوسع كل المشاعر الجميلة حينما تنوي التركيز على ماتحب,1,0
فليس الحلم ماتراه في نومك انما الحلم ما يمنعك من النوم,0,0
احترموا عزلة البعض المؤقتة ورغبتهم بالإبتعاد عن الأخررين ولا تكثروا الظنون أو تصدروا الشكوك ف جميعنا نحتاج إلى خلوة صادقة مع النفس,0,0
شوق مبكر لليالي الشتاء الجميل,1,0
سيأتي دور أيامك الجميلة وأحلامك الحلوة,1,0
دائما الغيوم واشكالها تشعرنا بروح الجمال,1,0
حب طمأنينة,1,0
أحب هذا النوع من البيوت التي تمتلك نوافذ كبيرة,1,0
كانت الأخت والصديقة والجانب المشرق من الحياة,1,0
شخص آخر,0,0
لو كانت هذة اللوحة امامك ماذا كنت ستكتب,0,0
لا تندم على الماضي تعلم منه وتجاوزه,1,0
أجمل سواد ممكن تشوفه بحياتك,1,0
الاطفال حياة اخرى تعيشها في حياتك,0,0
لاشيء يستحق أن ترهق نفسك لأجله,0,0
ألطف صداقة بين طفله يابانية وكلبها,1,0
اللون الأصفر يزيد من جمال الحياة,1,0
البحر بعد تساقط الثلج,0,0
إن هذه الأيام تتطلب الكثير من الصبر والصمت والتجاهل,0,0
مصور الصورة يقول هذه الصورة جمعت كل شيء جميل,1,0
الأم هي الرحمة التي وهبها الله لنا,1,0
فتبارك الله أحسن الخالقين,1,0
عندما لا يكون في هذا العالم أحد يسمع صوت قلبك راقب النجوم ليهدأ,0,0
قرية في الصين هجرها الناس فاستوطنتها الطبيعة,0,0
يوما ما سأقول لم يكن الامر سهلا ولكنني فعلتها,1,0
رسومات جميله رغم بساطتها,1,0
ماذا تريد أن تكتب,0,0
صور لأطفال يعتقدون بأنهم نجحوا في الإختباء جميلة برائتهم,1,0
العمر مجرد رقم لكن الحياة للجميع,0,0
أعرف جيدا معنى أن يحتضن الإنسان نفسه بنفسه ويردد أنا بخير,1,0
متحف الفضاء والجمال الذي لا ينتهي,1,0
وقلبك موطن الأزهار وأنا اللي يعشق الأزهار,1,0
خلف كل نافذة مضيئة في وقت متأخر من الليل قصة,0,0
ولكنك لا تعلم كيف أبدو من الداخل,0,0
جمال السماء و كأنه لوح مرسومة سبحان من أودع الجمال في كل شيء,1,0
قد يكون اختلافك هو سبب تميزك وجمالك,1,0
رسومات إبداعية نابضة بالحياة,1,0
صباح الخير,1,0
جميل جدا,1,0
على سلامتكم,1,1
السعادة قرار لا تنسى ان تتخذه كل صباح,1,0
صباح الطبيعة والجمال,1,0
انها فطرة الإنسان,0,0
مساء الحب والطيبة,1,0
اسعد الله صباحكم,1,0
عليك ان تتقبل حقيقة استمرارية الحياة نحو الامام,0,0
أحيانا نتمنى لو نرجع لطفولتنا مرة أخرى,0,0
أرح سمعك مع هذه التلاوة العطرة,1,0
عش كما تحب أن تعيش لا تجعل الآخرين يتولون مهمة حياتك عنك,0,0
مساء الخير أصدقائي,1,0
شاركوني فرحتي وشكرا لكم من أعماق قلبي,1,0
افضل برنامج,1,0
صباح مشرق بنور الله,1,0
اعرف قيمة نفسك وارضى بشخصيتك,0,0
اللهم إجعل لنا مع نسمات هذا الصباح رزقا وسعادة وعافية,1,0
صباحكم خير وسعادة,1,0
جمال الأقدار,1,0
امنح كل الحب لنفسك,1,0
و الله حرام و الله قتلوه ظلما,-1,0
الله لن يغفر لكم يا ظلمة,-1,0
الله لا يسامحكم,-1,0
أنتم لا تخافو الله بأفعالكم هذه,-1,0
الله اكبر على كل ظالم,-1,0
حسبنا الله و نعم الوكيل,-1,0
الك يوم يا ظالم,-1,0
ذبحتونا,-1,0
الله ينتقم منهم اجمعين,-1,0
الفاسدين يتنعمون باموالنا فهل اصبح فاسدا لأعيش,-1,0
الله يكون في عون الفقير و الطبقه المتوسط سوف تنحدر اكثر و اكثر,-1,0
اللهم انا نشكو اليك ضعف قوتنا و قلة حيلتنا حسبنا الله و نعم الوكيل,-1,0
حسبنا الله و نعم الوكيل,-1,0
انا لله و انا اليه راجعون قتلوه ظلما,-1,0
يجب على الحكومة الجاهلة العودة بالتوقيت الى الساعة الثالثة,-1,0
اطالب برحيل هذه الحكومة,-1,0
الطبقة الوسطى في طريقها الى الانقراض للأسف,-1,0
شعب لا يحركه هذا الظلم و التعدي على كرامته هو شعب لا يستحق الحياة,-1,0
الله يرفعهم الى جهنم جنب القذافي بأسرع وقت لان الظلم زاد عن حده,-1,0
الله على الظالمين,-1,0
مسخره,-1,0
كله على رأس المواطن ما يثير السخرية رفع اسعار المشتقات النفطية المستخدمة في الصناعة,-1,0
حسبنا الله و نعم الوكيل فيكم,-1,0
اللهم خذهم اخد عزيز مقتدر فانهم لا يرحموا الضعفاء اللهم سلط عليهم عذابك فانهم ارونا الويلات,-1,0
اللهم ارنا فيهم عجيب صنعك فانهم اذلو الشعوب,-1,0
الله لا يخلف عليهم و لا يكثر خيرهم شعب مسكين و رفع الاسعار,-1,0
حسبنا الله و نعم الوكيل في اناس همهم تجويع الشعب,-1,0
بلد يديرها اغبياء و حراميه,-1,0
هموم المصاريف قتلت الصغير قبل الكبير الله ياخذ حقنا منكم و لا يباركلكم,-1,0
ارحمونا حرام عليكم,-1,0
رايحين يدمروا البلد الله ينتقم منهم,-1,0
الله لا يوفق الي كان السبب و الله حرام,-1,0
