tweets,type,class_name
ماهي آرائكم متتبعي الكرام,0,0
عبقرية المدرب وروعة اللاعبين,1,0
أمة عربية واحدة خالدة,1,0
عاد إليكم من جديد وأخيرا درت جيم لهاد الصفحة,0,1
الله يخلف عليك سيدي محمد,1,1
أشارك في تمام الساعة في نشرة أخبار الجزيرة لمناقشة التوتر السعودي المغربي وسحب الرباط سفيرها من الرياض,0,0
هجومك يا أخي على حسن طارق تبرهيش و قلة عقل ودليل انعدام غرام ديال المنطق,-1,1
أمين عام حزب سياسي كينشر تدوينة وكيدير ليها جيم,0,1
أجي بعدا فين غبرات واحد الحمى القلاعية شفت ما بقات هضرة عليها,0,1
إغلاق ثلاث بيوت لأعضاء الجماعة في القنيطرة والدار البيضاء وأكادير,0,0
الشعب الياباني الشقيق بعد الإسلام,0,0
أنفلوانزا الخنازير مسؤول عليها وزير الصحة والحكومة والدولة ياك والحمى القلاعية واش نقدرو نقولو أن هو اللي مسؤول عليها,0,1
الدولة تعلن أن الوضع تحت السيطرة,0,0
واحد السؤال وما تديروهاش مني قلة الصواب واش بنكيران هو اللي زاد في ضريبة السيارات,0,1
شكرا يوسف سفري بوعميرة وبنحليب ديما راجا,1,1
الجالية الإماراتية المقيمة في المغرب قلوبنا معكم و لن نترككم ويمكنكم في الهزائم أن تراهنوا علينا وكفى,1,0
متى تعلن الدولة انتصارها على المجتمع من خلال حربها المفتوحة على أبنائه والذين من بينهم اعتقلته غربته بعيدا عن أهله جردته من ثيابه بطريقة مهينة أدانته ب سجنا نافذة واليوم تخفي عنه جلطة دماغية تهدده بالشلل,-1,0
الدولة اللي تعاقدات مع رحال باش توكل السجناء واش ما تقدرش تتعاقد مع الشيخ زايد باش تداويهم,0,1
أنفلوانزا الخنازير تقتل سيدة حاملا في المغرب وزارة الصحة قالت قبل الوفاة إن الوضعية الوبائية للإنفلونزا لا تدعو إلى القلق,0,0
من يكون هذا السمسار الذي أقنع أفضل لاعبي منتخب المغرب بالهرب من دوريات أوروبا للعب في دوريات الخليج,0,0
الله على أخلاقك يا فخر العرب,1,0
انقلاب فاشل في فينزويلا رئيس البرلمان ينصب نفسه رئيسا الجيش يرفض الانقلاب أمريكا وكولومبيا والبرازيل تعترف بالمنقلب رئيسا والاتحاد الأوروبي يدعو للتهدئة ولانتخابات حرة هذا الغرب الامبريالي وضيع جدا,-1,0
بنكيران كان من دعاة الملكية البرلمانية بعد ان منحه الملك تقاعدا استثنائيا أصبح من دعاة الملكية التنفيذية,0,0
بمناسبة هل تغير المغرب إلى الأحسن أم الأسوإ في رأيي أنه جاب دورة على راسو ورجع لبلاصتو ديال,0,1
ليرتفع منك المعنى لا الصوت فإن مايجعل الزهر ينبت ويتفتح هو المطر لا الرعد,0,0
جاء إضراب الحوانت في الرباط وسلا وجاب معاه الشتاء يا سلام الرواح غادي يمشي,0,1
الله يخلي لنيا العونيات,1,1
الحكومة تتوقف عن تطبيق تعديلات مدونة الضرائب خوفا من توسع احتجاجات التجار,0,0
اول مداخل هذا التغيير الذي سيدعمه كثيرةن هو الصراحة والوضوح للأسف إنها تغرق في الغموض,-1,0
حدراف لاعب كبير وغادي يبقى كبير وبلاصتو كاينة في الرجاء وفي المنتخب دار خطأ آه ولكنه لاعب أكثر من رائع,1,1
مبروك للوداد والوداديين ديما راجا,1,1
بلاغ مشترك من مجموعات ألتراس الرجاء والوداد بمقاطعة مباراة الديربي احتجاجا على إغلاق مركب محمد الخامس,-1,0
أشياء كثيرة تمنيت حصولها في ولم تتحقق أبرزها أن تستعيد دولتنا عقلها وأن توقف حربها ضد المجتمع وممثليه صحافة سياسيين مناضلين وأن يؤسس عبد الإله بنكيران تجربة سياسية جديدة,0,0
جمهور الكرة رجل السنة في المغرب,1,0
جميل جدا السي يونس,1,1
مسيرات تعم فرنسا و ارتقى فيها شهداء والحكومة تعطل عددا من المؤسسات بالبلاد,0,0
الإسلام الذي حرصت مدرسة الحركة الإسلامية على تعليمه للملتحقين بها قسم التراث إلى شقين وحي و تاريخ فالوحي سرمدي والتاريخ تجربة خاصة لمجتمع معين ولفرد من هذا المجتمع لا تلزم أحدا واعتبرت مدرسة الحركة,0,0
شدوه في الحبس يتربى تعلم فنون الحرب وقتل واحد في فيديو كليب شافو نص مليون إنسان في ساعات واربي هانت تشوف زهرنا كيداير,0,1
التعليق ديال العثماني زايدو واحد الشاب ماشي أصلي ولكن جا معاه,0,1
قراران لمجلس الشيوخ الأمريكي هذه الليلة إدانة ولي العهد محمد بن سلمان واعتباره مسؤولا عن جريمة وقف الدعم الامريكي للسعودية في حرب اليمن,-1,0
من اجمل ما سمعته في الملاعب العربية والعالمية نبض الشعوب تحية لأهلنا في المغرب,1,0
هادي آخر كلمة عندي نكتبها من قلبي والدمعة في عيني,-1,0
هل وصفت أحزاب الأغلبية الحكومية الفرنسية المستقلة عن تحكم الدولة المتظاهرين بالانفصال,0,0
المغرب مع المدرب الفرنسي رونار أفضل من البرازيل في الكرة واي لقاء بيناتهم غادي نربحو البرازيل بواحد لصفر,1,1
رحمها الله ورزقكم الصبر واسكنها الفردوس الاعلى من الجنة,1,0
طبعا بسبب التهرب الضريبي,0,0
يا راجل اتق الله عيب عيب,-1,0
اذكرهم لنا حتى نبحث عن قضاياهم وقصصهم,0,0
شي نقابيين عوض يتحملو المسؤولية ويروينا حنة يديهم بداو يتهموا التلاميذ بالانخراط في مؤامرة كونية ضد عيش وماتحضيش,-1,1
حنا فاش كنا تلاميذ كنا كنديرو احتجاجات بعقلها وكنا عارفين معى التظاهر وعارفين أشنو الرسائل اللي بغينا نوصلو هاد الدراري ديال دابا زايغين وصافي وماعندهمش الوعي اللازم لخوض معركة نضالية,-1,1
عاجل اضطراب حركة الترامواي بين الرباط وسلا بسبب مسيرات التلاميذ,0,1
تلاميذ المغرب يواصلون الاحتجاج على على أمل أن تعلق بنصف كلمة تتفهم مطالب مستقبل المغرب,0,0
سبحان الله,0,0
علاش جمهور الوداد كاعي على تهراس بعض الكراسي في طنجة وساكت على تهراس بعض الكراسي في فاس,0,1
لا تكسر قلب يتيم حتى لا يكسر الله قلبك,0,0
هادو كيبينو انهم ماشي غير كيشجعو فرقة دالكورة هادو ناس يترفع ليهم الشابو,1,1
الشعب مقهور والتعليم رجع اللور,-1,1
من نتائج انتصار العثماني إعلاميا على الدارجة حسمه دعم كل برلمان البيجيدي حتى قبل انعقاده,0,0
دانون سونطرال بدأت تواصلها مع المغاربة بنعتهم الخونة وأنهته بنقص دريال والنشطاء يشيدون بحكمة الشركة,-1,1
خويا غير سجلت ملاحظة بروح رياضية وصافي,0,1
عيد مبارك سعيد وكل عام وأنتم بخير تقبل الله منكم ورزقا سعادة وفرحا وحبورا,1,0
قلب الأم باختصار الله يسمح لينا من الوالدين,1,0
كانوا الناس باغيين روسيا تتأهل هي مابقات كورة,0,1
مخابرات فرنسا وألمانيا والجزائر تكشف انقلابا إماراتيا في تونس بتعاون مع وزير الداخلية المقال,0,0
حمدو الله وشكروه الوقفة كانت في الليل اما كون الداودي فطر المغاربة فطر المغاربة قبل العصر,1,1
مصاصو الدماء أنا الاسبوع الفائت ديت لمرا لطبيبة خمسة دقايق ب المنكر بعينه,-1,1
أنا نفس الشيء أصبحت اليوم لم تعمل عندي أي قناة بين سبورت لا مفتوحة ولا إخبارية لكن مسحت كل شيء ودخلت تردد جديد ودخلت,0,1
أنتم نهايتكم ستكون مأساوية أكيد لأنكم بايعتم مدينة رسول الله مقابل أن يحكمكم ديكتاتوري وسجنتم عدد كبير من العلماء وقتلتم الصحفيين والان فتحتم السعودية للمغنيين والراقصات,-1,0
وأنت أيها السعودي البغل الحمير إدفعوا لترامب مقابل حمايتكم لم تقدروا على حمايتكم من قبل مجموعة من المليشيات الحوثية واستعينتم بالتحالف لقتل الأطفال اليمنيين,-1,0
ثانيا البربر أمازيغي أشرف من دبابكم ونحن لانطالب أحد أن يحمينا كما فعلتم أنتم عند ما باعتم كل جزركم مقابل الحماية,-1,0
أخي معتز نريد منك أن تسلط الضوء على معاناة,0,0
الإيرانيون يقولون لكم الحمد لله على نعمة جزيرة أبو موسى,0,0
لاحول ولا قوة إلابالله العلي العظيم اللهم أرحمها رحمة واسعة ونسأل الله أن يأخد الحق في كل هؤلاء المجرمين,-1,0
ربما العلمي هو من أعطى لك الأمر,0,0
إقرأ مادا قال عنكم كوهين هده حقيقتكم,0,0
أتمنى من كل قلبي أن يضربكم زلزل مدمر إن شاء الله,-1,0
المغاربة في هده الأيام,0,0
ثلاثة أسابيع كافية ليخرج الرئيس ويتحدث عن عدد من الإجراءات لحركة الاحتجاج أما نخن في المغرب عدد السينيين ونحن نحتج ولم يسمعنا أحد زيادة على عدد كبير من الزيادات الصاروخية في الأسعار,-1,0
شوف ليك وحدة ودير حتى نتا شي دويرة فباريس,0,1
إذا كان لديك مثل هذا الخائن الكبير في البلد ماعليك إلا أن ترحل,-1,0
هالعار اسعادة رئيس إلى ماهضر معه إفتحنا الحدود غير شي يومين,0,1
وقفت اليوم في سطوب مع المغرب وقالي بوليسي شعل الضو قلت ليه لا قالي علاش قلت لو العثماني قاليك حفضو على الطاقة رد عليا بوليسي قالي العثماني حمق,0,1
أجدادنا حررو الصحراء من الاستعمار وأشباه الرجال والمغنيين بغاو إحرروها بالشطيح والأغاني,-1,1
شكرا لك على مساعدتي في الوصول إلى متابعا من تظن أيضا أنه ينبغي له متابعتي,1,0
ربما العثماني لم يرشيء,0,0
قالك دابا طلقو شي فضاء كيراقب تحركات البوليساريو في الداخل والخارج,0,1
الشمايت د الحكومة,-1,1
أنثم من أثر عليكم حليب البعير ياصهاينة العرب,-1,0
والله أنتم عالم تضحكون على أنفسكم,-1,1
العالم لديه حجة على نضامكم القمعي لولا أبو ايفانكا الدي يبتزكم بتصريحاته ولعلمك أنا لست ضد الشعب السعودي ولكن ضد سياسات المسؤولين المتهورة,-1,0
قناتكم معروفة ورئيسكم باعكم لأمريكان مقابل الحكم وعلمائكم في السجون,-1,0
قناة العربية تستحمر الشعوب,-1,0
بقيتي فيا السي جمال على نتائج الملكي,0,1
ناقصكم غير يتيم,0,1
المغاربة يريدون فتح تحقيق في الحادثة ومحاسبة كل المتورطين,0,1
لعنة الله على الخسيس المجرم,-1,0
هكدا يتكلم أشباه الوزراء في المغرب,-1,0
قنوات العار والفساد المغربية,-1,0
العصابات الديكتاتورية,-1,0
قالت تبا للبحر هو المسؤول عن شبابنا,0,0
نتمنى السي رئيس حكومتكم إسقاط حكومتكم في أقرب الاجال وتقبلو مروري وشكرا,-1,0
الغرب كان يقتل المسلمين مباشرة واليوم يستخدم أشباه المسلمين لقتل ماتبقى من امسلمين,-1,0
مسلسل جديد من الصراع والتصريحات النارية بين ءال عيوش وءال الحدوشي وجماعته,1,0
حسبنا الله ونعم الوكيل في كل طاغية,-1,0
ساعة لله,0,1
المخزن والتراكتور وجهان لعملة واحدة,-1,1
فقط في المغرب,0,0
وزارة الأوقاف في المغرب تشبه ماتفعلها نضيرتها السعودية كل من يقول كلمة الحق إلا واجهوه بالإيقاف أو السجن,-1,0
القضاء الفرنسي شبيه بقضاء دول العربية ةلديكتاتورية,-1,0
صباح الخير من تمزيرت,1,0
شكون غايخدم معكم المراسلين من المغرب حيت كلشي غايشدوه لتجنيد الإخباري عفوا الإجباري,0,1
هل السعودية دولة متى تم التصويت على دستورها أين مؤسساتها المنتخبة السعودية ليست دولة ولا ينطبق عليها مفهوم الدولة هي مجرد قبيلة وينطبق عليها مفهوم القبيلة اكثر من مفهوم الدولة كما تم التأصيل لها في الفلسفة السياسية وكما هو متواضع عليه في العلوم السياسية,-1,0
مرض التفكير ليس له علاج حتى ولو استطعت أن تنام ستحلم بما تفكر به,-1,0
كان يغرر بالمغرر بهم ورفع شعارات محاربة الريع ومارس دغمجة على الجميع بعبارات التماسيح والعفاريت لكنه هو الريع في أبهى تجلياته,-1,0
أحييكم عاليا والله إلا انتم اشخاص تضحون بوقتكم وجهودكم وكل ما تملكون لنشر البسمة على وجوه أبناء هذا الوطن,1,0
تحياتي العالية لكم جميعا,1,0
للمرة العاشرة أشعر باهانة شديدة حين اقرأ كانط وهيجل إذ احتار بين كوني غبيا أو جاهلا,-1,0
أنا البطل الذي يموت في الصفحة الأولي كلاوديو بوتساني,0,0
في نظري تصرفه غير لائق تماما,-1,0
لابأس أكيد ستمر كسابقاتها أكيد ستمر,0,0
هذه ليلة من تلك الليالي التي لم انم فيها من فرط التفكير,0,0
التعادل فهاد الظروف وفالكامبنو راه فوز عريض,1,0
أودي راه كنشجع مدريد,0,1
تعادل بطعم الإنتصار,1,0
الله ارحمو ووسع عليه,1,1
العلاقة جدلية لو لم يكن الجهل لما كان الاستبداد ولو لم يكن الاستبداد ماكان الجهل بقدر ماتصنع الشعوب اصنامها بقدر ماتساهم هذه الأصنام في ترسيخ التبعية والجهل,-1,0
المهم هو الروح الرياضية سواء فازت ريال مدريد أو انهزمت برشلونة,0,0
أنا لا أعطي أهمية كبيرة لذلك الشيء الذي يسمى الأكل,0,0
أنا في الحقيقة كنت احاول أن اشرح لها الفكرة ببساطة ولا أقصد الانتقاص من حجم الفلسفة طبعا من الصعب أن تشرح نظرة سيوران للحياة والوجود وغياب المعنى وعبثية الحياة الأمر يحتاج للكثير,0,0
سيوران راه مريض شوية أصلا كان يفوز بجوائز كبيرة في الأدب وفي الفلسفة ولا يذهب لتسلمها,-1,1
يقول سيوران أنا أستقيل من الانسانية لم أعد أريد أن أكون ولم أعد قادرا على أن أكون انسانا أنا إنسان يزعجه كل شيء أريد عدم الازعاج عدم الاهتمام بي أجهد كي أجعل الآخرين لا يعيرونني أي إنتباه,0,0
من ضمن الكتب التي قرأتها لايمكنني تحديد كتاب بعينه كلها كان لها تأثير علي حتى الكتب الرديئة منها علمتني كيف يكتب السيئون,0,0
الكتاب دائما إذا قرأت ولو صفحة واحدة فهذا أفضل من لاشيء,1,0
الله اعطيك الصحة اخويا زهير,1,1
هناك فرق كبير بين أن تمتلك فكرا وأن يمتلكك فكر,0,0
حتى هما زوينين,1,1
اولئك الذين يحبون الشاي مثلي يمكننا الاعتماد عليهم,0,0
تم تعطيل الكومبيوتر الياباني بهاكرز ثلاثي قطري حقيقة من الصعب توقع فوز قطر باللقب,0,0
عجيب هدش,0,1
ارجو له الشفاء العاجل يارب,1,0
ومفهمتهاش واش مبقيناش من دول عدم الانحياز,0,1
المهم ليس الحفظ بالنسبة لي ولا أريد متعلما يحفظ المعلومات ليقوم بارجاعها لي يوم الامتحان أريد من يفهم الإشكالية الفلسفية ولديه قدرات على التحليل العقلاني والنقد البناء ولابأس إن كان مشاغبا,0,0
والجانب المشرق سيكون لدي تلاميذ عباقرة,1,0
شكرا ارجو لك كل التوفيق أيضا,1,0
شكرا لك على كل شيء,1,0
ستكتمل إن شاء الله بفضلكم ونحن بدورنا نقوم بمجهودتنا,1,0
شكرا لهلة اخطيك,1,1
وقد بلغنا الأمانة إلى مكانها الثانوية التأهيلية الجديدة ارفود شكرا لكم جميعا,1,0
وقد وصلت إلى مكانها وشكرا لكم جميعا,1,0
هذا الصباح توصلنا من السيد مشكور جدا على مجهوداته الخاصة شخص رفقة مجموعة من الاشخاص عرفناهم هنا معروفون بنكران الذات تحية لهم جميعا وغبرهم شكرا للجميع لكل من ساهم في انجاح هذه الفكرة المشروع شكرا وشكرا وصولا للتقدير والاحترام,1,0
أنا مسؤول عما أكتب وانت مسؤول عما تفهم ولست مسؤولا عما تشم خصوصا إذا كنت تقرأ بأنفك,0,0
الحفظ يركز على جانب واحد وقدرة واحدة من قدرات الدماغ وهو اثارة الذاكرة وتخزين الكلام فيها وهو الغاء للتحليل والفهم والتدبر والاستدلال وهي قدرات أساسية أيضا فعل الحفظ مفصول عن الفهم ومفصول عن فعل القراءة مع احترامي للجميع طبعا أنا قلت وجهة نظر والفكرة تناقش والرأي يحترم,0,0
صباح الورد لأطيب ناس,1,0
لنحاول المساعدة على تدفئة أطفال صغار يواجهون قساوة الطقس والمناخ باجسادهم الضعيفة,1,0
وهذا لا يسمى مجتمع مدني ولا يستحق ان يسمى مجتمع مدني المشكل هو غياب ثقافة العمل الجمعوي والمجتمع المدني,-1,0
المعروف أن المجتمع المدني هو من يراقب السلطة السياسية داخل جميع المجتمعات لكن في المجتمع المغربي المجتمع المدني تابع للسلطة السياسية وعليه فهو عوض أن يكون وسيلة مراقبة وحماية للمواطن ضد استبداد الحكومة والسلطة اصبح يساهم في اخضاع المواطن,0,0
أن تكذب لصالح نفسك فهذا مستحيل وأن تكذب لصالح الغير فهذا تدليس وأن تكذب قصد إلحاق الأذى بالغير فهذا افتراء وهذا هو اسوء أنواع الكذب جون جاك روسو من كتاب تاريخ الكذب جاك دريدا ص,0,0
المشكلة كأس آسيا وقالك حتى هو ممنقولش مجانا عشنا وشفنا الهند ضد قرغيزسستان حصريا,0,1
تزوح إن كانت زوجتك جيدة أصبحت سعيدا وإن كانت زوجتك سيئة اصبحت فيلسوفا سقراط,0,0
كل عام وانتما بألف خير,1,0
أنا شخص سيء الحظ وأنت أسوأ مني على ما أعتقد,-1,0
فعلا لكن مستواه أكبر من ان بفهمه التلاميذ يمكن فرضه في الجامعة,0,0
توصلنا في هذه اللحظة بمجموعة من الكتب المهمة من طرف السيد مشكور على مساعدته ومساهمته وعبره الشكر موصول للجميع ولكل تويتوما شكرا لكم وصولا للتقدير و الإحترام,1,0
مودتي لكم جميعا وشكرا استاذ ياسر معرفتكم شرف,1,0
راه تأخرنا حتى جمع كلشي فمرة ورسلهم,0,1
الله ايجازيك بالخير السي عادل ولو انك كتقولي منشكركش لكن معندي مندير,1,1
صباح الورد عليكم في هذه اللحظة في هذا الصباح توصلت الثانوية بمجموعة من الكتب التي تم جمعها على مستوى الدار البيضاء والنواحي فشكرا للصديق وعبره شكرا لكل ما ساهم في هذه المكتبة,1,0
شكرا لكم,1,0
عفوا مرحبا,1,0
مساء الورد مدخل نقدي تأسيسي,1,0
لا تصدق كل ماتقوله الحكومة,0,0
الله اسخر السي عادل,1,1
إن أبلغ درس يتعلمه الإنسان من الحياة هو أنه ليس هناك ألم لايستطيع المرء أن يتخلص منه بعد فترة معقولة من الزمن أو أن يصادقه ويتعايش معه أو يحيله الي أنس وسعادة بشيء من سعة الأفق وعمق البصيرة والنظرة الشاملة للحياة التي تري كل مافيها من جوانب طاغور,0,0
انتحر لأنه تعب من الحياة فقالت له لو كنت تقدرني ما انتحرت أحيانا نسيء لمن نحب بإيذاء أنفسنا,0,0
الله أحسن لعوان كنقدر الظرفية مهم راه قرارك صحيح,1,1
شكرا جزيلا لك اكيد سيعجبونهم وسيساهمون في اغناء المكتبة وستعم الفائدة كل من مر بالثانوية,1,0
كل عام وانت سعيد وجميل باختلافك,1,0
ارجو لك كل السعادة والحب والسلام,1,0
ارجو لك كلها سعادة وبتحقيق كل النجاحات,1,0
انت استاذة في الإنسانية كل شخص استاذ في شيء ما هذه الصفة ليست مرتبطة بمجال معين,0,0
ستكون بخير ارجو لها الشفاء العاجل,1,0
سنة سعيدة لك استاذتي أيضأ,1,0
كل عام وانت بخير وسعادة دائمة,1,0
شكرا جزيلا لك نحن سعداء بدعمكم,1,0
عندما ننصت جيدا نكتشف جمال الطبيعة و إبداعها,1,0
ارجو لك الشفاء العاجل يارب,1,0
بالتوفيق لك,1,0
وانا اعتذر بدوري كل التقدير,1,0
اذا مر يناير والليفر في الصدارة معناه اللقب قريب من اللقب,-1,0
الفيديو صحيح للأسف,-1,0
أنت من جئت لصفحتي لتناقشني وبعد ذلك تقول لا أستطيع أن أناقش أنت تعيش تناقض ذهني,-1,0
لا يجب السكوت عن كل ذلك لكن ما حدث عظيم,1,0
من يقول ذلك الكلام فهو يحاول تبرير العنف والإرهاب والعنف والإرهاب لا يمكن تبريره,-1,0
لا شيء قابل للفهم مع مثل اولئك,-1,0
انصرنا يامولانا,1,0
إذا كان الفيديو صحيح فهو أكبر من عمل ارهابي,-1,0
