tweets,type
اتركوهم ينبحون فنحن نعيش في صحراءنا و نعيش من خيراتها لا يهمنا عويئهم,0
كانت تالفة ليك,0
لواه لواه ماكاينش معامن ا ختي,0
لا يشوه سمعتك إلا من تمنى أن يكون مثلك وفشل,-1
يكفى بريقه لتعرف الجمال فى المغرب,1
صلوات ربي وسلامه عليه وعلى آله وصحبه أجمعين,1
آخر ما كاين في السوق الزواج عبر الخاص عش رجبا ترى عجبا من ورا هادشي كامل اللي بغاني نشهد له زرقلاف,0
تماما لا يستطيع المرء ان يتحكم فيه,0
ماتبقاوش تسولوني بزاف اسئلة ما عندها معنى,-1
يا ربي ياربي يلاقيني ببنت الآصل واللي مكتبها لي يا ربي وشكون هادي اللي فبالك بغيتي تفرحيني بيها,1
واخا معرفش شحال عندك في عمر غا نقول ليك شرفتي المهم كانضحك معاك,1
بنسالم حميش يمسح مساحيق العولمة ويضع أعطابها أمام المرآة,0
عندما يمتلء القلب بالحب لا فرق بين الحضر او عدمه فمن يعشق الروح لا تهمه الجزئيات,0
القناة القطرية التى تبث السموم بأكاذيبها في المنطقة العربية,-1
مصرع شخصا في تحطم طائرة إثيوبية,-1
موسيقى رقصة الأطلس عنوان للإبداع المغربي,1
امين جعل الله دعاؤك في ميزان حسناتك,1
لو أرادك الله صلبا لخلقك صخرة ولكن لين الطين فيك كان مقصودا,1
حب الله و الوالدين,1
نقضي اليوم بكامله في العمل يصيبنا الصداع و الظغط و الثوتر و في اخر الشهر نقبض أجرا و نعالج به ما أصابنا,-1
الطيبة ليست غباء بل حسن تربية,1
السلام عليكم ورحمة الله وبركاته حسب بلاغ لوزارة الأوقاف والشؤون الإسلامية المغربية فإن فاتح رمضان هو يوم غد الخميس ان شاء الله وفقنا الله جميعا لطاعته,1
مرحبا,1
فيها يكمن الجمال يخليلي الجمال انا,1
صدقت و الله,1
صلوات ربي و سلامه عليه,0
يا ذا الجلال والإكرام,0
بنعطيه اساسي,0
اجزم انهن دائما على صواب و انا من هذا المنبر أضم صوتي لصوتهن,1
امين يارب و للجميع,0
السي أنس هذا ما نريد تجاوزه أن نكون مغاربة فقط أن نعترف باختلافنا وأن يحترم كل منا خصوصية الأخر وأن يحل الوطن محل العرق أو او الأمازيغي على راسنا والعربي على راسنا في إطار أننا نشكل شعب واحد,0
جمال الأقدار,1
الحمد لله على نعمة الإسلام الرسول صلى الله عليه وسلم بين لنا علامات الساعة الصغرى و الكبرى,1
أنا دائما مع التفكير و التريث و عدم التسرع,1
جزيل الشكر غاليتي,1
مديرية الأمن قتيلة و جريحا في حادث إطلاق نار بمدينة كلميم,-1
هرسو وخربو وشعلوا لعوافي,-1
صلوات ربي و سلامه عليه,1
الله يسلمك,1
تبارك الرحمن منظر جميل جدا ماشاء الله,1
زيدوهم زيدوهم هادشي مايكفيهم,0
كاينة واحد فئة من جماهير ريال العربية قمة الحقد والكراهية ولا يعرفون ان كرة القدم مرة لك ومرة عليك,-1
أرح قلبك وروحك ومسمعك مع تلاوة عطرة د عبد الله المطرود,1
كلام معقول واتفق معه,1
لا لا عادي كلنا هكاك فالأول ملي شفتها معرفتهاش,0
صباح الخير اليوم عيد,1
اللهم في هذه اجعلنا ممن عفوت عنهم و غفرت لهم و عتقت رقابهم من النار و كتبت لهم الجنة نحن و ووالدينا و من نحب و جميع المسلمين يارب,1
مع من تحب تجد في أبسط الأشياء فرحا,1
لا يتألم إلا من كان وفيا أكثر مما يجب,-1
مشاركة وازنة في أشغال الدورة الخامسة لمنتدى كرانس مونتانا بالداخلة,0
تماما نسأل الله من لطفه,1
ماعنديش شك فروحك الرياضية و كون كانت الوداد فبلاصتنا غنشجعها تا انا وان شاء الله مربوحة,0
أستغفر الله العظيم الذي لا اله الا هو الحي القيوم و اتوب اليه,1
مرض التفكير ليس له علاج حتى ولو استطعت أن تنام ستحلم بما تفكر به,-1
الله يهدي ما خلق,-1
انظر وتمعن ايها المغربي يامن تتلحف السماء وتفترش الارض يامن جعلت من الحاويات موائد لك انظر ايها التلميذ يامن تتلقى تعليمك تحت جدران مهترئة وطاولات وسبورة مكسورة انظر ايها المغربي اين ولمن تعطى الملايين وانت تئن من الجوع ومن الفقر ومن الجهل فملايينك وميزانياتك تذهب الى امثال هذا,-1
الله ياخد الحق,1
نريد ملاحظاتك عن المباراه,0
هذا فعلكم تحت غطاء الخونه,-1
المخزن يسير بالوطن الى الهاوية,-1
مازلت متعطشا لهذا الاسلوب الجميل,1
ان شاء الله الله يوفقك,1
اهله الله علينا و عليكم بالامن و الامان و اليمن و البركات,1
ه امين,1
صباح خير يا اخي,1
هناك استثناءات بالطبع,0
مات شرفهم وجدوه مسفوحا على شجرة,-1
منو عداد مابغاوش يتفهمو ليا,-1
آمين تعيدو و تعاودو ان شاء الله,1
في ماليزيا قامت كل زوجة بتزويج زوجها بزوجة ثانية تعبيرا عن حبها له وقد تم ذلك بحفل جماعي راقي تناقلته وسائل الاعلام الله يهدي زوجاتنا لعمل خيري كهذا وانهم ان شاء الله لمهتدون وانا لهذا اليوم لمنتظرون,1
هؤلاء الذين ينتقصون من الناس,-1
سؤال في محله,1
انصحك تلبس نظارات لانك لم تقرأ التعليق جيدا,0
أثناء مشاركتنا في عمل جمعوي في الحي المحمدي بالدار البيضاء الحي المحمدي,0
أختي الصغيرة الحبيبة تسلم عليكم في طريقها للمدرسة,1
حرام عليك,-1
يا سلام عليك,1
الخيانة هي آن تستولي على ماء يخرج من الآرض تملآه في قنينات من بلاستيك ثم توزعه على الناس بآغلى الآثمنة فتجني آنت الآرباح وتطالب الشعب بتحمل الغلاء باسم الوطنية والوطن الخيانة هي آن ينزل ثمن برميل البترول في جميع آنحاء العالم وتبقي آنت ثمن البيع كما هو فلا الشعب يستفيد,-1
جيد جدا,1
شفت فيك الأهل والصحبه والعمر الجميل,1
من المؤسف حقا أن تبحت عن الصدق في عصر الخيانة,-1
الوزير في احتجاج ضد من الله اعلم من سيحاول ايجاد الحل لاحتجاجه الله اعلم من السبب في هذا الاحتجاج الله اعلم,0
شكرا لكم على تمرير تغريدتي,1
غادي يجي اللي غتدي اطنز عليهم ويندمو في الأخير,-1
ملقيت منقول من غير آمين,0
إذا ارتقت العقول بأفكارها طابت الألسن بحديثها,1
ربي يخليك ا ختي امين يا رب شكرا,1
صباح الورد سي براهيم,1
ليت الشوق الدي وجعنا جمعنا,1
سوء تفاهم فقط,0
زوينين عندي سبعة,1
في كل بلدان العالم يخرج الشعب لمساندة النظام أو المطالبة برحيله,0
الله يشافيك و يشافي جميع المسلمين يارب,1
حسن نيت,1
تلاميذ المغرب يواصلون الاحتجاج على على أمل أن تعلق بنصف كلمة تتفهم مطالب مستقبل المغرب,0
رمضان كريم بالصحة والسلامة إن شاء الله يا رب يكون شهر توبة وشهر مغفرة,1
الشرطة الاسبانية تدخل الى مسجد مغربي وكما تظهر الصورة فعناصر الشرطة دخلو باقدام حافية للتعرف على المعتكفين وبعدها استدعاهم الامام لجلسة شاي واخذ صورة معهم ينصر الله الدول الكافرة ان كانت عادلة ولا ينصر الدولة المسلمة ان كانت ظالمة,0
في امان الله,1
صراحة معنيديش مع الكرة المغربية,-1
الجمال يكمن في الخلق و الروح و الاخلاق فعن اي جمال تتحدث,1
أفادت وسائل إعلام أمريكية بأن أنقرة لديها تسجيلات صوتية ومصورة يرى مسؤولون أتراك أنها تثبت مقتل الصحفي السعودي جمال خاشقجي داخل قنصلية بلاده في إسطنبول,0
صراحة الانتقام لكن إذا تم الإعتذار فالمسامحة افضل,1
انظرو الى الأعمى فكرو في الأصم تأملو الأبكم راقبو المشلول لتعلمو أنكم مستودع نعم و كنز من العافية و قلو الحمد لله,1
الحقيقة هي أن بوتفليقة سينجح في الانتخابات كالعادة وكل قنواتكم تطبل له رغم عجزه,-1
كاينين شي مسائل اختلف فيهم العلماء و الاحسن العمل بقول الجمهور انت ادعي مع امك و سائر المسلمين من مكانك و القبور خليها لاهلها,0
اللهم إنا نسألك دعوة لا ترد ورزقا لا يعد وبابا إلى الجنة لا يسد,1
الله يعزك اخويا محمد,1
قتلتيني بالضحك اليوم,1
يسعد صباحك اخي الفاضل,1
لا اظن ان الجزء الاول موجود على الشكل الالكتروني,0
هذا جواب,0
شكرا خويا على دعواتك الله يحفظك ويخلي ليك ماعز عليك,1
المغرب في تقدم دائما,0
موجودات غير هو نتا ف الرباط مانظمنش ليك تلقا فيها,0
رسالۃ تفائليۃ إطمئن لعل في لحظۃ ما يغير اللہ گل الذي تظنہ لن يتغير,1
بتوفيق اخويا العزيز تبارك الله عليك,1
مردودية الاستثمارات والنفقات العمومية ترفعان المديونية العامة للمملكة,0
كنت أعتذر ولا أدري ما خطآي كان كل همي ما أفقدك,1
جزاك الله خيرا وحفظك الله,1
يارب كل اللي جاي أيام جميلة وأخبار مفرحة وقلب مرتاح وراحة بال,1
اااه على فكرة صوتك يشبه لصوتها لكني لست ممن يشجعون على الغناء,-1
الواحد يرد البال خصوصا ف هاد الوقت اللي الكل باغي غير الفضيحة لخوه هاد التكنولوجيا الى طاحت فأيدي ضعاف النفوس ستخرب المجتمع الله يحد البأس,-1
جات هاد التغريدة مع الاذان,0
لا أتفق معك أنت دائما منحاز للشخص الغني قبح الله وجهكم,-1
نحن عندما نفكر في مجتمع لايفكر نحكم على أنفسنا بالعزلة,0
طيب الحين متاكدة انك عرفت علاش متعصبة منك لانك غير محترم تدخل على تغريدات الناس و تقلل احترامك لكن الوقاحة عنوانك,-1
بالتوفيق ان شاء الله و اتمنى تكتب في ميزان حسنات من يشارك في هذه الحملة الرائعة التي تدعو للخير,1
بالصبر والتقوى يجعل الله العسر يسر,1
ان شاء الله مربوحة,1
مدينة رائعة,1
يخبئ الله في أقدارنا أشياء جميلة كن على ثقة بذلك,1
يا جماعة الحيوانات الكل ضدنا,-1
اللهم آمين يارب العالمين,1
اللي قراها ما يقول مبتدئة صراحة ما شاء الله عليك,1
مالك جاتك الدوخة,0
أيام جميلة كانت,1
كلامك اروع واجمل,1
مختفون كاين الخير في المغاربة,1
الله يبارك فيك خويا ابوليناس ديما كاين المعنى من المعنويات وخا شي خطرات خارج النطاق,1
قد اصبح الحزن صديقي,-1
صوت أمك في البيت أكبر نعمة تستحق أنك تحمد الله عليها,1
ياالله دهشة تغرق ثنايا الروح فرحا,1
و منكم نستفيد,1
تقرير دولي يصنف المغرب ضمن الدول الأقل تسامحا مع المثليين,0
طريق السلامة,1
بغينا العرب ترضى لقينا العرب مرضى,1
حالنا نحن وإخواتنا المصريين,0
العشاء الصحي يكون خفيف,0
كلها يلعب قدام باب دارهم,0
المشكلة هي أن المراة تتهم المراة وتظهر الرجل كضحية,0
يا ناعم العود يا سيد الملاح,1
الله على الصوت,1
مساء الخير,1
حتى شبيهك بالاسم صرت أحبه,1
رغم رحيله جماهير الرجاء تحمل غاريدو مسؤولية الإقصاء,0
غير لخير,1
مبدعين الصراحة راقتني الصورة وقلت نتقاسمها فقط انا ما جبت شيء من عندي,1
باقي ساعة وحدة فقط,0
اصلا عادي هادشي كيوقع فكلشي البلدان العربية,0
عجبتني رآها زوينة,1
من يصنع السعادة بداخلك هو من يستحقك,1
حاول أن تسافر,0
رايكم بالبرنامج حتى الآن جماعة,0
بحالنا بحالكم,0
ربي يعطيك ويرضى ورضيك يارب ختي في الدارين الدنيا والآخرة يارب,1
مساء الخير ياعقيد,1
اسعد الله صباحك بكل خير صباحك رضى و طمئنية من الرحمن لك الف تحية من المغرب طاب يومك,1
يا رب امين,0
نتا ماشي رجل من كلام باينة كاع مامربي,-1
بصح و الله,1
ظروفك الخاصة لك وحدك لكن أدبك في الحديث حق للجميع,0
إنها مهزلة عالمية على المباشر,-1
الحق مزعج للذين اعتادوا ترويج الباطل حتى صدقوه,-1
ثقة مبالغ فيها,-1
متشرفين,1
أكثروا من الإستغفآر فكم من إستغفار كان سببا فى تحويل محنة إلى منحة,1
تصميم المدن في العالم العربي دائما تكون بشكل يعكس حقيقة العالم,0
معبرة وحق الله,1
باش تعرفي الغباء نتاع المسؤولين دياولنا السيد مافاهام والو وتيبغي إشرح باز حاشي صنتيحتو صحة,-1
صباح الخير أيها العالم,1
طريق التوبة مفتوح و اتمنى ان تعفو عنها بلدها و ان يسامحوها اهلها افضل ما تبقى بين مخالب الملحدين و المشركين اللهم ارزقنا الهدى والتقى والعفاف,1
حتى انا منقدرش,0
سيكرهونك لفشلك وسيكرهونك لنجاحك,-1
كتموت على الرديلة انت,-1
مستنيااك ياروحيي بشوق كل العشاق,1
أحيانا تسعد غيرك ب كلام أنت تحتاج تسمعه,1
الله يحفظك يا ابن الاصول,1
الى كانت الصور من واقع فهي جميلة ما شاء الله,1
الحمد لله ربي يخليك,1
إنتهت قصة حب لا ليس هذا هو التعبير السليم بل انتهى الكلام بيننا فكيف ستعشق كادح متمرد يحكي لها عن بطولات جيفارا ومغامرات كاسترو ويكتب لها القصائد كل صباح كيف لا ينتهي الكلام ولن تنام بين آحضان بورجوازي يحدثها عن مراكز التسوق ومغامرته مع البنات الفرق بين الحب والحب دولار واحد,-1
تهانينا للسيدة نعيمة لا أعتقد أنهم سيجدون أفضل منك,1
الصورة تعبر عن ثقافة و وعي الشعب,1
يبار ليا في عمرك يا رب,1
لا أذكر عدد المرات التي تطلين علي فيها فجأة,0
مساء التفاءل,1
لا داعي للإعتذار أخي سعر معقول بالنسبة لتركيز العطر ألف شكر,1
اي هذه الحطة الاولى قبل دجاج محمر,0
الله يغلبك على كلشي ويخليك ل ماماك ربي يطول عمرها ويحفضها ليك ياربي حتى آتكوني كتشبهي ليها فكلشي مين داك الغصين من ديك الشجيرة,1
منطقيا لا شيء في العالم قابل للإستمرارية كل الوعود التي تعطى مجرد مشاعر لحظية,0
لا بأس فلا أحد يهتم لما تفعل مهما تفعل أفعل ما تعتقد أنه صحيح فقط يوما ما سيدركون,1
ممكن مساعدة محتاج صيدلية,0
أسعد الله يومك,1
نعيد و نكرر كرة القدم لا تقاس نهائيا بالحفلات و الصالات المغلقة مقياس كرة القدم الوحيد هو الملعب و اي احد يشك في تفوق ميسي على جميع لاعبي عصره من حيث المستوى الفردي فليتأكد أنه يعاني من مشاكل عقلية,-1
سنة سعيدة صديقي تمنياتي الخالصة بالصحة و السلامة و طول العمر,1
اللهم أغثنا ولا تجعلنا من القانطين اللهم أنت الغني ونحن الفقراء اللهم انشر علينا رحمتك بالسحاب سحابا مغيثا هنيئا نافعا غير ضار,1
اخ عزيز و غالي,1
اشنو بغاو زعمة من الحكم ايدير مفهمتهمش,0
بكل ثقه مايمرك مثلي لو تصبر دهر,1
ماكايناش لاباج فيسبوك مالقيتهاش لقيت ليميل و صيفط ليهم ان ميل صباحك مبروك,1
اطلع برا يا نذل,-1
الصدق منبعك,1
بصح كما كاين اللي يفرح كاين اللي يقلق فصبر جميل,1
لكن لا حرام هذا ظلم,-1
بعض الليالي هواها يستفز الشعور,-1
جمعة مباركة على الجميع,1
إن الله وملائكته يصلون على النبي يا أيها الذين آمنوا صلوا عليه وسلموا تسليما الأحزاب,0
فعسى أن تكرهوا شيئا ويجعل الله فيه خيرا كثيرا لو قال خيرا لكفى فكيف وقد قال خيرا كثيرا ابتسم في وجه البلاء فربما حمل لك العطاء فقط أحسنوا ظنكم بالله أسعدكم الله في الدارين,1
اللهم الحياة الجميلة والأيام السعيدة,1
السواد الاعظم ليس عنده ثقافة الفرجة و الروح الرياضية والأخلاقية للأسف,-1
حق مولانا,1
مايكون معاك باس اخويا,1
ضعف واضح في دفاع فريق,-1
نعم جدا شفولنا حل,0
إليك أحلى نغمة صامتة مغربية رقصة الأطلس,1
و الله تقريبا عندك كل الحق,1
راه الجو لي مامساعدكش,0
نغرد من شدة البرد,0
تعجز الكلمات عن وصف هاد الشعور اقسم بالله الا اختالطات المشاعر ديالي فرحان بكم لأن هدش كيغير حتى النظرة ديال التلميذ للإنسان ويقول شوف راه الناس فالمغرب كامل كيفكرو فيا وكيعانوني وكيزرع فيه حب الخير تحية عالية لكم من اللخر,1
جمعتك اطيب اختي,1
جديد برنامج المباريات,0
أوافقك الرأي وبشدة,1
أربع سنوات سجن لكل من يسيئ للرئيس نعم إنها بلاد الدكتاتور تركيا,-1
كوفي عنان الله يرحموا مسكين,1
أتق شر الصابر إذا هجر,-1
ان شاء الله,1
آنا لا آراهن على كلماتي لك مهما كان جمالك آنا آراهن فقط على قلبك على الصوت العميق ذاخلك الذي يجدبنا لبعضنا دون سبب محدد,-1
لإن شكرتم لأزيدنكم,1
كل عام وانت بألف خير,1
كأس العالم المتعة من كل نواحيها,1
وقيلا السخانة هاديك بالشفاء إن شاء الله,1
يا حقير,-1
لكن ممكن تزيد الامر سلبية اذا انتشر وهو للاسف انشتر,-1
اخطاء البعض ترسم نهايات البعض,0
الحمد لله على سلامتك,1
كل واحد فينا فهاد الدنيا بلاصتو فاللخر هنايا كنتمنا من الناس لي كيظنو انهم غادي يديو معاهم,0
من المهم أن نسلط الضوء على أولئك الذين يخاطرون بحياتهم من أجل مساعدة الآخرين,0
امين يارب العالمين و نت الله يغنيك من نعيم الدنيا و نعيم الاخرة يا رب,1
تحياتي المتبادلة استاذ,1
اختيار الالفاظ ضاعت للأسف,-1
قهروني حرام,-1
اللهم امين,1
فلا تعتقد أنك بقطع رزق مخلوق أو التضييق عليه يتسع رزقك ويطيب عيشك كما تشاء فالأرزاق قسمها الله بحكمة وتكفي للجميع ولعل من قطعت رزقه وقوته كان يدفع عنك الكثير من الشرور العظيمة وأنت لا تعلم سبحان من خلق هذا الكون بتوازن يذهل العقول,0
رمضان اللهم إني أسألك العافية في الدنيا والآخرة,1
لا تيأس ربما أجمل ايام حياتك لم تأتي بعد,1
الينايريون الرائعون,1
صلوات ربي و سلامه عليه,1
اضمها في برد الايام وادفى,1
يستاهل,1
صحيح عندك الحق,1
والله بغيت نذوق منها والله,0
إنا لله و إن إليه راجعون الأخ جمال كان إنسان محترم نسأل الله له الرحمة و المغفرة,1
إلانتماء عز,1
كل مبرراتهم لا تسوى حداء اصغر مغربية,-1
ليتني آعرف ما بذاخلك,-1
الله يبارك فيك,1
يتغير الوقت بسرعة,0
فين وصل العرس,0
عقاب المخرب هو القتل عند الحقراء عديمي الإنسانية,-1
يآ أمة ضحكت من جهلهآ أمم,-1
دعوة حب,1
ريالية و افتخر و نعلي راسي الفوق,1
رئيس حكومة البيرو ممثل محترف ومحام متمرس,0
انت اطيب اخي الغالي الهي يحفظك,1
اودي غي دير مزيان و الرحيم الله,1
جزاكم الله خير,1
الغروب والجو الجميل في مدينة آسفي,1
بالتوفيق أسود الأطلس,1
قام بالتطاول على شيوخ بدعم وتحريض من وعبر قنوات قطر الفضائيه قنوات الفتنه,-1
إثارة وأية إثارة,1
إيدر طفل مغربي أدهش أساتذة في البرمجة,0
الله يفرحكم بيها,1
الله يسامحك,1
صديقة لي من المنطقة,0
عندما تضيق بي الدنيا احتاج حضن امي و لا أجده,-1
اجل كثيرا,1
اللهم امين وانت داعى ولك بالمثل واكثر يارب,1
الحمدلله بعدا بلي قلت قريت واحد التغريدة وعجباتني باش ماتجيش تقاضيني و تقوليلي حقوق النشر,0
مبارك عليكم الشهر الفضيل تقبل الله منا ومنكم صالح الأعمال,1
كم قلت لك ياقلبي لا تأمن احد,-1
المغربي الي طلق العنان الخيال ديالو النتائج تبان تبان,1
اودي كاع هاكاك كاتوقع مرة مرة حتى نتي اقوى مما تظنين,0
نار جهنم مصيرهم,-1
هكا احسن في ظل المصلحة العامة,1
يلامسون قلبي أولئك الذين ينتبهون لتفاصيلي صغيرة التي لا أنتبه أنا نفسي لها,1
مرحبا بيك ازين ديالي فاي وقت دار دارك ماتحتاجيش عراضة,1
خاصني ويكاند من هاد الويكاند عمرني وصلت لهاد النيڤو د العيا و مازال تابعاني الطريق,-1
الحمد لله هاد القنوات ديال السعودية كينقلو الدوريات الكبرى,1
هده الطريقة التي تنهجها فاشلة أخي,-1
الله يحفظك والله فرحتيني شكرا,1
