tweets,type
الله ابارك فيك,2
بالتوفيق,2
أنا اعادى الأفعال السيئة,0
لا حول و لا قوة الا بالله الله يرحمو ولكن زاد كمل على بنتو و حرمها من أب,0
فطومتي الغالية راني ضاحكة و صافي,2
كل التوفيق لرجاء الشعب اليوم في نهائي الكنفدرالية,2
اتفق معك تقريبا اغلبنا يسيء استخدام مواقع التواصل الاجتماعي توجد تحزبات وشخص بالف حساب يصنف الناس كما يحب ومجموعات تهاجم ناس وتتهمهم بتهم ليست فيهم هذا من غير الذباب الالكتروني والمؤامرات كثيرا ما افكر بالانسحاب من هذا الفضاء الافتراضي,1
مساء الخير,2
راه تقرير عليه ماشي تم إختياره لشخصية السنة,1
غايجي واحد الوقت و غادي نحقق فيه كاع داكشي لي كانتمناه حيت حتى حاجة ما مستحيلة,2
اليوم الأول لي في العمل الجديد,1
حمدلله غير على اعتراف ديالك,2
اجزم انهن دائما على صواب و انا من هذا المنبر أضم صوتي لصوتهن,2
اودي ماتخليو حد يجمع الحسنات,2
الإرهابي مهاجم مسجدي نيوزيلندا نقل الاعتداء عبر فيسبوك لايف ونشر بيانا على تويتر,0
ان الله مع الصابرين,2
و نعم بالله العلي القدير غاليتي,2
غاديين بتيسير الله,2
هناك ما يسمى بانجذاب الارواح تقدر الواحد ما تعرفو و لكن تشوفو ترتاح ليه قبل ما تتبادل معاه الحديث وهناك العكس سبحان الله,2
مصاب راه قاليك حول العالم و حظوظي شبه منعدمة,0
فيكم و البركة اخوان و احباب غاليين أعتز وأتشرف بكم,2
جزاكم الله خير,2
المغردون العرب يتابعون عن قرب أحداث فنزويلا,1
انا متفق مع الفكرة فكروا في هاشتاغ مناسب لها مثل فضح المتحرش ويجب نشر كل الرسائل مثل تلك فيه وهكذا,1
تسليط الضوء على الإمكانيات الموجودة فيه,1
جميل جدا كل ماقلته ارجو لك السعادة صديقي حسن فخر لي ان تكون صديقي,2
گوني قويه فالحيآه لآ تحترم الا المرأه القوية التي لا تكسرهآا التجارب الفاشله وانماا تبنيهاا,2
الاسبوع المقبل,1
قلبك للي غزال حبيبة ربي ينورك يا غالية,2
اقبل بالمكان الذي أنت به تذكر أين كنت ولكن الأكثر أهمية أن تعلم المكان الذي تريد الذهاب إليه أتمنى لك بداية جميلة ويوم رائع,2
نجاح استئصال دودة من عين طفل في ورزازات,1
الفيديو يفضح كذب قناة الجزيرة ويكشف تمثيل الاخوان دور الموتى,0
كلام جميل,2
ثمن سنين مشات من حياتك بلى ماديري فيها شي حاجة,0
حروفك رائعة,2
اللهم ارحمه واغفرله واجعله في عليين مع الشهداء والصديقين وارحم موتانا وموتى المسلمين,2
الى كانت الصور من واقع فهي جميلة ما شاء الله,2
اسخف موضوع يتم تداوله على مواقع التواصل الاجتماعي,0
لاخير في امريء متملق أينما مالت الريح يميل,0
ان شاء الله ونوقف امام الله نحاسب كل واحد من العسكر الجزائري على كل المكائد التي كادها لبلدي على مدار سنوات,0
إنا لله وإنا إليه راجعون اللهم أرحم والدنا العزيز محمدو ولد الليله برحمتك الواسعة وتجاوز عنه وأسكنه فسيح جناتك,2
غير قالو ليهم زيدو لينا في الشهرية مبغاوش,1
سهيلة منذ نعومة اظافرها وهي فنانة,2
الصيف هنا مكاين غي الإحتفالات,2
راجع التاريخ يا ابني و راجع امورك كفاك جهلا بالقضايا,0
شكرا بزاف لأعز الناس لي سولو فيا صراحة مريض بزاف ولاكن كين تحسن الحمد لله كنبغيكم بزاف,2
المشكلة هي أن المراة تتهم المراة وتظهر الرجل كضحية,1
لأننا نتحمل يعتقدون أننا لا نشعر,0
يا رب امين,1
تحفيظ القرآن الكريم بأحد الكتاتيب,1
فهموني الا فهمتوا شي حاجة,1
زادكم الله من بركاته وأغدق عليكم من خيراته ومنحكم عفوه ومرضاته وأدام عليكم نعمه ومسراته وكفاكم شر الزمان وعثراته,2
كذبة ابريل,0
الله يستر وصافي راه حتى انا خايف من هادا الشي حيت ديما فمراكش كتكون الاستفزازات وتبدا المشاكل,0
وبعض الكلمات خلقت لتقال مره واحده لشخص واحد ثم لا يكون لها معنى بعدها,2
بارك الله فيك,2
يستغلون الجهل والفقر,0
اعلام العار,0
اللهم انك عفو تحب العغو فاعفو عنا,2
اقترب من الله يقترب منك كل شيء جميل,2
الغالب الله ماعندي ماندير ليك اودي امارادونا مرضتونا,0
اذا كنت لا تستطيع القيام بأشياء عظيمة إعمل أشياء صغيرة بمحبة عظيمة,2
و انت الى جهنم و بئس المصير,0
تستحق الوصول لهذا,2
مستعدة على بركة الله,2
حان وقت غلق حسابك على الفيسبوك,1
اه فهمت تماما الوقت مضمد الجروح الخفيفة ان صح التعبير,2
الصينيون يعبدون الرئيس و الحزب الشيوعي آسيا الشرقية مختلفة عن العالم ككل,1
في وجودك لو يغيب الكل ما أفقد أحد,2
سمعت هاد الموسيقى ودازو ليا الدموع وأنا عرف علاش بكيت ولكن ما نقدرش نعبر,1
البؤس في اوضح صوره,0
انا بخير كل ما اخوات مثلك يسالو عليا الله يجعل لقلوب صافية,2
فعلا هادي ماجات الواحد يبعد و يرتاح احسن,1
ربي يعزك و ينورك و ينصرك خويا لعزيز,2
عزائنا لأهالي ضحايا فاجعة القطار رحم الله الموتى والهم ذويهم الصبر والمصابون نسأل الله لهم الشفاء,2
لكن القدح في اعراض بنات المسلمين و الطعن في شرفهن بدون وجه حق اقبح و اشنع و اسوء واصحابها في جهنم لذلك الاحرى بك تنصح نفسك و من هم على شاكلة هؤلاء و لا احد شمت لكن عسى ان تكون موعضة لمن يطعن في شرف المسلمات و اهل بيته بدون شرف و لو ت,0
ان شاء الله,2
صباح الخيرات و البركات,2
موحالش واش باقي تدوز من حدايا,1
انتي الشمس التي تمد الدفئ بمجرد سطوعها,2
قصة رائعة,2
الى غير فادك نت باركة علينا,2
يارب,2
بوركتم,2
واخا ماعرفتوش ولكن باين فيه ولد الناس,2
أساتذة التعاقد يرفضون حوار الداخلية ويهددون ب سنة بيضاء,0
عيونك وطن مالي عن سماها رحيل,2
سبق لي دزت من هنا هاد الطريق طويلة بزاف,1
و انت الى جهنم و بئس المصير,0
في سجدة بين يد الله,1
من الاشياء الجميلة اللي كان يمتاز بها الانسان المغربي الشمالي وهي رقي الافكار,2
اللهم اني اسالك علما نافعا ورزقا طيبا وعملا متقبلا,2
على سلامتك,2
تماما الله يوفقهم و كل المنتخبات العربية,2
لاشيء بعد الموت الموت تعني النهاية النهاية بكل مافي الكلمة من معنى نحن كائنات ترفض الإعتراف بالفناء وهذا ما يدفع العلم للبحث عن الأبدية وأنا متأكد أننا سنحصل عليها إما بفضل وصفة ما وإما عن طريق تحويل الإنسان إلى ألة أو إنسان شبه ألي,1
هذه معاقل الإسلام,1
المهم من هادشي احبكم بلزاف بلزاف يا مغردين,2
في نظري تصرفه غير لائق تماما,0
تسلم روحك اخي,2
احبك مهما كان الرد,2
اكلتي المفضلة الشواء,1
العلاقة جدلية لو لم يكن الجهل لما كان الاستبداد ولو لم يكن الاستبداد ماكان الجهل بقدر ماتصنع الشعوب اصنامها بقدر ماتساهم هذه الأصنام في ترسيخ التبعية والجهل,0
صافي كوني هانية,1
من صلى الفجر في جماعة فهو في ذمة الله حتى يمسي,2
لا اعتقد خص يكون عندك شي معارف باش يلقو ليك شي خدمة وفرصة نجاحك في اوروبا اكبر من المغرب بكل تاكيد,1
الصورة من الحساب الرسمي,1
انت قليل أدب,0
نعم,2
ربي يبارك فيك خالتي اللهم امين وان شاء الله تفرحي بتخرج شيماء,2
أكاديميون وباحثون يتدارسون إشكالية الاندماج المغاربي في الدار البيضاء,1
الله ايكثر خيرها فالحقيقة خاصنا شي بحال هاد السيدة باش لبلاد تزيد للقدام,2
تصبحين علي خير يا قلبي ليلة سعيدة واحلام جميلة,2
قلب واحد هو قلب الواليدة,2
خاصك غ ضبطي المقادير,1
لا تحدثني عن حبك دعني أراه,1
انا أعيش ايام صعبة أيضا لست وحدك,0
اللهم حبب إلى قلبي الإيمان والقران ومجالس الصالحين,2
علينا و عليك خويا انس باش ما تمنيتي يا رب,2
واقيلا عندك الحق,2
بصحتك غرت,2
اللهم امين يارب العالمين,2
صورة لخواتم الخطوبة التي نزعت من أصابع قتلى الحرب العالمية الثانية و لكم أن تتخيلوا كم من قصة حب دفنتها الحروب,0
من المؤسف ان فيلم بهذه الرداءة يحظى بكل هذا الإهتمام,0
من فضائل رمضان علينا التقليل من خلطة الناس وأخذ حظ من العزلة وأفضل ما تكون في المرابطة في المسجد وانتظار الصلاة بعد الصلاة,2
قمة التخلف البشري,0
هذا هو الجواب الصحيح,2
بنت مختفية هادي جوج سيمانات هما واليديها تيقلبوا عليها ليوم لقاوها ميتة فشي غابة,0
يا ناعم العود يا سيد الملاح,2
لماذا الشعب رافض الرئس بوتفليقة الإدارة فاشلة العدالة غائبة والأحكام لا تنفد الصحة مريضة,0
هذا جهدي معاك,1
تقبل الله طاعتكم وكل عام وانتم بخير,2
الف مبروك,2
زائد اللي جاب أي كتابة كايلصقها لشي شخصية تاريخية أو يدير شي تصويرة لا تمث للموضوع العبثية,1
موحال ايديرها العثماني,1
فادي خويا لعزيز يجمع الله مع احبابك و الغاليين على قلبك يا رب,2
ما قصرتيش يعطيك الصحة,2
أرح قلبك وروحك ومسمعك مع تلاوة عطرة د عبد الله المطرود,2
هاد التلاميذ و الأولياء ديولهم و الله ما يستحقوا هاد العناء و التكرفيص,2
هو طامع في القلب مسكين و هي حطته في قفص,0
منزلك في وسط قلبي ولا حولك أحد,2
يعطيك العافية يا علي,2
و شهد شاهد من اهلها اان شاء الله يكون خير متفائلين بالخير,2
سرقوا كل شي إلا حزني لم يقتربوا منه,0
معلوم شخصية تهابه كل نساء العالم,2
ونهارك أسعد ان شاء الله,2
تكذبون حتا على اموت ياسبحان الله,0
تميز بما شئت لكن لا تتكبر أبدا,2
اذا مر يناير والليفر في الصدارة معناه اللقب قريب من اللقب,0
تصبحن على خير,2
الله يرحمو ويصبركم على مابتلاكم وإنا لله وإنا اليه راجعون,2
غبر هاد خونا,1
فقط في المغرب,1
درب النقى دربي ولا ادل غيره,2
يتميز بوجود صناعات يدوية بجودة عالية,2
اسهل طريقة لزيادة عدد المعجبين لصفحة الفيس بوك,1
بزاف هاد الفيلم,2
هادي زوينة,2
صدقت,2
عندما تجدبك الروح لا يبقى لشكل و المظهر قيمة,1
ابيات شعرية,1
كل مافي الأمر أني اعشقك,2
إنا لله وإنا إليه راجعون للهم أسكنه فسيح جناتك,2
شي شهر عسل هنا,2
تشبهين الورد وكلماتك عطر,2
كوفي عنان الله يرحموا مسكين,2
راه يخطط كيفاش يرجع,1
أرفض تماما وأدين ضرب الأساتذة,0
ظاهرة تستفحل المجتمع العربي,0
و الله افضل دول شمال افريقيا و دول العمق الافريقي المسلمة على دول الخليج,2
الحمد لله,2
الله يجعل كل أوقاتك سعيدة اخي,2
الله يسعدك يا غالي,2
كلنا شعب واحد,2
الصحراء في مغربها و المغرب في صحرائه انتهى الكلام يا بوزباليو مرتزقة,0
اساءة البشر لا مثيل لها و لا يوجد في العالم وحشية بقدر وحشية البشر,0
من هذا المنبر اشكرك على مجهوداتك التي تقوم بها من خلال تغريداتك لتعريف على كل هو تقاليد و أعراف و ثقافة تخص بلدنا المغرب تحياتي لك ولد بلادي,2
الشكوة لغير الله مذلة,1
تحلى ايام يا رب,2
المهم من هادشي احبكم بلزاف بلزاف يا مغردين,2
وفيك بارك الرحمان,2
شكرا بزااف نور الهدي والله يخلي ليكم جاد هادشي كيحفزني نزيد نخدم شكرا ليكم بزاف على الدعم ديالكم ديرو تانتوما ڤيديوات و صيفطوهالي الدار,2
هذا من لطفك و نبلك غالتي و نتي أطيب و معدنك ذهب صافي يا بنت الاصول,2
عيد مبارك أخوي محمد تقبل الله منا ومنك,2
حين يدمر العرب الممتلكات العامة فهم يعتقدون أنهم يدمرون ممتلكات الحكومة لا ممتلكاتهم و لازال العرب يستخدمون القمع والتهديد والضرب خلال التعليم ويسألون متى بدأ القمع أستغرب لماذا تستعمل كلمة ديمقراطية كثيرا في العالم العربي,0
امين أخي الكريم الله يحفظك و يحفظ كل غالي و عزيز لقلبك,2
كل شيء يجوز في الحب والحرب,1
ميزك ربي من الناس و عطاك,2
الله يسامح,2
بالتوفيق,2
آمين يا رب العالمين,2
قلبي شاف فيك الهناء و أكتفى بك,2
في انتظار حلقة غد بفارغ الصبر,2
تدوم بسمتك يا غالي اشتقتك والله يا اروع سليم,2
شفتي نيتك ناقصة,0
الله يحفظك,2
لن ا شجع احد غير الحب,2
صدق قائلها و من لم يجرب غ تجيه الهضرة ساهلة,1
امين يارب و للجميع,1
إنها لا تعي ما تقول لأنها مجنونة والمجنون رفع عنه القلم,0
الله يعاونك و يكمل عليك بخير,2
قال النبي صل الله عليه وسلم لو توكلتم على الله حق توكله لرزقكم كما يرزق الطير تغدو خماصا وتروح بطانا و لكم في قصة سيدنا سليمان و النملة خير دليل,1
الله يوفقها ويوفق الجميع,2
السعودية حشدت الأصوات لصالح الملف الثلاثي الامريكي وضغطت للتصويت ضد الملف المغربي وصرح تركي آل بذلك علنا واحتفل الشعب السعودي بخسارة المغرب التنظيم كل هذه اسباب كافية,0
صحبة مصلحة و استغلال للأسف,0
اللون الأصفر يزيد من جمال الحياة,2
راني عارف عندي الثقة فيك والله,2
قلوب تائهة ستجد راحتها بالقرب من خالقها,2
أظن دولة اروبية,1
هذا ما كنا نبحث عنه دائما التنافس بين الاندية الوطنية في دورينا,2
نصائح من شخصيات بارزة تشجعك على القراءة يوميا,1
أشهد أن لا إل ه إلإ الله و أشهد ان محمد رسول الله سبحان الله وبحمده عدد خلقه ورضى نفسه وزنة عرشه ومداد كلماته,1
صباح الخير لعائلتي و قبلة على جبينهم صباح الخير لشخص عن ألف شخص و ألف معنى صباح الخير لكم متابعيني و للعالم أجمع,2
ظهر الحق و زهق الباطل,2
هذا يسمى احترام عادات وتقاليد البلد المستضيف وليس فيه شيئ غريب,2
لو اجتمع غضب الانس والجن على دولة ما فعل بها من كوارث وجرائم وحوادث مثلما يفعل الانقلاب بمصر شياطين شياطين,0
والسعودية اللي هي دولة إسلامية صوتات على أمريكا,1
انها دعوة الحق,2
بكاني هاد الليلة نقطة ضعفي رجال كبار يبكيو يلعن بو الفلوس ويلعن بو الخارج اللي غيخليك تنسا والديك غاتندم أقسم بالله غتندم ضرني فقلبي,0
بجوج مكلخين,0
الله يعوض علينا شكون تيغنيها,2
تبا لقد وقعنا في الفخ,0
في موكب قهوتي أنت في صباحي ومسائي ما بين أضلعي تسكنين وما بين سطور كتابتي فأين أهرب منك وأنت كالبحر من أمامي ومن خلفي فهادا يعني أنني أحبك ولا يمكن للعيش من دونك يامن دعلتني أبوح بحبك ليلا ونهارا ومدا أفعل في غيابك يامن جعلتني لا أميز حتي بين الألف والباء أحبك حب جنون وسلام,2
مشيت لأحسن شاطئ فالمغرب,2
نظرتي لك عمر جديد,2
الله يحفظك و ينورك,2
قناة العهر,0
غير ضاحكة,2
رئيس الوزراء الجزائري ينشد الحوار ويعد بتشكيل حكومة موسعة,1
مادام انه قمر ليلي لا اشوف النجم لو يكثر,2
حجز كميات شيرا ومعدات محظورة في طانطان,1
شفت التويتات دولك اليوم روعة,2
يشرفني طبعا لكن اني مغربية بس لنا صلة رحم معهم,2
ما ضيع الطيب إلا قلبه الطيب,2
أشعر بالخيبة,0
عندما تشعر أنك فقدت كل شيء تذكر أنت لم تفقد الله عز وجل,2
يا رب توفيقك,2
بوينغ تطمئن شركات الطيران بعد تعرض طائرتها من طراز ماكس لكارثتين جويتين,1
شكرا امين,2
الله عليك فعلا انا محب للبيئة,2
أول واحد غا نبلوكيه هو هاد السيد مكيعرفش يناقش كتشدوا من هنا كيجبد ليه حوايج اخرين كتحول معاه فيهم كيبدل ثاني,0
مغربنا وطننا نحن فداه,2
و لك بالمثل,2
رمضان اللهم أجعل قلوبنا رقيقة بخشيتك وجميلة بذكرك ونقيه بحبك,2
عارف لي كاين,2
اللهم اغفر لي خطاياي وعمدي وجهلي وهزلي وكل ذلك عندي,2
نحن البسطاء الذين لا نملك ما نعوز عليه آمالنا الا الصباح نستبشر به رغم كل الظروف البائسة التي تحيط بنا نستيقظ في كل يوم على آمل حدوث أشياء مبهجة تغير الحياة في عيوننا لا نيأس ابدا طالما أن هذه الشمس تشرق والسماء تتلون لنا من بعد السواد وينتشر الدفىء في الهواء,2
انت آخر شخص يتكلم عن احترام القانون,0
شكرا لهلا يخطيك,2
ناظور عامر بزين,2
ناري ناري سمح لينا عيد ميلاد سعيد باشما تمنيتي ان شاء الله,2
جميل,2
البحيرة الجميلة هذه تحتوي على العديد من البحرية الصغيرة كالأسماك الملونة والتي تتميز بجمال ألوانها,2
للأسف ماعندي ماندير ليك,0
طابت أيامك وطاب قلبي المشتاق,2
كلنا هنا اخوة في تويتر والاحترام دائما في اسلوبك وكلامك,2
أحب هذا النوع من البيوت التي تمتلك نوافذ كبيرة,2
لهلا يخطيكم,2
شركة بريطانية تراهن على غاز تندرارا للتقليل من إمدادات الجزائر,1
ليا نفس الشرف و اكثر,2
راني مزال كنتهلا فيه,1
ما أجمل الصباح عندما يخبرنا أن الأماني مهما تأجلت سيأتي فجرها لتشرق فاستبشروا وتفاءلوا صباحكم تفاؤل وأمل وسعادة,2
ابسط الاشياء يمكنها ان تسعدنا,2
ان شاء الله راه حاضرين خاص غ الزعامة و الثقة,2
روح خد لك دروس تارخية من عند محليلينكم السياسيبن قبل التفوه بحماقات تثير الاشمئزاز,0
ذكريات الماضي,1
مهما حرصت واجتهدت في تدبير أمرك فإن حكمة الله نافذة وما يختاره لك فيه الخير,1
والله نتعاونوا المساوات فكلشي فحال الراجل فحال المرآة,2
من يكون هذا السمسار الذي أقنع أفضل لاعبي منتخب المغرب بالهرب من دوريات أوروبا للعب في دوريات الخليج,1
دائما انا اخر من يعلم في هاد تويتر,1
صورة توضح بشاعة ما وصلنا اليه اخلاقيا رجل في مكانته لم يشفع له تاريخه كي يعامل معاملة كريمة زمن يصدق فيها الخائن و يكذب الصادق,0
الله يشفيه ويرفع عنه ويحفظ له صحته يارب,2
ندمنتي لي رجعت,0
ما اجتمعت السمنة والعقل في جسم واحد قط,1
المغرب لا يباع ولا يشترى يا وضيع المغرب حر في سيادته وسياسته الخارجية,0
واسعدك الله في حياتك,2
دائم مبدع اخوي محمد,2
شعور سيء أن تكتشف مؤخرا أنك تعاملت دائما مع الأشباه أشباه الأحباء أشباه الأصدقاء لا شيء حقيقي وثابت في حياتك إلى الآن,0
الصبر ثم الصبر أخي,2
الله ينورك دنيا وآخرة يا رب,2
تماما,2
استغفر الله العظيم واتوب إليه,2
بحالنا بحالكم,1
هذا الوفاء و لا بلاش,2
كل هذا من اجل مصلحتك فقط,2
ياالله يسر أمري سهل طريقي أسعد قلبي أرح بالي وحقق حلمي إنك على كل شيء قدير,2
لم نجد ما نعلق به اصلا,1
الاخلاق اهم,2
التنقيب عن كنوز يورط أشخاص نواحي سطات,0
دولة الإهمال أسوأ من دولة الإحتلال,0
انت استاذة في الإنسانية كل شخص استاذ في شيء ما هذه الصفة ليست مرتبطة بمجال معين,1
ينصر دينك,2
و الله من بين الاماكن الجميلة و التي تستحق العناية و الاهتمام ناسها بسطاء لكن يعانون التهميش هم أولى بمخطط و مناطق أخرى لكن,2
ممكن ولكن مذاق لا يتحمل,0
ضحكة شفاهك تبري القلب العليل,2
باقي مبغى يحشم,0
حيث المعقول هو المعقول الصبر,2
ندير النية زعما,1
مساء الخير,2
اللهم رب الناس اذهب البأس واشف انت الشافي لا شفاء الا شفاؤك شفاء لا يغادره سقما,2
ربي يخليك,2
يسعد صباح الغاليين على قلبي انا موجودة حبوبتي,2
شبعت ضحك ملي شفتها مكاينش شي لاعب في التاريخ ما زكلش بينالتي إلا واحد و هو لي معمرو تارو,2
