tweets,type
كثير من الناس يبالغ في مظهره ولكنه لا يتحقق من الجوهر وما أدراك ما الجوهر لم ينبهر العرب بملابس الرسول الكريم ولا بمطعمه ولا بمشربه لكنهم انبهروا بعظيم أخلاقه وطيب سيرته وحسن أدبه ولين معاملته فحولهم من أمة ترعى الغنم الى أمة تقود الأمم طابت أوقاتكم بكل خير,1
استغفر الله,1
اكبر حملة نظافة في تاريخ المغرب جمعية مغاربة ونفتخر,1
قطر الخراب,-1
الله يكبر بيك,1
قصة رائعة وأسلوب أروع ولكن عليك أن تزيد فيه قيلا فخمس سنوات مرت في رمشت عين,1
شكرا اختي العزيزة ربي يبارك فيك وينورك,1
عادل المسامحة صديقي,1
ريتم الوداد مرتفع بزاف,1
وراني عرفت,0
للاسف,1
سبحانك يا جليل,1
اتمنى للناطقين بها كل عام و انتم بألف خير,1
يسعد صباحك و كل اوقاتك يا طيب,1
كلام عميق,1
اقترب لناس حسابهم و هم في غفلة معرضون,0
الله يرضي عليك,1
صراحة الانتقام لكن إذا تم الإعتذار فالمسامحة افضل,1
وهبي البام سيقود الحكومة المقبلة والسياسة رقصات أرانب,0
ضحك للدنيا تضحك ليك,1
عندما أقرأ منشوراتك كمسؤول عن قطاع الرياضة في السعودية استنتج حجم الأزمة القيمية والفكرية التي يعانيها المجتمع السعودي,-1
و هل للمخلوق شأن في خلقه,0
أخشى أن الضرر و الدمار الناتج من طريقة و أسلوب إدارة البلاد منذ الثورة حتى الآن لن يمكن إصلاحه,-1
شكرا امين,1
تدبير النفايات الصلبة بأسطول جديد في الحسيمة,0
اللهم أنزل عليه لعنتك,-1
تبارك الله عليك مبهر و مبدع,1
نهاية الموسل الاول صدمتني وهوأكثر مسلسل أخذت منو صدمات,-1
تجبرين العين ان تتأملك,1
خطير متقاعد يطلق الرصاص بطريقة عشوائية على المارة من فوق سطح منزله بكلميم,-1
القهر و الظلم,-1
كلشي ممكن في ظل هاد المنعرج اللي نعيشوه شفت واح الفيديو ديال الملك ف طنجة استقبلوه الناس ب اخنوش ارحل,0
قد همت في خل يذيب القلب مبسمه,1
اللهم امين يارب العالمين,1
كونوا في الموعد,0
آمين يا غالية ربي يطول في عمرك يا رب,1
هذا ما كنا نبحث عنه دائما التنافس بين الاندية الوطنية في دورينا,1
ما اجمل الصمت,1
هادي زوينة,1
مجرم,-1
دخول بعض الناس لحياتك هو مجرد درس تتعلم فيه أشياء تطبقها باقي حياتك أولها هو عدم الإفراط بالعاطفة وثانيها أن قلل توقعاتك بالأشخاص,0
ينورها عليك دينا و اخرة خويا ربي يعزك,1
بنت مختفية هادي جوج سيمانات هما واليديها تيقلبوا عليها ليوم لقاوها ميتة فشي غابة,-1
انهم اهل الكاريكاتور و لك في جرائدنا خير مثال,0
مذبحة ميدان رابعه العدويه جريمه نكراء,-1
تعادل بطعم الهزيمة للرجاء,-1
هاد الڤار يطبق غير على اللي بغاو البرازيل مثلا,0
ونعم بالله أخي,1
هل ما زلتم مقاطعون لمحطات أفريقيا,0
أسوأ شعور عندما يكون هناك شيء يقتلك في الداخل وعليك أن تتصرف وكأنك لا تهتم,-1
هو يستاهل وحنا مالين الخير,1
وصف جميل,1
يخطئ القلب لحظة فيعاقبه العقل سنين,-1
استغفر الله حرام عليك,-1
مممم الله يجعلني نتيق,1
لو انت إنسان عاقل السعودية أصل الشر في العالم ولو إنت إنسان عاقل فأنت تعلم ذلك,-1
انا لا أقدر بثمن,1
الله سترنا اختي,1
صباح الخير أباشا اش خبارك هاني مهني,1
لا خير في أمة اضطرت نساؤها أن تتمرجل بينما رجالها تثأنت,-1
شكرا و لك المثل و أكثر,1
لحسد ومايدير زريعة لقنب,-1
الله ييسر لك كل ما فيه الخير,1
يارب ٱجعلني ممن تفائل بخيرک فأكرمته,1
باقي قدامكم ساعة على اليلة يلاه,0
تسلملي روحك الجميلة غاليتي,1
شكرا أختي,1
لغة سيئة جدا,-1
أغنى رجل على وجه الأرض,0
تبقا السر بين قلبي و مكاتيبي يقرونك سطر و أنت بداخلي دنيا,1
حدراف لاعب كبير وغادي يبقى كبير وبلاصتو كاينة في الرجاء وفي المنتخب دار خطأ آه ولكنه لاعب أكثر من رائع,1
من هذا المنبر اشكرك على مجهوداتك التي تقوم بها من خلال تغريداتك لتعريف على كل هو تقاليد و أعراف و ثقافة تخص بلدنا المغرب تحياتي لك ولد بلادي,1
متخلق و معلم,1
جاني و جملني و زين أيامي,1
لاشهادة لفاسق ظالم,-1
تحطم طائرة مصرع شخصا من دولة بينهم مغربيان,-1
يظنون أن الضوء أسرع ما في الكون أو لا تعلمون أن الدعاء يجتاز المسافة الموجودة بين الأرض والسماء في ثانية,1
واخا ا سيدي,1
مجتمع ذكوري سيداته النساء من اجمل ما قرأت,1
المهم مزال محافظة على المراكز الاولى,0
فراق الاحبة اشد من الموت,-1
هل يرمم تغيير جلد الحكومة الجزائرية علاقات الجوار مع المغرب,0
سيكون لك في قلبي ايقاع خاص ليس ك غيرك من البشر ستكون أنت البسمة التي أستنير بها في ليلة أنت فيها قمر,1
يارب هذا الصبح هب لنا من نورك نورا,1
انسان بلا مبادئ,-1
السكوت احيان وزنه من ذهب,1
يسلمك ليا و يخليك ليا ابابا لعزبز,1
ما أجمل أن تبدأ العمل فقط منذ أربع أيام و تصبح في اجازة ليوم كامل,1
ف امان الله,1
كلام واضح,1
تمتع و شوف اخواتك الحلوات,1
اخترتها طواعية لم أجد يوما نفسي في بلدي,0
واخا شكرا,1
المحتجون يتوقون للتغيير ويضغطون لإبعاد الحرس القديم بالجزائر,0
اوا مبارك اومسعود,1
ساءرون في دروب الحياة راجيين ان ينورها الله بنوره انار الله دروبك وشكرا لمرورك الكريم,1
لصوص مصر يسجنون شرفاء مصر,-1
كنتم الافضل احنااا معااكم في الحلووه والمره ندعمكم نساندكم,1
عظم الله اجركم الله يرحمها ويسكنها الجنة,1
جعلنا الله واياكم من اهلها اخي الفاضل بارك الله فيك اخي الكريم,1
جربت التعايش مع المجتمع إلى أن أيقنت بأن الوحدة ليس سيئة كما وصفوها,0
الجيش يستعيد كعواش واليوسفي قبل لقاء خريبكة,0
حتى انا دكالي,0
أصبحنا أضحوكة العالم دموعنا جابت كل القنوات بكينا في الكأس والليغا والان بالأبطال حرام والله,-1
صباح الخير ياعقيد,1
لا حول و لا قوة إلا بالله لا رحمة و لا شفقة عجيبة هي قلوب هؤلاء المجرمين,-1
لا بان عادي,0
ابتسامتك سر سعادتك,1
توقعات طقس الثلاثاء سحب منخفضة وكتل ضبابية,0
أروع ماقرأت عن عيد الحب تحياتي لك استاذة احسان الفقيه,1
مساء الخير,1
الله يبارك فيك حبيبة,1
اشكرك اختي نبيلة على كرم اخلاقك وكلامك الراقي واتشرف ان اكون في هذه القائمة مع اعلام تويتر في المغرب,1
لا تجرح طفلا ذاكرة الصغار لا تنسى الصفعات الصغيرة,1
يسعدك ربي و يفرح قلبك يا غالية,1
العصابات الديكتاتورية,-1
حتى عيوبك في عيوني جميله,1
نصيحة اليوم تيق فراسك وكون نتا هو نتا كون داكشي لي بغيتي ماشي داكشي لي بغاو هوما,1
صباح خير يا اخي,1
اللهم يسر سنة سعيدة,1
إنكسار النفس لا يجبره ألف إعتذار,-1
فهو يعيش قهرا في ظروف سيئة جدا تحت الخيام البالية,-1
نهاية اسبوع رائعة للجميع,1
الله يعاونك و يكمل عليك بخير,1
كل شئ سيكون جميلا قد لا يكون اليوم ولكن بالتأكيد سيكون ذات يوم,1
يعطيك العافية يا علي,1
الله يعمر حياتك خير و نعيم من رب العالمين,1
أكدت مصادر برازيلية وفاة لاعبين بسبب حريق في مركز تكوين و تداريب نادي فلامينغو البرازيلي اثناء نوم اللاعبين,0
رحم الله من عرف قدر نفسه,1
ليست لدي أي فكرة إطلاقا عنه,0
خطوة جديدة,0
احتراماتي لبحال هاد الرجالة الكبار,1
إنا لله وإنا إليه راجعون الله يرحموا ويوسعه عليه,1
بدأنا فصل جديد وبدات آمالنا واحلامنا فياربي حقق ما تراه خيرا لنا في ديننا ودنيانا وأخرتنا,1
الله يعطيك الصحة,1
الا يكفي ان نسبة مرضى السرطان اعلى نسبة عالميه بسبب مفاعل الاسرائيلي و بكل جهل نضعهه في بلدنا,-1
الحمد لله على نعمة العقل,1
يعني رافض يتعاطى مع طلبك لكنه لا يريد ان يصرح لك بها,0
ليس على الكل للاسف هناك من تقاعده لايكفي حتى لثمن زيارة طبية واحدة,-1
والسعودية اللي هي دولة إسلامية صوتات على أمريكا,0
اللهم طهر ايامنا وكل أوقاتنا من كل ضيق وعسر وأفتح لنا أبواب السعادة واليسر,1
الحمد لله على نعمة الامن و الامان,1
قل هو الله أحد الله الصمد لم يلد ولم يولد ولم يكن له كفوا احد,0
الله يديم عزك حنونة,1
الله يدوزها على خير,1
الحمد لله حمدا كثيرا طيبا مباركا فيه,1
مساء الخير,1
هانيا الله يحفظك,1
هذا عندو شي عقل,-1
عجبتي اللقب,1
عندما يتم قذف المغاربة في أعراضهم أقول لك ياتركي الكلب صن لسانك و أغلق فمك,-1
حنا مالين الخير نجمعو الناس على الخير,1
ربي يحفظك اخي كلامك شرف كبير لي وكل يرى الناس بعين طبعه والطيب من اصلك,1
كم حاجة قضيناها بتركها,0
سيري أ سعاد الله يفرحك,1
أحبكم في الله إخوتي الكرام,1
عندك الصح الجمهور كيعمل الضغط,1
عارف لي كاين,1
هل هناك امل في ان تحتل بلدنا مراكز متقدمة في النمو والتطور مستقبلا,1
لقطة من جنازة شخص فقير سنة يتيم متزوج من دون اولاد تبا لاصحاب المصالح تبا لضمائر الناس تبا لمن يعبدون الدرهم ادعو له بالرحمة و المغفرة,-1
امين يارب العالمين غاليتي,1
عندي نفس الامنية,0
تشرفنا فاي وقت اخي مرحبا بيك عندنا,1
وأنت يا أمي كطمأنينة الصلاة كأرض أحياها المطر,1
نعم لتجديد الاتفاقية,1
الله ينورك دنيا وآخرة يا رب,1
الله يحفظك وبارك فيك,1
و ما المانع,0
جميل,1
ما اجتمعت السمنة والعقل في جسم واحد قط,0
عندما يتشابه الجميع بالحب أتميز أنا بعشقك,1
شحال ف الساعة مثلا و لا هادي حتى هي قديمة,0
كيف الحال و الاحوال,0
ويحكم ماذا تفعلون متأكدين أن هادو لعبو الإقصاءيات باش وصلوا لروسيا فريق دون المستوى,-1
إذا قطعت علاقتك بشخص أقطع لسانك عنه,0
مدارسنا اضحت مناهجها تفتقد لتدريس القيم الدينية و الاخلاقية,-1
الأخلاق لا تباع ولا تشترى ولا تصطنع الأخلاق هبه يعطيها الله لمن يحب وتظهر حتى فى ملامحه دون أن يتكلم,0
دامت عليك صحة وسلامة,1
وهبي صلاحية الملك تتجاوز الفصل والعثماني مجرد موظف,0
سمحليا,1
ما يجي معاهم غ الزيار,-1
الله يخزيهم,-1
تزوح إن كانت زوجتك جيدة أصبحت سعيدا وإن كانت زوجتك سيئة اصبحت فيلسوفا سقراط,0
يكفي يكون رجل,0
صحيج و اتفق اللي بغيتيه لراسك بغيه للناس,1
الله يلعن بوها شهية,-1
الجميع يعي ذلك,0
لن تنجح إذا استمر قمع الاقلية المسلمة,-1
الله عليكم يا شعب التويتوما العظيم,1
دولة امارة المؤمنين تتبع منهج صوفي محض حسبنا الله و نعم الوكيل,-1
اللهم انك عفو كريم تحب العفو فاعفو عنا,1
من لا يقدر وجودك لا تعظم غيابه,0
الجميع يحتاج الحب الممتلئ بالصدق,1
اللهم امين ختي ولك والجميع,1
اللهم اشفها واشف مرضانا ومرضى المسلمين,1
في اليوم الذي لا تواجه فيه أية مشاكل تأكد أنك في الطريق الغير صحيح,0
أكثر النداءات طهرا حي على الفلاح,1
الصراحة ماشي عيب,1
الله يسلمك,1
يجب عليك ان تتعلم التفكير قبل أن تدرس الفكر,0
امين الله يكرمك و يحفظك,1
أغرد اليوم باليونانية لأني أعشق هذا البرنامج,1
هنا إزدادت و هنا سأعيش و هنا سأموت وطني بدون مقابل,0
اليوم غادي تسمعو واحد الكوڤر مفاجأة وجوه الخير شكون بغا يسمع ابن جرير,1
لا تقل في الناس مالا تحب أن يقال فيك,0
زيدو مرحبا بيكم بصحة غداكم طياب لميمة الله يخليها ليا,1
مبروك للوداد والوداديين ديما راجا,1
ماعرت علاش مازعمتش عليه بديت شوية ف الحلقة الاولى و ماكملتش,1
على سلامتك عزيزتي إنشاء الله اكونوا أمورك بخير وعلى خير,1
اذهبو الى الجحيم,-1
ان شاء الله خير,1
قمة التخلف البشري,-1
اللهم أحسن عاقبتنا في الأمور كلها وأجرنا من خزي الدنيا وعذاب الآخرة,0
الصورة عجييييبة,0
خيالك يرسم البسمه على شفاهي وياخذني الى آخر مدى في الكون وطن عمري,1
اللهم فرحة تنسينا ما مضى وأنقضى وترسم ملامح الفرح لأيامنا,1
احكي سرك للغريب حتى واذا محافظش عليه ينشرو بعيد على دوارك ولا تحكي سرك للقريب كي ينشرو يجيبلك العيب لباب دارك,0
النقاش يفيد و اذا ما افاد يخفف من وقع الصدمة,1
بمناسبة السنة الجديدة لا اتمنى لكم شيئ ان كنت تريد الصحة عالج نفسك ان كنت تريد المال إعمل بعرق جبينك ان كنت تريد السعادة اعمل الخير من حولك ان كنت تريد الحب ابحث عن شخص يلائمك,0
من يريدك لن يعيقه شيء ثق بذلك,1
غ يتصلح الحال ان شاء الله غير كوني متفائلة,1
يموت عدوك و لي مايبغيك,1
لا آجيد الكتابة عن الآم فلا آحد يستطيع وصف جزء من الجنة,0
الله يحفظك,1
صباح الأمل المشرق بالخير والمحبة والعطاء صباح الخير,1
اضم صوتي الى صوتك,1
صباح الخير,1
إن شاء الله,0
الله ينصرهم على الحق,1
يا مجرمة,-1
حتى انا مخلوعة منها الله استر,-1
من جلسة تصوير مجلة,0
وأن غاب طيفه في قلبي مايغيب,1
هدية بسيطة مني لكم,1
بغض النظر عن افيلال و كتابة الدولة المكلفة بها تساؤلي حول ان كان هذا العزل شمل او مس احد الاحزاب المعارضة ذات الصيت العالي كحزب الحمامة مثلا كيف سيكون الرد,0
الله يرحم الحسن الثاني و كافة الملوك المغاربة المسلمين و بارك لنا في ملك محمد السادس,1
إدارة فيسبوك توضح حقيقة العطب الذي لحق موقع التواصل الاجتماعي,0
الزمن ماياخذ الا الغالي النأدر,-1
لا اعتقد خص يكون عندك شي معارف باش يلقو ليك شي خدمة وفرصة نجاحك في اوروبا اكبر من المغرب بكل تاكيد,0
عيد مبارك سعيد نهاركم مبروك,1
هانتي تشوفي,0
كل عام وانت سعيد وجميل باختلافك,1
ليس تصغير ولا حقد فقط انا اتكلم بالمنطق,1
لا استخدم غيره اصلا,0
ربي أكتب لوجودها بجانبي سنوات لا تعد,1
كيفاش,0
صباح الطمئنينة و الرضا بما قسم الرحمن,1
اسعد الله صباحكم بكل خير,1
وأنت ربي يعطيك ويرضى عليك يارب يارب,1
عام سعيد على الكرة المغربية,1
عالم دين مغربي,0
الله يبارك و يجزيك بخير,1
توقع شي نهار يطلبو منك الحالة المدنية كلها,0
تصبحين علي خير يا قلبي ليلة سعيدة واحلام جميلة,1
والله حتى زوين مرة مرة نتجمعو ونضربو الدنيا بركلة,1
يسعد صباح الغاليين على قلبي انا موجودة حبوبتي,1
تشبه صباح الشتاء كل ما فيك يفتن,1
هذا هو التقرير اللي يخلي المغرب يسحب السفير من السعودية كانشوفها غير سبة وصافي اما التقرير مافيه والوا,-1
جمال مدن المغرب لا يضاهيها جمال,1
اللهم امين,1
هاء نسيت بلي حنا فناظور معندناش ملعب اصلا,-1
نحمد الله ونشكره وأنت كيف حالك,1
ربي يخليك,1
تسلم من كل شر اخي,1
ممكن متابعين,0
كيف الحال و الاحوال,0
كل فكرة لاتؤدي بك إلى الله هي فكرة مشبوهة أو ناقصة,0
ياه زوين و مافيهش المواج,1
بادو الزاكي الأقرب لتدريب الدفاع الحسني الجديدي,0
ما اثقل دمك و ما اغباك,-1
ممكن متابعين,0
عزة النفس ينتهي عندها ألف صديق و حبيب,-1
مهندسو وأطباء الغد يرفضون الاستعمار الثقافي,0
اللهم احفظ ملكنا وبلادنا من كل مكروه وشر,1
شكون بحالك اخويا سعداتك,1
للأسف من لم يجد شيئا ليفعله اليوم يصبح مغني,-1
حديثهم شيء وحقيقتهم شيء آخر,0
إن الله يغفر الذنوب جميعا إلا أن يشرك به,0
حتى من سواعدة كيتشكاو منك ابادة,-1
من الطبيعي أن تتناثر الإتهامات والتشنيعات والشتائم والرصاصات في كل إتجاه إذا كان رأس الدولة عاجزا عن إتخاذ القرار,-1
الحافيظي كيعطي الذهب,1
يحفظ الله الأمة بالمصلحين,1
انتهاكات الانقلاب القمعية فى جامعة الاسكندرية وصلت مداها باصابات واعتقالات,-1
امين يارب العالمين,1
الأم هي الوحيده التي ستبقى تحبك مهما أخطأت,1
اللهم استرنا فوق الأرض وتحت الأرض ويوم العرض عليك,1
والله كلامك صحيح لازال المنتخبون يسيرونها بعقلية التسعينيات,1
كلها جميلة,1
الحرية لمن طلب بحقه,1
التحكيم المصري لا علاقة و الدليل اعتماد الإتحاد المصري على الحكام الأجانب,-1
انا الاول و احب المركز الأول,1
لك الأجر ضعفين,1
إذهب إلى الله بضعفك يأتيك بقوته اللهم ارزقني وارزق متابعيني الفردوس الاعلى,1
سنة سعيدة لك استاذتي أيضأ,1
امين و ليك حتى نتي,1
النفاق في الحياة في المعاملة في بزاف ديال المواضع,-1
الله يسلمك و صباحك ابرك,1
باي باي البرد,0
مشينا ضحية الطمع,-1
روح انت و بلدك و الاخوان المسلمين و كل شرقك المقرف بعيد عنا لا تذكرنا,-1
كما قال المغرب لو فيها أربعة ملاعبية من طينة المرابط ما تهمهم لا البرتغال ولى الأسبان تحية خويا الرجولة آللي داويين عليها فالتلفزة شفناها عندك اليوم,1
صباح الخير زوينين بون ويكاند,1
احسن الله اليك اخي الفاضل تحياتي,1
الله يعطيك الصحة,1
الارزاق المهم راك عارفة مكامن الخلل و خاصك تحطي الدواء على الجرح الله المعين,0
الشكر لله حظيت بتكريم عن سن من اناس طيبين تكريم معنوي تخونني الكلمات في هذه الاثناء انا سعيد جدا لله ما اعطى و لله ما أخذ,1
لولا تآمر العرب وبعض الفلسطينيين مع اسرائيل لما اسطتاعت اسرائيل ان تصل لما هي فيه الان حسبي الله على المتواطئين الخونة ونعم الوكيل,-1
صافي ماكاين والو,0
هذه الانتخابات غير عادلة لن نقبل بها أبدا,-1
اش غادي نقول ليك غير الله يلعن اللي مايحشم كتدافع على شركة فرنسية والشعب المقهور المطحون مهاز ليه كاع الهم,-1
كيعجبني نتصنت له عندو ما يقول و يتكلم ف بزاف المواضيع,1
ترحب بيك الجنة,1
ونعم بالله,1
ديما موجود,0
مسلمين الاسلام كايقوليك تفضحي عباد الله و تشوهيهم,-1
مغربيان ضمن قتلى حادث تحطم الطائرة الإثيوبية,-1
مايمكنش نعرف العلم لله,0
رايك يحترم بغش النظر عن المسائل الدينية حكمهم ينجح و لا لا معروف على المرأة الى خذات اي مسألة تاخذها بجدية و حزم,1
والله حتى زوين مرة مرة نتجمعو ونضربو الدنيا بركلة,1
كم سعره أخوي عبد الله لو سمحت,1
و بئس الميعاد,-1
شكرا لتقبلك النصيحة و شكرا ايضا لنصيحتك و ان شاء الله خير,1
كلامك صحيح للاسف ما خدموا ما يخلو اللي يخدم,-1
كلها خزعبلات يا أخي,-1
اللهم اميين يا رب العالمين,0
ترشيح جثة بوتفليقة,-1
من الصحراء الغربية,0
القط المغربي يتنبأ بفوز المنتخب المغربي على المنتخب البرتغالي,1
فكر أكثر من مرة,0
الله اكبر,1
اللهم صلي وسلم وبارك على سيدنا محمد وعلى آله وصحبه أجمعين,1
بالتوفيق للأميرة اليوم اللوك يجنن,1
الوطن ليس جغرافيا الوطن هو قيمة الحب و الكرامة والفداء و العدل الوطن ثبات على المبدأ في ضجة البائعين وتشبث بال,1
خدمة رديئة فقط الإشهارات بدون جودة,-1
ربي يخليك,1
هاد لفقيه خطار والله,-1
ما الذي يدور ذهنك الآن أهوال يوم القيامة,0
لا لرشوة,0
شكرا خاي هذا المأمول و نتمنى خيرا,1
مرحبا الله يسخر,1
اه مزيان,1
وايلي نتوما ممحتاجينش الفرص باش تجيو,0
فكروني عافاكم علاش انا هنا اش باقة كاندير فهاد تويتر,0
