tweets,type
و اكون من الحاضرين و اصفق لها و اشجعها و اقلها بالمصري اديلو كمان يا قشطة,2
والصداع من الفوق حتى الليل حتى تبان ليهم الهضرة او مايسكتوش,0
بنادم حتى كيمرض عاد كيعرف راسو شحال ضعيف ولا شيء,0
الله يرحمه و يوسع عليه,2
وجزاك,2
نهاية المباراة بفوز الترجي مبروك الترجي فاز اداءا ونتيجة,2
بالصحة,2
من أحسن الحوايج لي كيعجبوني بزاف فالصويرة هي الألوان المتناسقة,2
زيدان يعود رسميا لريال مدريد,1
يستاهل ربي يرفع قدركم,2
و ما هو الفرق يا حضرة الزعيم,1
هذا حال بعض الناس دعك منهم استمتعي بما ترينه صائب لك,1
و ما خاب من قال يا رب,2
تقبل الله منا ومنكم اخي محمد عيدكم مبارك سعيد وكل عام وانتم بألف خير,2
صباح النشاط,2
الله يرضي عليك,2
عندما تلهو الرأسمالية بالقوى الكادحة و تكون الحكومة نائمة فى سبات عميق يعيش الشعب تائها قلقا مهملا ويصبح المستقبل غارقا فى القذارة واش مابانش ليكم نرجعو اشتراكيين حسن,0
مغربي ولد بلادي و السوري من عائلتي,2
لا تعيش بعيدا عن الله وتطلب السعادة,1
إن الهوى جرحه عذاب وأجمل أيامه غياب,0
دابا فهمني حاجة وحدة اش بغيت تݣول,1
عادي ارادة قوية برافو عليها,2
من اجمل ماقرأت و رأيت ربي يحفظك يابنت الاكرمين,2
نصيحة اليوم الكلام الناقس مورا الظهر كيبقا ديما مورا الظهر وكيخليك ديما تزيد لقدام,1
رفع الله قدركم,2
هاد المسالة ديال ضرب الاقتصاد الوطني في الصميم,2
لا ضريفة هادشي لي خارج عليا نيت صباحك مبروك,2
قصدك روعة,2
امين يارب,2
للأسف,0
آلله يكون منه و يشافيه و يقعد وسادها بالصحة والعافية و السلامة يا رب العالمين,2
كاين فرق بين العتاب و نكد,0
أمطار الخير الحمد لله اللهم إنا نسألك موجبات رحمتك,2
قد تأتيك النعمة لانك تمنيتها لغيرك,2
قل لن يصيبنا الا ما كتب الله لنا,1
جهد تشكر عليه الصراحة,2
انت الأروع,2
هدف رائع للوداد البيضاواوي في شباك العين الاماراتي,2
شكرا لكل من شارك,2
بالرضى بما قسم الله و قدر,2
شاداني الخلعة,0
بالصحة,2
مامحسوبة لا علينا ولا عليكم,1
ربي يحفضك ويسعد ايامك ويطول عمر والديك يا رب,2
مرحبا بك من جديد وعلى سلامتك,2
لاروع و اجمل و احلى صديقاتي على تويتر,2
صباحكم مبروك زوينين,2
امين و اياك يا الفرتوتة ديالي,2
تعليق منار اسليمي على ما يقع في الجزائر,1
مايشبهك غيرك ولا غيرك جميل اربعينك حور ماخلقوا بشر,2
تسجيل نادر للمفكر المغربي المهدي بن عبود,1
ان شاء الله,2
ولد المغرب على قناة المانية,1
إتزن في مشاعرك من البداية لا تاخذك اللحظات للسماء وتردك للقاع,1
عندما تسلبي ارادتك فلست حرة أبدا,0
كانت تالفة ليك,1
هل تعتبرهم اعلاميين هؤلاء مجرد مرتزقة للسيسي و تركي ال الشيخ و اسيادهم السعوديين و الاماراتيين,0
قالك كوليها انتي,1
دامت عليك صحة وسلامة,2
الرجال صناديق مقفلة مفاتيحها التجارب,1
سلامة روحك يا الغالية انتي,2
يمارس جريمته معتمدا على غباء جمهوره,0
تعادل بطعم الهزيمة للرجاء,0
قال ابن رجب رحمه الله أفضل الصدقة تعليم جاهل أو إيقاظ غافل,1
قل هو الله أحد الله الصمد لم يلد ولم يولد ولم يكن له كفوا احد,1
ان شاء الله خير,2
فويل للمصلين الذين هم عن صلاتهم ساهون,0
من هادشي كامل فاش نرجع غنمشي عند الوالد انعاود ليه هادشي,1
معجبونيش لكلمات,0
كما هناك زهور بلا عطور هناك طيبون بلا حظ,2
تفاصيل الشاب اللي قتلوه بلا رحمة ولا شفقة,0
اهلا بك كلشي بيخير,2
مسولوش عليك باش نقولها ليهم,1
أنا يا سيدي إمرأة أمازغية عربية شرقية مغربية إن إستبحت قلب رجل أسكنه ولا تشاركني البقية,2
وأخيرا فنان وأعتز بها فنان وتقاتلت بزااف عليها فنان وفرحان والحمد لله بغيت نشارك معاكم أحلى أوقاتي,2
ما اجمل العدالة الالهية,2
أنا كل ما نويت أنسى ليك ذكرى ترجعني,1
معلومة صحيحة,2
أنا الاول و احب المركز الأول,2
هذه سنة الحياة أخويا ماعليك غير الصبر,2
جس النبض و لكن كيبان لي لا مجال للمقارنة,1
اه بصح هادي راه معلومة صحيحة و لكن ما تنفعك ف والو,2
يبتسم لك قلبي كل مامريت في بالي,2
اللهم آمين يارب العالمين و جميع موتى المسلمين,1
جزاك الله خير يا اخي سمير اللهم اعنا علي ذكرك وشكرك وحسن عبادتك,2
لا لا راه بدلت رايي شحال هادي اكتر من شخص حدرني ومن الرجوع للمغرب عالاقل تكون عندي خبرة ديال خمسة اعوام عاد نرجع للمغرب ونلقى خدمة مزيانة الا رجعت دابا غنبيع عصير فراس الدرب والقرار جا من بعد دراسة للوضع في المغرب وبرغبة مشتركة,1
زيدو مرحبا بيكم بصحة غداكم طياب لميمة الله يخليها ليا,2
الله يحفظك,2
امين ربي يخليك,2
يليق بي أن أكون كل أشياء السعادة,2
غباء في غباء لان نفس الحركه صارت مجرد تقليد أعمى,0
الله على اخلاقهم فخر العرب,2
المشكلة أن الأساتذة الجامعيين مكيناقشوش البحوث مع الطلبة لوكانت المناقشة سيتم اكتشاف الخلل,0
تقدير موقف حول الانتفاضة الشعبية في الجزائر وخلفياتها,1
هذه هي آخر فرصة لكم,1
سلا عاصمة التسامح,2
هادي قافية واعرة,2
بغيت نمشي نفطر حدا البحر,1
بارك الله فيك اخي رشيد و كثر من امثالك,2
أربعة أشياء لا تتركها في حياتك لا تترك الشكر فتحرم الزيادة ولئن شكرتم لأزيدنكم ولا تترك ذكر الله فتحرم ذكر الله لك فاذكروني أذكركم ولا تترك الدعاء فتحرم الاستجابة أدعوني أستجب لكم ولا تترك الاستغفار فتحرم النجاة وما كان الله معذبهم وهم يستغفرون,1
من أروع المدن المغربية فعلا,2
حق مشروع,2
واخا ا سيدي,2
ربما من الأسباب التي جعلت زيدان يغادر الفريق,1
ما يخالف طول عمرك,2
عيدك مبارك أخي خالد,2
مساء الخير,2
ماهي الفرحة الكبرى,2
حكمة اليوم,1
في رأيي مبادرة مزيانة,2
مجازر سوريا مستمرة أين الأمم المتحدة من حماية الأبرياء,0
لقد خالف كل العهود وحتى العصورأراد أن يخالف ليعرف لكن الله يمهل القاتل حتى ينسى فعلته فيأخده أخد عزيز م,0
تجاهل التغريدة هو الحل,1
مرحبا بكم عندنا,2
على سلامتك انشاء الله تكوني بخير,2
هناك استثناءات بالطبع,1
تماما الله يحفظكم أجمعين,2
يا مسهل,1
كل من ينزل مظاهرة بسلاح أيا كان انتماءه السياسي هو مشروع قاتل يجب محاكمته,0
موقع فيسبوك يتعرض لعطل تقني في دول العالم,1
عيد مبارك سعيد نهاركم مبروك,2
الإخوان هاد الصحيفتان تعملان على إفشال المقاطعة و همهم مصلحتهم لهذا هناك دعوة من كل المغاربة لإلغاء الاشتراك و الإعجاب بهم,1
امين يارب العالمين,2
كل مخلوقات الله تستحق السعادة,2
واش متأكدة محاولة سرقة ولا فقط وسوسة,1
إبتسامة الأم تنسيك هموم الدنيا,2
قافلة تقرب التلاميذ من الإنترنيت وزان,1
وانتي بالف خير ليمو ربي يدخل عليك السنة الجديدة بكل شي حلو,2
ان شاء الله,2
تكون للابد و اوافق,2
الأصدقاء عائلة أخرى أنجبتهى الأيام,2
حرك الما يبان العطشان,1
اللهم احسن وقوفنا بين يديك,2
وما كان لي عليكم من سلطان إلا أن دعوتكم فاستجبتم لي فلا تلوموني ولوموا أنفسكم الشيطان,1
المغرب يظل كبيرا بتاريخه الذهبي وجاله العظماء رغم كيد و تشويش قناة العربية المدعومة سعوديا ضد وحدته الترابية,2
ساعات متواصلة بدون كلل ولا ملل,2
و انتي تشبهين الشمس تنيرين الكون بضياءك,2
سيفتخر بكم رسولكم يا خير أمة اخرجت لناس,2
لايستحق البطاقة الصفراء,0
الأسوأ هو أن يعاد الشعور الذي جاهدت طويلا أن تتجاوزه أن يباغتك الموقف مرة أخرى من حيث لا تعلم,2
هاء نسيت بلي حنا فناظور معندناش ملعب اصلا,0
حدراف لاعب كبير وغادي يبقى كبير وبلاصتو كاينة في الرجاء وفي المنتخب دار خطأ آه ولكنه لاعب أكثر من رائع,2
مادمت تشاهد بسمة أمك فالحياة لاتزال جميلة,2
و لله الحمد بعض المرات يبقى فيك الحال على شي حاجة لكن مع مرور الوقت تدرك ان ابتعادها كان فيه خير كثير,2
يارب قد طال انتظاري فبشرني بما انتظره منك عاجلا غير آجل إنك على كل شي قدير بجاهي النبي محمد عليه الصلاة والسلام,1
و ما المانع,1
هادشي لي عطى الله,1
ياحبيبي شرة العاشق كبيره كل ما زاد الغلا زاد العتاب,2
تا نتي قريتي الساعة الاضافية فظلام,1
الله يفضح امكم فضحتونا,0
البيت الأبيض يوصي برفض قرار ضد دعم السعودية,1
يا حقير,0
القصة الكاملة,1
ماقدر اعيش العمر لحظة بدونك,2
يا ناعم العود يا سيد الملاح,2
للأسف من لم يجد شيئا ليفعله اليوم يصبح مغني,0
فكر مزيان و خد قرار,1
سؤال محير بقدر سهولته تتجلى صعوبته لا ارى مكان سامتنع عن زيارته ان اتيحت الفرصة,1
حتى من سواعدة كيتشكاو منك ابادة,0
الا يكفي ان نسبة مرضى السرطان اعلى نسبة عالميه بسبب مفاعل الاسرائيلي و بكل جهل نضعهه في بلدنا,0
الحافيظي كيعطي الذهب,2
أفضل الدعاء لله سبحانه وتعالى أخفاه وأخشاه ادعوا ربكم تضرعا وخفية,2
انتهاكات الانقلاب القمعية فى جامعة الاسكندرية وصلت مداها باصابات واعتقالات,0
استغفر الله العظيم,2
صباح الخير لعائلتي و قبلة على جبينهم صباح الخير لشخص عن ألف شخص و ألف معنى صباح الخير لكم متابعيني و للعالم أجمع,2
فضل و نعمة,2
كن بخير,2
اجمل حاجة فيك يا الهام انك صريحة و واضحة,2
الحرية لمن طلب بحقه,2
عيب تكذب,0
بخير الحمد لله سيد الحاج,2
الله يستر,2
كرسي واعر,2
سنة سعيدة لك استاذتي أيضأ,2
ولغيرك قلبي مايميل هذا وعد,2
يد واحدة في ارتكاب جرائم وحشية جديدة ضد شعب مصر فى تظاهراته السلمية,0
الله يطول فعمرها,2
لا عليك احيانا نحتاج ان نطلع اوجاعنا دموع و نخفف على ما بداخلنا من الم و حنين,1
الانفلات الامني بسلا ولى تيخلع شكون المسؤول على المصائب,0
روح انت و بلدك و الاخوان المسلمين و كل شرقك المقرف بعيد عنا لا تذكرنا,0
ممكن استشارة,2
تصبح على خير ا دكتور,2
في امان الله وحفظه,2
آمين يا رب العالمين الله يسعدك,2
كيا تقدم سيارة كهربائية بتنقية الشحن اللاسلكي,1
حتى العربية لي كيهضر بيها زوينة,2
ان كان المطبعون عرب مسلمون حقا التطبيع مع الكيان الصهيوني المحتل هو حرام من الكبائر بنص الآية الكريمة,0
أثينا مصرع مواطن تحت عجلات مترو أومونيا,1
أنا شخصيا غير موافق,0
قلبي وجعني اين مثل هاذي الرجال اين ياناس انفخت قلبي على الصباح,0
ولروحك السعادة,2
شكرا لكم على بذل جهدكم المتواصل بوراهي,2
بارك الله فيك اخي,2
نحن لا نتغير ولكن نبتعد عن كل من لا يعرف قيمتنا,1
لانك شديد التحمل ظنوا انك لا تشعر,0
لا خير في أمة اضطرت نساؤها أن تتمرجل بينما رجالها تثأنت,0
رأي الناس فيك لايهم المهم هو رأيك انت حول نفسك,1
أجمل البشر من يصنع فيك ابتسامة حين يعلم انك بحاجتها,2
سطر متابع ألف شكر لكم جميعا على دعمكم,2
كل واحد منا عنده اخطاء وعيوب وعنده مميزات فنحن بشر والكمال لله وحده,2
أنا جاهل في العتاب أنا عتابي غياب,0
توصلنا في هذه اللحظة بمجموعة من الكتب المهمة من طرف السيد مشكور على مساعدته ومساهمته وعبره الشكر موصول للجميع ولكل تويتوما شكرا لكم وصولا للتقدير و الإحترام,2
آخر الزمان هو هذا,0
تعيب الناس أنظر الى حالك البئيس,0
اكيد انا وحدة منهم,1
للأسف هذا دليل على سواد قلوبهم,0
في كل بلدان العالم يخرج الشعب لمساندة النظام أو المطالبة برحيله,1
شكرا لك هذا من اصلك اخي الكريم و مصر لا تقل محبة و كرم تحياتي,2
في الانتظار,1
علي الجمييع يارب اسعد الله صباحك,2
رحم الله الفقيد,2
على امل ان يكون لرقاص السامبا نصيب من هذا العرس دمت طيبة,2
ربي يخليك يا مكنون الدفئ و الحنان,2
ماشعرت حتى سبيتو عصبني,0
شكرا,2
أبرياء جدد تسفك دمائهم في بلاد الكفار,0
ياااا رب اميين,1
قصص مروعة تعكس همجية همجية لا يمكن حصرها في كلمات العزاء الوحيد لهؤلاء الضحايا,1
اللهم امين الله يجازيك بخير امامنا كنت محتاج هاد الدفيعة,2
هادي البدايه ومزال مزال,2
عندما يتعرف الشخص على عيبه ويدركه ويدرك أخطاءه يبدأ رحلته فى التخلص منها من خلال عدة محاولات,2
هذا سهل إن لم تكن موظفة لن اتزوج,1
ما موضوع هذا الكتاب,1
محطة القطار أكدال الرباط,1
يا مجرمة,0
عرفتي ملي شفت جواب شبعت ضحك,2
وعمرك تقدم تهديد منين تكون غضبان ومقلق,1
جزاك الله خيرا اختي الكريمة,2
يسعد صباحك و كل اوقاتك يا طيب,2
تفائلوا فالهموم متل الغيوم ما تراكمت الا لتمطر,2
الحمد لله على فهمك,2
الله يحفظك,2
صافي اللي بغيتي على خاطرك,2
ليس كمثله شيء وهو السميع البصير,1
الحمد لله هاد القنوات ديال السعودية كينقلو الدوريات الكبرى,2
سهيلة منذ نعومة اظافرها وهي فنانة,2
أنت أجمل أشيائي التي اخبئها بداخلي,2
ماشاءالله,2
مايكون معاك باس,2
غا ضاحكين,2
هم السابقون و نحن اللاحقون,1
منكر ما بعده منكر,0
اثناء زيارتي لمدينتي,1
امين يا رب العالمين,2
جميل جدا,2
واهجريني صرتي لغيري تميلين,0
ملاحظتك في محلها سواء باللغة العربية او باللهجة المغربية,2
و الله يلاقينا مع احسن منا,2
فكرة جميلة لو تم دمج الاسماء فيما بينها نحن لسنا ضد الاسماء الفلسطينية و لكن انصافا لمن كانو سببا في ازدهار المنطقة,2
اودي ماتخليو حد يجمع الحسنات,2
على الوداع ان يكون سريعا كي لا تعطي الفرصة للأخر ليرى الدموع في عينيك,1
السلام عليكم,1
لا يعلم ما فى القلوب الا الله,1
امين بركتي ليلتي الغالية,2
ثق بالله فهو لا يخذل عباده,2
حافظ سوارك,1
يسعدني اكثر ان لا تصدر احكامك الخاطئة في حق الناس قبل فهم قصدهم,2
أنا مسؤول عما أكتب وانت مسؤول عما تفهم ولست مسؤولا عما تشم خصوصا إذا كنت تقرأ بأنفك,1
انا أعيش ايام صعبة أيضا لست وحدك,0
آمين,2
مساء الخير,2
لله يجيب لي يقول الحق,2
الانقلابيون فعلوا ما لم يفعله كفار قريش,0
حفيظ دراجي مبلوكيك,1
دقيقة صمت حبايبي,2
اكتب اجمل سطر قريته,1
امين,2
الى الحكومة و ما جاورها كيف تريدون من الشعب ان يرضخ لمطلبكم بالتراجع عن من اجل مصلحة الوطن و انتم من واجهتموه بآذان بلاستيكية عندما كان يطالبكم بالتخلي عن تقاعدكم السمين ام ان الوطن لنا وحدنا و خيراته لكم فلتستمر المقاطعة حتى اشعار اخر كلكم مسؤول و كلكم مسؤول عن رعيته,0
شكرا شكرا في الحقيقة أنت من تستحقين ملايين التحايا,2
كل عام وأنتم بخير بمناسبة حلول شهر رمضان شهر البركة والرحمة أعاده الله علينا وعليكم بالخير,2
سعيد بمروركم,2
لا قلب و لا ضمير,0
عسكري آخر الزمان,0
حدائق القشلة متنفس عراقي لاستقبال المثقفين,1
مساء السعادة يا اخي احمد,2
من الخطئ ان نحكم على شخص بمجرد قراءة العنوان بدون ان نتطرق الى محتوى الموضوع,0
الله يكتب علينا مكاتب الخير,2
انا ذاك اللي عجز يلفته غيرك,2
التعرف عن كثب على الثقافة الكويتية,1
لم يعد مجديا أي حديث مع بشار,0
اللہ يكمل عليك بالخير اختي,2
ه غي ضاحكة معاك,2
شدوه البوليس واخا و علاش عباد الله كاتصور فيه و تبارطاجيه علاش يبارطاجيو لاكارط ناصيونال ديالو الخ,1
حالنا يرثى له اصبت و الله,0
النحس الرجاء و نهضة بركان و حسنية أكادير في مجموعة واحدة,0
لا اله الا الله,1
وا اسفاه,0
آيت ايدر لم أطلب العفو عن توفيق بوعشرين,1
عالم لا يطاق و ألم لا يطاق,0
لي دار الذنب استاهل العقوبة,0
إهانة للشعب,0
أعجبني واحد الإعلان دانماركي على الخريطة ديال استفزوا فيه الكيان الصهيوني ياريت يكونوا اشهارات او إعلانات عربية مماثلة,2
الله يسر امورك,2
اللهم أعنا على ذكرك و شكرك و حسن عبادتك,2
منيب نهاية الإسلام السياسي قريبة وديمقراطية المغرب صورية,1
على الأقل لن ننهزم ب لصفر يافشلة,0
مبرع مع راسك,2
اللاعب مستمر مع ناديه لم يفسخ عقده,1
يارب ٱمين,2
صباح السكينة وطمانينة يا اخي سمير,2
اللهم امين ختي ولك والجميع,2
باهت الليل من دونك الله لو ليلي عيونك,0
اشجع الوداد فقط لأن والدي يحبه,2
أهل الحق سماهم الله المسلمين,2
نظام الهيما لمكافحة التصحر,1
مما جاءفي كتاب فك الله اسره انظر مثلا كيف لو أن المليارات التي قبضها المخلوع صالح أنفقوها على الشعب اليمني مباشرة وكيف لوأن المليارات التي أعطوها السيسي وبن علي وبن جديد وحفتر أنفقوها مباشرة على الشعوب ودعوها إلى الله لا إلى القومية ولاإلى التعري والدياثة والسياحة,1
جلدة تنتظر سيدات في مظاهرات السودان,1
الله ينورك بانوار النبي اخي الفاضل الحمد لله على نعمة الايمان,2
تحية لكاتبتنا,2
صباحك طمئنية و رضى ورحمة,2
يسلمو عيونك,2
الصدق منبعك يا ابن الأحرار,2
حبيبة قلبي نتي تستاهلي الجنة و نعيمها غاليتي,2
ما احلاه من اجمل ما خلق فى هذه الدنيا,2
اللهم في يوم الجمعه أفرحنا بخبر جميل و أشف كل مريض و أرحم كل ميت و أشرح صدورنا وأجعل هذه الجمعه أستجابه لكل دعاء,2
الله أحن عليك من ألف كتف ومن ألف سند الله يبقى حين لا يبقى أحد,2
هذا من طيب اصلك يا ابن الاصول وباذن الواحد الاحد منصورين,2
تشجيعك على راسي,2
سوق العمل في يحتاج إلى ألف يد عاملة جديدة,1
السلامة يا آلله,2
ممثلة تقدم مشاهد خليعة يستضيفها رجل دين يكرمها,0
عندي ميول لامريكا اللاتينية دبا نشجعهم واحد بواحد هادوك رعاة البقر القتالية و الكورة ديالهم بوحدها,2
ولا أحد غيرك,2
شرب فنجان قهوة,1
اما في الحياة العامة فهو يتصرف وفق قدراته وميزاته ونوع عمله وهذان الوجهان المتناقضان غالبا ينتج عنهما اشكال لا حصر لها من الرياء والخداع و القمع على العرب أن يفهموا التجربة اليابانية فسيطرة العسكر على الشعب هي سبب دخول البلاد في حروب مجنونة,1
كاميرا خفية في الانحطاط الاخلاقي,0
الغالي يرخاص ليك تستاهلي كل خير,2
في الوقت البدل الضائع,1
كنا مغاربة و بقينا مغاربة و غا نبقاو مغربة و إن الفرج لقريب,2
مبروك و الله يفرحك بها,2
منتخبنا الوطني في كلمة واحدة فرض على العالم الرياضي احترامه,2
أنا الدي يسعك صدره إذا ضاقت به الدنيا,2
الله يكبر بيك,2
أنا و ليلى رائعة كاضم الساهر,2
مع هاد السياسة اللي غادين فيها كلشي ممكن,1
واصنع جميلا في الحياة فإنما باللطف نبلغ في القلوب مقاما,2
دوم يا رب,2
حتى الضباب زادها جمالا,2
يا قلبي اللهم نصرنا علي انفسنا اللهم قنعنا بما رزقتنا وبارك لنا فيه,2
واش غايدوزوا الكتابي و الشفوي,1
حسب حذيث الصحافة,1
الثقافة السياسية وتسطح الدبلوماسية,1
الله يرحمها و يرحم جميع موتى المسلمين,2
صعبة جد معقدة,0
مصائب قوم عند قوم فوائد,1
