tweets,type
اللهم أنزل شفاءك وعافيتك على جسد كل مريض واجعل العافيه تسري في نبضات قلوبهم يا حي يا قيوم,2
لا زين لا مجي بكري,0
التجاهل عقاب لذيذ,0
أساس تقدم المجتمعات هو العلم والمعرفة والمجتمعات التي لاتقدر العلم والمعرفة لايمكنها بناء حضارة,1
حامل اللقب اخر سنوات يتم تجاهله,0
إني أراكم من بعيد,1
غبي,0
المجاز حسنا لك ذلك,2
الله يعطيك الصحة,2
لؤلؤة القصر الملكي لالة خديجة رفقة والدها جلالة الملك محد السادس حفظه الله ونصره,2
جميلة و عظيمة بوجودك فيها يا جميل,2
فعلا صدقت كثر الله من يراقبنا حبا,2
اش هاد الباطل,0
إعتني بها ياصاحب النصيب فآنا ما زلت آحبها,2
و انت من اهل الجزاء بعض مما عندكم,2
هدأت المساجد وقلت الصفوف ورجعت المصاحف إلى الرفوف وبقيت هناك ثلة خفية نقية جعلت حياتها رمضانا دائما مصاحفهم لا تعرف الغبار والهجران خطاهم إلى المساجد لم تفتر زادهم رمضان قوة فوق قوتهم أول ئك الذين هدى الله فبهداهم اقتده,1
هدف رائع من باولو ديبالا دقيقة,2
مونتاج زوين,2
امنيتي هي أمنية كل عام توقف الحروب والعنف في العالم,2
ربي يعزك و ينورك و ينصرك خويا لعزيز,2
اللهم سواريز ولا بواتينغ الفاشل,0
عيد ميلاد سعيد عصام,2
صحيح عندك الحق,2
أمين رب العالمين,2
لتنشيط الدماغ,1
موقف جميل,2
النظر الى الخلف هي سبب الفشلكلامك في الصميم اخي,2
يظن الإنسان منا أنه يعرف من حوله جيدا,1
فهو لم يذهب ولم يأكلوا شيئا من الطعام لأنه أصلا رجع من باب الكهف ولكن أكثركم لا يعلمون,1
سيدة أعمال من تتبرع بأكثر من مليون دولار من أجل التعليم,1
ترامب يأمر بحظر طيران بوينغ ماكس,1
من غير ما تشرحي ليا احبيبة انا عارفة بانك لم تسيئ لهدا الانسان و اعرف انكي لا تعرفينه هو سوء ظن وسوء فهم حصل و لا رد لقضاء الله و الصراحة ليا نصيب في ما حصل و انا اعتدر للجميع,2
عزائنا لأهالي ضحايا فاجعة القطار رحم الله الموتى والهم ذويهم الصبر والمصابون نسأل الله لهم الشفاء,2
الله يكتر خيرك,2
امين يا رب,2
مالقيتش ليه وصف صراحة,1
اللهم اغننا بحلالك عن حرامك وبفضلك عمن سواك,2
مسلسل جديد من الصراع والتصريحات النارية بين ءال عيوش وءال الحدوشي وجماعته,2
معارضون جزائريون ينتقدون قرار الرئيس بوتفليقة تمديد الولاية الرابعة,1
جديدة بالشوارع المغربية,1
ما دمت بدون زواج فلا زالت الحياة جميلة,2
الحمد لله على كل حال ربي يدوم الصحة والعافية انشاء الله على الجميع,2
ابسط فطور من مراكش,1
الكاريزما توضع في المقام الاول عاد نشوف الاقدمية,1
بلى بلى لي تزادت ف الراس عندها قيمة,1
الله يبارك فيك,2
جعل من يقرا التغريده للجنه يارب,2
الشكر لكم انتم على هذه المبادرة النبيلة التي اتمنى ان تحقق اهدافها المرجوة شكرا,2
صفه بكلمة,1
انني ارى العكس تماما,0
المضمون فيك الله يحفظك ختي,2
بلا قصدت لها بالعكس فهمت,1
اشتموا و قلوا أدبكم خلينا نتعرف على اخلاقكم,0
ألم أقل لكم إنها ممارسة فاضحة و غير مقبولة,0
لا تحاول البحث عن حلم خذلك,0
اللهم امين يا رب العالمين,2
سبحان الله وبحمده عدد خلقه ورضا نفسه وزنة عرشه ومداد كلماته,2
للطلب يرجى التواصل,1
ان شاء الله يا رب,2
للي ما يحب المغربية يبعث له حمى,0
هل من لقاء مرتقب بمدينة اكادير ضمن برمجتكم وشكرا,2
صباح النور اية,2
اعرف انك تعرف,1
آنا لا آراهن على كلماتي لك مهما كان جمالك آنا آراهن فقط على قلبك على الصوت العميق ذاخلك الذي يجدبنا لبعضنا دون سبب محدد,0
اش هاد الوقاحة,0
شكرا لهلا يخطيك,2
بزاف د الحب,2
الله يفرح قلبك الطيب,2
أرجو منك أن تخبرني برأيك عني بصراحة فأنا لن أتعرف على هويتك,2
مشاء الله عليك جمال اناقة من فانز سهيلة بن لشهب,2
الحكم ب سنة سجن لناصر الزفزافي ونبيل احمجيق أبكيك يا وطن الحگرة والظلم والجبروت لولا عائلتي لغادرتك قبل شروق الشمس,0
اتفق و بشدة رشيد غلام خامة صوتية فريدة من نوعها ممزوجة بالرقي و اتفق اكثر انه لم ينال حقه في الشهرة و الدعم الفني,2
الواقع يفرض علينا ان نكون حازمين في قراراتنا الكلام يبقى مجرد كلام مقارنة مع ما يعيشه المرء,2
من يتجاهل الاساءة ليس عاجزا عن ردها ولكنه عرف قدر المسيء فتجاهله,2
نكات العرب على توقف و عن العمل,1
رأس مالي محبتكم وتشجيعاتكم أستاذي منكم أتعلم,2
لواه اذا كان من يستحق الشكر فهو انتم,2
هناك أفكار غير صحية عديدة روجت لها الأفلام الرومانسية في هوليوود قدمت نسخة خيالية عن الحب لكنها في الواقع تعد عشقا مستحيلا,1
في كل ليلة لك مع البال ميعاد,2
هادي هي الدنيا,1
انا غي دريويشة,2
تماما,1
الله اكثر خيركم,2
و زد عليها الله يسمح ليهم الاستقبال الزين لي كيديرو في الصيف,0
يا سلام على مراكش الليل,2
يا للاروعة,2
السلام عليكم ايها الاخوة والاخوات,2
الحب عندما يكون رزينا يصير شبيها بالواجب,1
شكرا بزاف خويا وربي يبارك فيك ويسعدك,2
عمرك تندم حيت درتي النية,2
إذا لم يتبعوا هذه البنود فمن المؤكد أننا سنلغي العقد هؤلاء القوم معروف عليم التماطل و الغش,0
الله يشافيها ويعافيها يارب,2
بارك الله فيكي حبيبتي الغالية وجزاكي الله خيرا,2
ثقة مبالغ فيها,0
كاع للي عندو شي ختو ولا مو ولا بنتو ماقدرش يحكمها ويكون لها رجل بمعنى الكلمة وبلا كرامة ولا نخوة تتلقاه معقد من المغربيات ويكب نذالته ويسيى للمغرببة في مواقع التواصل امام للي يسوى و للي مت يسواش عزبزي المغربي بدل ما تطعن شرف بنات,0
اه مزيان,2
باش ماتجرحش ليا المشاعر,1
يا واسع الجود و الفضل و المنة أرزقنا ما نتمنى,2
صراحة عندنا زين فالمغرب,2
هو الذي سيطر و لكنه انهزم هذا هو حال المنتخبات العربية و من ورائها الانظمة و الدول العربية,0
عندو قلب و قلبه زوين,2
مايكون معاك باس اخويا,2
عندما يسافر وزير في الحكومة ويصطحب معه ابنته التلميذة تحت صفة مستشارة له في زيارة رسمية وتتقاضى راتبا شهريا من ميزانية الدولة موظفة شبح أمام مرأى ومسمع وصمت الجميع فلا يسعني هنا إلا أن أتهم الجميع حكومة وشعبا بالتواطؤ في نهب المال العام وصرفه في غير محله,0
سبحان الله وبحمده سبحان الله العظيم فائدة لغوية الغزل ما تغزله المرأة بمغزلها قال تعالى ولا تكونوا كالتي نقضت غزلها من بعد قوة أنكاثا تشبيه لحالة من يفسد أعماله الصالحة بحالة المرأة التي فككت غزلها من بعد قوته,1
ان شاء الله غنعاودوها غدا,2
رحمها الله واسكنها فسيح جنانه,2
الأخلاق هي الروح التي لا تموت بعد الرحيل,1
عندي بزااف من العائلة كيلبسو هكا,1
فرحت مين راني فانز ليك,2
جمعتك اطيب اختي,2
الأستاذ هي حرفة قبل أن تكون مهنة,1
سمحليا,2
هذا الشخص يسعى لنشر الفتنة فقط فكل تغريداته محرضة على الفتن ومعاكسة للعقل البشري,0
صباح الحب,2
الظاهر عقلك تافه من اصحاب العقول المقفلة,0
صباح السكينة وطمانينة يا اخي سمير,2
ليتني خلقت آكثر سطحية أقل ذكاء لما كنت لمحت كل ما يجري حولي بأدق تفاصيله لما كنت شعرت بما يجري من تحت قدمي ليتني خلقت دون حاسة الشم لكي لا أشم رائحة كذباتك على بعد خمسين قلب,0
فأردنا أن يبدلهما ربهما خيرا منه زكاة وأقرب رحمة ليس كل ما نفقده خسارة قد يريد الله تبديل النعمة بخير منها,2
أحبك ويشهد لي خافق ما عشق غيرك,2
مبروك العيد لجميع الإخوة و الأخوات إنشاء الله بالأفراح و والمسرات ؤ باش ما تمنيتو يارب,2
نتا تعرف كثر طبعا,2
اودي السلامة صافي هادشي من علامات الساعة,0
وزااايدها بساعة الصيفية في فصلالشتاء بغيت لك الغرق في الغرق,0
كل شيء تغير و إختلف,1
حيا الله اصلك يا قمر,2
تذكير بصيام الأيام البيض ابتداء من غدا الإثنين,1
تحتاج الى دقائق لتعطي الاخرين انطباعا عنك ولكن قد تمضي عمرك كله لتغير ذلك الانطباع,1
الله يشفيه شفاء لا يغادر سقما ولا ألما,2
هادي زوينة,2
نريد تغطية عن هذه الجريمه ربما يكون للمجرم خطيبه,0
فاشل,0
هذا يسمى احترام عادات وتقاليد البلد المستضيف وليس فيه شيئ غريب,2
هل يوجد تلوج بإفران حاليا,1
شكرا,2
مزيانة للبلاد,2
ا مالك على السيدة حشومة قرا اشنو كتبت بشوية لم تقلل من شأن المغرب,2
باقي ماكملتش المجلة كاملة كانقرا بشوية بشوية قريت واعر بزاف و فهمت برافو في انتظار التتمة ف العدد المقبل,2
يسعد أوقاتكم,2
اغيب عنك وخاطري عنك ماغاب,2
و الله سهيلة حالة صعبة,2
مغامر يحلق مع صقره في السماء,1
اودي صباحك مبروك,2
الجمال هبة من الله,2
الى يضحك عليك بنادم تعيق ليه و لكن الى يضحك عليك راسك هي اللي صعيبة,0
الله يعفو علينا من هاد البلاد الكحلة,0
من فضلك ممكن إسم العمل,2
يوما ما ستفتهم جيدٱ آن الدنيا تدور ثم تعود وتقف عندك ل تفعل بك مافعلته بغيرك تذكر ذلك جيدا يامن يؤلم غيرك وتمضي وكآنك لم تفعل شيئا,1
اصبحت أرى في أعين الناس عيناه,1
ما ناقصينا فتن اللي فينا يكفينا,0
نعم الأسف واقع مر بكل ما تحمله الكلمة,0
جعلنا الله واياكم من اهلها اخي الفاضل بارك الله فيك اخي الكريم,2
شكرا,2
ملي ولا العثماني رئيس للحكومة فإن كلشي ممكن الحدوث,1
السلام وعليكم أمين رغيب بغيت نشكرك بزاف على الفيديوهات لي كاتلوح ديما وتوحشناك تلوح شي حاجة خرى,2
اودي غي دير مزيان و الرحيم الله,2
تجاوز وسامح,2
شكرا لتجاوبك,2
قصة الأندلس من القصص لي كتعجبني بزاف خصوصا الفترة ديال عبد الرحمان الداخل,2
عمري فحياتي ننسا هاد النهار كانطلب المساعدة,0
عيد ميلاد سعيد محسن الله يرزقك من حيث لا تحتسب,2
العثماني يؤكد استعداد المغرب لتقاسم تجاربه وخبراته مع العراق في عدد من المجالات,1
الله يكمل عليك,2
عش لنفسك عش لشغفك عش لهدفك قاتل و كافح من اجل نفسك و من اجل احلامك الى متى سوف تبقى قلق كيف يفكر الناس فيك,2
القصة بإختصار,1
باعوا أنفسم بحفنة من المال والجنس,0
امين يارب,2
اللهم إجعل لنا مع نسمات هذا الصباح رزقا وسعادة وعافية,2
شركات ودول تتخلى عن بوينغ ماكس,1
مبارك عليكم الشهر الفضيل تقبل الله منا ومنكم صالح الأعمال,2
حسبنا الله ونعم الوكيل فيكم,0
شقيق امسية سعيدة,2
بنشماش حزب البام يحتاج إلى انبعاث جديد,1
ضعف إيمانك بعد مارأيت حبل المشنقة ملتفا حول رقبتك,0
شكرا,2
نعم هذه هذه القلوب النقية,2
امين يارب جزاك لله خير يا رب,2
أعتقد أن الناس أصبحوا يكذبون بكل صدق,0
اللهم ارزقنا قلبا سليما مساء طيبة وقلوب صادقة,2
الساعة المشؤومة اترت سلبا على كل الناس الصلاة العمل النوم,0
الحب هو احترام وتقدير المتبادل,2
سوريا تعرضت لمؤامرة والامر المحزن ان ولاد سوريا انزلقو في المؤامرة,0
نعم صحيح قصدت صعبا على الشخص المصاب لانه لا يعلم و لا يدري ما يفعل اما ان كان من ياخذ بيده و يذهب به للراقي ليكون سببا في شفاءه فهذا جيد و الله هو الشافي,2
لا يفقهون في الحب شيئا,0
لٱ حول ولا قوة الا بالله اش هاذ المنكر,0
الله يهدي ما خلق,2
ناعمة انتي ك غصن ياسمين مدهشة ك عين طفل ضغير تشبهين الورد و كلماتك عطر و ان ضحكتي يصبح الورد يشبهك,2
تعجز الكلمات عن وصف هاد الشعور اقسم بالله الا اختالطات المشاعر ديالي فرحان بكم لأن هدش كيغير حتى النظرة ديال التلميذ للإنسان ويقول شوف راه الناس فالمغرب كامل كيفكرو فيا وكيعانوني وكيزرع فيه حب الخير تحية عالية لكم من اللخر,2
مؤسف أن يتمنى الإنسان حقه,0
هذا من طيب خاطركم تحياتي,2
يانسيم الصباح سلم علي,2
فكر مزيان و خد قرار,1
الله يحفظك خويا,2
ونعم الأخوة,2
اللهم امين و لك بالمثل ان شاء الله,2
الله يكون ف العون حاسة بيك,2
لن يتم ذالك لاتوجد إرادة سياسية بالمغرب واللوبي الفرنسي سيضغط من أجل فشل الحملة,0
الله ينورك يا غالية,2
أسوأ شعب,0
لن يقوى علينا الضلام مهما إشتدت ظلمته تبا لكم ولي إنتهاكاتكم وطغيانكم لن تنالوا منا إلا ابتسامتنا ومزيدا من العزيمة والإصرار ووو تحية لكل الآطفال الدين لا يعيشون حياة الآطفال صدق الثائر تشي جيفارا الذي قال التاعسون هم مصدر القوة في العالم,0
نت درت علاش تاخد العقوبة و انا مالي,1
اذا وصل اخر الشهر,1
أول مرة كيموت لي واحد الإنسان كنعرفو غا من خلال النت إنسان عرفتو و عرفناه بالتغريدات و الرسائل ديالو إحساس مرون و مخربق و جديد عليا أنا شخصيا نتمناو ليه الرحمة و كنتمناو الصبر للعائلة ديالو الحياة قصيرة عيشوها فرحانين بالبساطة لي فيها و بزاف ديال الحب,2
للاسف واقع,2
ظاهرة تستفحل المجتمع العربي,0
واضح انه سهى تعاني من الارق كذلك,1
من المؤسف ان هذا حالنا اللذي نعيشه الان,0
الله يعطيك الخير يارب العالمين خويا,2
فكرة جميلة,2
الى حين التأكد من صحة الخبر يبقى مجرد كلام,1
كانت أيام زوينة,2
العناق فيه و فيه,1
لي دارها بيديه يفكها بسنيه,1
الله يهدي الجميع,2
عيونك سماي وقلبك اكبر اوطاني,2
الله يرزقك الرضى و القناعة و العفو و العفاف و الهدى والنور و التقوى و الهداية,2
تنقضي أيامنا دون أن نشعر,1
مع انتشار الوقاحة أصبح الأدب ملفتا للنظر,0
احب الشوكولاتة بجميع أنواعها,2
اعتقاد خاطئ,0
سلمت يديك وتفكيرك حفظك الله ورعاك,2
سأطبل كما يحلو لي,2
الأجر مع النية الحسنة و صافي صباح الخير,2
تماما هو هذا,2
سير الله يمسخك قول امين,0
جميلة و عظيمة بوجودك فيها يا جميل,2
الله يدوم المحبة مع القلوب الصادقة الصافية الوفية عاش مول النية ولا عاش من خانه,2
هده تغريدتي الاولى,1
الجنة اللتي ستدخلها أنت لا أريد دخولها جهنم أشرفلي وأهون علي من أن أكون مع أحد الوهابيين المنحطين,0
طيب احترم نفسك انت و عرف ان الصالح و الطالح في كل مكان حتى في بلدك,1
لا ترافق اليائسين و تحاور الفاشلين,1
دريس ماعنديش الگانة لهادشي غير نصيحة عمرك تدعي على شي واحد ببحال هادشي ماعرفتي فين تخرج,0
صباح الورد لأطيب ناس,2
كل منا له فقيد علمه معنى الرحيل,0
من جنازة الفتاتينن الذين قتلهم المجرمين الارهابيين أمس,0
أصبت و الله ياليت كل عابر يعتبر,1
الله يسخر,2
السلام عليكم ورحمة الله وبركاته حسب بلاغ لوزارة الأوقاف والشؤون الإسلامية المغربية فإن فاتح رمضان هو يوم غد الخميس ان شاء الله وفقنا الله جميعا لطاعته,2
جميلة بشكلها شيء يبعث على الجمال وبس,2
كلشي ممكن,1
وخالق عيونك الحور مابعد حبك حب,2
جميل جدا ابدعت,2
اللهم فرحة تنسينا ما مضى وأنقضى وترسم ملامح الفرح لأيامنا,2
على قدر نية الانسان يرزق اللي مشا للزواج بنية الاستقرار و طاعة الله و تكوين اسرة و راحة البال فالله سيرزقه دلك واللي مشا بغرض اخر للترفيه و و و و فله ما راد,1
مهما ساء حالك فاحمد الله فهناك دائما من هو أسوأ منك حالا الحمدلله,2
واذكر ربك إذا نسيت,1
تحية لتشجيعك وتحية لروحك الطيبة,2
حافظ على الشخص الذي يطمئن عليك دائما,2
قانون الطبيعة يقول لكل بداية نهاية الحياة,1
اسوأ نظام نوم مر علي بحياتي,0
رسالۃ تفائليۃ إطمئن لعل في لحظۃ ما يغير اللہ گل الذي تظنہ لن يتغير,2
الله يهدي مخلق,2
كيف حالك يا عزيزي,2
على السلامة,2
السجدة التي يحضر فيها قلبك لا ترفع رأسك منها حتى تسد جوع روحك,2
أنا وعائلتي الصغيرة,1
كالعادة اكتبلك ويتأثر غيرك,0
حبابي أغلى الناس شكون كيتسنا الجديد يبان هنا,2
ابسط حقوق العلاقة وانبلها الستر,2
اللهم اجعلنا ممن تغيرت أقدارهم للأحسن ولاتحرمنا من ما نطمح إليه ولاتصعب علينا أمرا وارزقنا حظ الدنيا ونعيم الآخرة,2
مصرع شخصا في تحطم طائرة إثيوبية,0
السبب في هذه المجزرة البشعة,0
الله يعطيك الصحة,2
الحب والتسامح,2
الهضرة ماتشري خضرة حتى نجيو للتطبيق,1
الوعي مكاينش عند المعظم إلا القلة القليلة وخا إكون الإنسان مثقق ولكن كتبادر منو تصرفات غير طبيعية,0
كثرة الكتمان تجعل قلوبنا تتأثر من آي شئ,0
قتل و تعذيب المصريين في مبني المخابرات بالوكالة عن أمريكا و قتل إخواننا الفلسطينيين في غزة,0
انا ملامح فرحتي كلها منك,2
الحسد والحقد و النفاق والكذب,0
سأل رجل أحد السلف كم نقرأ من القران قال ابن تيمية على قدر السعادة التي تريدها,1
مزال الخير,2
الله لا اله الا هو الرحمان الرحيم,2
تقبل الله منا و منكم صالح الاعمال,2
نتا لي ضيعتي الفرصة ديالك,0
من يطآرد عصفۆرين يفقدهم جميعا ۆ للقارئ حرية لفهم,1
قصدك تعصمه عن الاتهيار و التمزق كلام جميل و في الصميم,2
جميل,2
بففف عيد ميلاد سعيد بعدا واخا معطلة,2
الله اعلم,1
وليكن ما تريد يا سيدي,2
فكرة جميلة,2
لا تخبروني عمن يكرهني أو يتكلم عني اتركوني أحب الجميع و أظن أن الجميع يحبني,2
لقاء جميل جمعنا بمعالي محمد الأعرج وزير الثقافة و الاتصال المغربي في المعرض الدولي للكتاب الدورة بالدار البيضاء,2
عطيني شوية وقت,1
أحسنت القول أخي,2
ليت ربي خلق لصافي النية علامة,1
في حالة إستمرار لعبهما قطعا الفريق سيقصى من كأس الملك و رابطة الأبطال الحقير سولاري لم يعطي نصف,1
امين ربي يخليك,2
عداوة على الإسلام الله يذمرهم,0
بادرة طيبة و محمودة الله يرحم الفقيد و يسكنه فسيح جناته,2
انت ما تتمنيها للبرازيل و تقولي دمت بخير عن اي خير تتكلمين من ترينه انسب,2
قراءة ممتعة,2
روعة اللهم صل وسلم وبارك على الحبيب,2
انسوا أوجاعكم بسجدة طويلة لله فالصلاة دواء نقي للقلوب الوتر,2
الله يحفظك مرحبا بيك,2
فيلم أكثر من رائع و القصة جد مشيقة شكرا,2
اخ عزيز و غالي,2
علي الجميع يارب,2
صباح الخير يا فنان,2
الفرح ضحكة أمي,2
رسميا إقالة خورخي سامباولي من تدريب منتخب كما كان متوقعا,1
المغرب لا يباع ولا يشترى يا وضيع المغرب حر في سيادته وسياسته الخارجية,0
لا لا بالعكس هكاك افضل من ناحية التكاليف المادية وفنفس الوقت عارفين الحسنية وبركان تبقى كل الاحتمالات واردة لكن ان شاء الله التاهل من نصيب الخضرا,2
بصراحة هيا لي خلاتني نتراجع عن هداك القرار بعد ما سولات ناس في المجال وطلعنا بهادي النتيجة للاسف في بلادنا مكاينش فرصة لينا حاليا,0
كاع لمغاربة صوتهم زوين,2
احترام المسافة القانونية,1
انا كنعرفك ومتشرف بمعرفتك,2
اذا سخر الله لك سببا لبلوغ مقام ما فلا احد سيمنعك ام انني مخطئ,2
عن جدارة و استحقاق,2
تستاهل اضعافها و تستاهل كل الخير,2
لكن وقت الجد يعرفون من اين تؤكل الكتف,2
عيونك يا حبيبي نور وصوتك موطن بالغربة,2
