tweets,type
أجلس وأشاهد نفسي وأنا أتحول لشخص غريب شخص يعاني من الوحدة و من الإكتئاب شخص لا ينام إلا على المهدئات أنا أتحول لشخص لا يطاق,0
آمييين يا ربي,2
وعايشة كأنها في جنة وكل الدنيا ملكاها,2
أثر القوي يضعف إذا غاب خله,0
الله يعطيك الصحة,2
عندو الحق,2
الله يسلمك و يبارك فيك أخي,2
صباح الخيرات و البركات,2
اسوأ موقف ممكن تنحط فيه إنك تكون صديق لشخصين يكرهون بعض,0
تفكير سليم من سيدة مغربية ماأحوجنا لأمثالك سيدتي الجزاء ليس فقط في بناء المساجد بل أيضا في الاستثمار في العقول البشرية,2
كل ما فكرت فيك ابتسمت,2
باش تلقى خدمة بحال هاكا خاصك دمر عليها و تستاهالها فأو روبا ولا فالمغرب,2
دعواتكم لعل دعوة في ظهر الغيب مستجابة و اعلم بان هناك ملك يدعو لك بالمثل ياارب فرج قريب بإذنك,2
عندي تجربة فهاد الميدان,1
تبا لكل من كان سببا في دمار البلاد و العباد,0
كل شعب أدرى بقدرات منتخبه,1
لا يضيع الله صدق النوايا,2
سامو من الناس اللي نجحوا فحياتهم و مشاو بسرعة,2
ايام لن تعود أبدا,1
واضح ان شباب اليوم رغم ذكائهم مغسولة دماغهم تماما,0
مرورك اجمل,2
حكم الزمان,1
لعنة الله عليه وإلى جهنم وبئس المصير,0
لاأعلم,1
شعب كهذا مع الأسف لن يقوى ولن يجرؤ على محاسبة مسؤوليه لأنه وبكل بساطة متواطئ وشريك بطريقة أو بأخرى في كل التجاوزات التي تصير أمامه وبالتالي لا يملك الشرعية الزجرية ويكتفي فقط بالتنديد واستهجان ما يدور حوله كأقصى ما يمكن أن يفعل,0
دائما الإهتمام هو نصف جمال أي علاقة,2
أنا إنسان فاشل في العلاقات الغرامية,0
الأخلاق لا تباع ولا تشترى ولا تصطنع الأخلاق هبه يعطيها الله لمن يحب وتظهر حتى فى ملامحه دون أن يتكلم,1
المصادقة على قانون الميزانية الأمريكية من طرف الرئيس المساعدات الأمريكية الموجهة للمملكة المغربية,1
يلاه طفات عليكم الشمعة,1
الارهاب و القتل هي سياسة محضة و ان كانت بدواعي الدين و الارض و لكن اصول المشكل سياسي على ما اعتقد شخصيا,0
العفو,2
عندي يقين بذلك و الحمد لله شكرا احبيبة على كلامك الطيب,2
انا لله وانا اليه راجعون رحمة الله على الجميع,2
اللهم لا تدع لناذنبا إلا غفرته ولا هما إلا فرجته,2
ثم إن عينيك تقول الحب يبقى شابا حينما يشيب كل شيء,2
مكتب التسيير فاسد يديره مجموعة خونة,0
الله يبلغها كل متمنياتها و يحقق احلامها يا رب,2
ضبط هاتفا ذكيا مهربا بالميناء المتوسطي ب طنجة,1
يبار ليا في عمرك يا رب,2
صراحة الانتقام لكن إذا تم الإعتذار فالمسامحة افضل,2
تقييم حديث يظهر قائمة الدول التي تتمتع بأنظف هواء هل تعتقد أن بلدك يقوم بمجهودات كافية لمحاربة,1
اسمع ثم ابتسم ثم تجاهل,2
اه بصح صعيب بزاف,0
حاربو هيئة النهي عن المنكر و استبدلوها بلجنة الترفيه,0
كانحس براسي تبدلت من داك العام لهاد العام سعاد ديال ماشي هي ديال نهائيا ان شاء الله احسن و احسن,2
الانقلاب يجمع عددا من الفاسدين ليقدمهم,0
طالما انت فاشل لهذا الحد لماذا أخدت منصب سيدك الدكتور محمد مرسي,0
واحد المرة كنت جالس حدا واحد السيد كبير فالعمر و قلت له الوقت تبدلت اسي عمر قال ليا بكل عفوية مسكين بنادم اللي تبدل اولدي اما الوقت باقيا كما هي و لا زلت اتذكر كلامه,1
كانت رحلة رائعة,2
لا يؤمن احدكم حتى يحب لاخيه ما يحب لنفسه وهذا من الخصال الحميدة فيك,2
امين يارب,1
تجار الدين يكذبون ويعتدون ويتواطئون ويزورون,0
شكرا أستاذ,2
نتمنى نشوف مبارة كبيرة تطغى فيها كرة القدم عن اي شيء ويكون الفور للأفضل,2
اه متافق معاك انفتاح و اغناء رصيد و ما الى ذلك لكني قلت ف التغريدة باللي تطلق عليهم,2
هناك أيام بحياتك كنت تظنها لن تمر كانت همك الكبير مرت ولعلك نسيتها والآن أيضا سيمر لاتقلق,2
مرحبا يا عشاق القراءة كيف الحال,2
اتمنى تسحب تعليقك و خل البساط احمدي اذا تتكرم لا نريد ان ندخل في متاهات اعراض بنات المسلمين,2
انا معاكم تالموت,2
لا تيأس مهما عصفت بك الحياة فإن الله الذي يخرج الحي من الميت ويخرج الميت من الحي قادر على أن يجعل لك مخرجا ويرزقك من حيث لا تحتسب صباحكم سعادة,2
أحسن تقرير شفتوا على الأزمة التركية,2
باشمن حق كاتپارطاجيو تصاور و هوية هاداك الشخص اي واحد كايبارطاجي هاداكشي يعرف راسو مريض و ماكاين تا فرق بينو و بين هادوك لي قطعو الريوس غير كلا واحد و كيفاش كايظهر المرض ديالو واااااااااا دخلو سوق روسكم ا عباد الله واك واك كلا يديها فراسو,0
شكون امال بعدا,1
ألف مره قلت لك وجهك من أسباب المسره حتى صوتك أغنية,2
أجمل إحساس فاش كنغني فأي بلاصة وتيجيو يتصورو معايا الناس الزوينين كنبغيكم بزاف وكنموت عليكم خليكم فجنبي حبابي,2
بعد دقائق فقط يبدأ البرنامج شكووون راهو متحمس,1
واجب عيد وطني,2
لانه في حالة خرج جميع اللاعبين خارج المستطيل الاخضر للاحتفال من حق الفريق الخصم ان يلعب الكرة و يروح يسجل,1
خص يوفر البيئة الملائمة للنجاح باش نقدمو ليه حيت نجاح المغربي في يعني تطور البلاد انا غنتخرج بامتياز من جامعة في ماليزيا بتخصص الهندسة المدنية وبغيت نرجع نخدم في بلادي لكن كلشي كيقولي ماتجيش غيحقرو عليك علاش انا نسولك علاش المغاربة ناجحين في الخارج,1
اه معرفت انا تفرجت في دقايق من الشوط الأول,1
كثيرا جدا جزيلا,2
اميين و ما يبقيه في دلك المكان الا لكونه يسلك دلك الطريق,1
ثق بأن لا شيء يفيدك في الدنيا سوى صلاتك وما الدنيا إلا حياة فانية,2
التخلف هذا,0
حافظي عليها فدفئها احن من دفئ البشر,2
لما يتم تفجير المساجد حرام يبقى عمل ارهابي,0
اللهم امين وياك يارب,2
الأم هي الرحمة التي وهبها الله لنا,2
أنا ضد من يحاول الكذب,0
ملكة جمال تكون على اساس اكثر من معيار في كثير من المجالات و ليس فقط على الجمال الخارجي,1
ترى الصبر احلى دواء,2
نعم صحيح شتان بين اوردغان و بين المجرم قاتل شعبه الطاغية بشار,0
صباح الخير شكر خاص لاعضاء وعضوات الشبيبة الاستقلالية الذي زارو ابنتي سيدرة عامر للاطمئنان على حالتها الصحية,2
سيء جدا أن تحمل هموم ليست مناسبة لسنك,0
الله يبارك فيك شكرا,2
الحكم ولا راجل مزيان,2
بوركتم,2
فاقد اللي كنت خايف أفقده,0
أفضل جهاز لكشف الكذب هو الأيام,1
اللهم آمين,1
البوكوص,2
الطريق المستقيمة لا تصنع السائق كذلك الحياة يا صديقي,1
الحمد لله الوزير نفى الخبر,2
سير شوف محطات افريقيا كلها عامرين و حتى المطاعم ديالهم ديما,1
من طبائع الانسان انه لا يرضى بما لديه حتى يفقده يعني حتى الصغير يتمنى متى يكبر و يصير مسؤول وووو مجرد رأي,1
الحمد لله على نعمة الامن و الامان,2
الله يهدي ما خلق,2
و تحياتي لاهل الجزائر,2
قمة الغرور و التكبر و الجهل انا علقت عليها استهزاءا بما فيها من انتقاص للمكان و المسلمين,0
لا اعتقد هناك قلة,1
تزوح إن كانت زوجتك جيدة أصبحت سعيدا وإن كانت زوجتك سيئة اصبحت فيلسوفا سقراط,1
إلى اللقاء دوزوا بخير,2
جايين ضيوف عند الملك,1
شكرا خويا على دعواتك الله يحفظك ويخلي ليك ماعز عليك,2
الشرطة توقف شخصا أطلق الرصاص في مارتيل,1
الحمد لله,2
مبارك عليكم الشهر الكريم وكل عام وانتم ومن تحبون بخير,2
جمعتك اطيب اختي,2
أحسن رفيسة عمية بطريقة لالة زهرة,2
تقريبا سنة,1
سأفرح قريبا تلك هي ثقتي بالله,2
شكون سعيد الحظ و ماعرضتيني گاع,2
ماشاء الله تبارك ربي ما اعظمك,2
لكم الشرف اني ننضم,2
تفكرت ايام الزمن الجميل,2
صح لسانك,2
صباح الخير,2
افضل منبه في الكون هو الام اذا طلبت منها ان توقظك في السابعة صباحأ سوف توقظك في السادسة و تخبرك انها الثامنة و بالتجربة هل مازالت أمك توقظك,2
في اطار تشجيع المواهب و داكشي هذا ما كان,2
أصابع خارجية وراء خسارة المغرب في التنظيم للأسف,0
ليست هذه هي الفكرة الاساسية للتغريدة,1
احلى رفقة,2
تذكير بسيط,1
لا زين لا مجي بكري,0
الله يبارك فيك,2
عودة زيدان تعبد طريق رجوع حكيمي إلى ريال مدريد,1
ورده ومخلوقه على هيئة إنسان,2
ارجو له الشفاء العاجل يارب,2
الله يفرح قلبك سومية انشاء الايام طويلة غنتلاقاو في ساعة خير,2
اللهم إنا نسألك أن تغفر لنا ما فات وتقبل منا ما هو آت,2
صباح الخير يا فنان,2
و و و تحماو علينا ويلاه جابو معانا التعادل,2
شدوه البوليس واخا و علاش عباد الله كاتصور فيه و تبارطاجيه علاش يبارطاجيو لاكارط ناصيونال ديالو الخ,1
إذا أردت أن تعيش في أنس وسعادة وراحة زد رصيد علاقاتك بطيب القول والحرص على إماطة الأذى عن مشاعر الناس وقولوا للناس حسنا فإنها مفتاح من مفاتيح القلوب,1
هاد المسافة اللي ضربتي يوصي بها الاطباء يوميا لهذا لا خوف عليك,2
الجودة كتفقص,1
أشعر بالتعبمن نفسي و تفكيري من الذين حولي و البعيدين,0
استغفر الله,2
تعلمنا الموسيقى كيف نقيس فترات صمتنا,1
المغرب يشارك في المناورات البحرية متعددة الجنسيات,1
هذا يتوقف على مدى إنسجام الزوجين,1
حب الله و الوالدين,2
مشاو بعيد,1
باركولي اليوم حصلتو علا جاءزة تنويه كون اتكلمو و اكتبو للوغة العربية بتلاقا وأنا جدو سعيد بهادا لنجاز و قررت أن اوشارككم فرحتي ومن هذا المنبر اشكرو كل من شاركا معي في فرحتي واتمنا أن أكون عند حسن ضنكم بي و جزاكم الله خيرن,2
نريد لمشروع التراموي ان يخرج للوجود,2
تابعيني باش نقدر ندخلك,1
ولو أحب أثنين أحبك أنت و عيونك,2
جعل الله دعاءك في ميزان حسناتك,2
الوطن ممزق,0
كملوا يعطيكم الصحة,2
لا توصيني على نفسي وهي معك,2
اقسم بالله ان العرب اكثر الشعوب تخلفا,0
نقطة مزيانة ف مادة علمية اهون و اسهل من نقطة مزيانة ف مادة ادبية,2
مواقع التواصل الاجتماع قلصت من حريتنا الاحتماعية و غيرت مردودنا الاجتماعي نحو عائلاتنا و اصدقائنا سلبت منا الهوس الاجتماعي اللي الانسان معروف عليه,0
سمحي لينا نتي مانعاودوش,2
هل دعاء اللهم ردنا اليك ردا جميلا اصبحت مسبة,1
انا بخير حبوبة حال و احوال بحال ديما,2
لجنة تقارب سبل إيواء النساء والأطفال بورزازات,1
مرحبا استاد,2
المغرب تسحب سفيرها من السعودية المغرب توقف مشاركتها مع السعودية في غزو اليمن,0
انتم من صوت لأمريكا وأطلق فكرة العداء,0
للاناقة عنوان,2
غير تهلا فيها تولي ان شاء الله بحال هكا,2
للاسف هذا هو الوضع الله يصلح حالنا,0
قمة الألم حين يكسرك غالي و يجبرك الغريب,0
أعظم أسباب كسب النعمة التوكل على الله والاعتماد عليه,2
مصيبة هادي اغلبيتهم عديمي المسؤولية,0
إله إ أنت سبحانك إني كنت من الظالمين,1
شربوهم شي حاجة ف فالاستراحة,1
دائما الغيوم واشكالها تشعرنا بروح الجمال,2
في البيت بمفردي للأسف,0
اعتدار مقبول على العين و الراس,2
الحمد لله مزال الخير في الناس,2
السجادة التي نفترشهآ ل لقاء الله وطن لا يخذل ساكنيه,2
يارب,2
ربي يدوم فرحتك ساهوتي,2
اللهم شيئا جميلا لم يكن بالحسبان,2
اللهم أمطرني عفوا و رحمه أمطرني خيرا و رأفه أمطرني سعدا و فرحه يا الله,2
أصعب من الشوق كتمانه,0
لا توجد دولة ااسلاميه حالها يفرح و السبب لا اعرف هو باين ف الحقيقة يعني باش يتغير حال هاد الامة خاصنا نهتمو بحالنا دينيا و دنيويا و بهاد الوتيرة اللي غادين بيها خاصنا قرون,0
كما يقولو ما ديرش ما تخافش الله يحد البأس,2
و راني غير كنت تنضحك معاك بارطاجي كما تشار,1
اذهبو الى الجحيم,0
ليتني آعرف ما بذاخلك,0
كل الاحترام والتقدير لشعب مصر الطيب,2
واش كاين شي إنتخابات و انا ما في راسيش ولا شنوا,1
اللهم اجعلنا ممن تغيرت أقدارهم للأحسن ولاتحرمنا من ما نطمح إليه ولاتصعب علينا أمرا وارزقنا حظ الدنيا ونعيم الآخرة,2
قلبي معك والروح لك دنيا و دين واللي احبه والله ان قلبي معه,2
اللهم ثبتنا على الصلاة حبا وليس فرضا,2
تعلموا الاخلاق من اليابانيين,2
ممن كان سببا في فتنة المؤمنين و المؤمنات و دحرجتهم عن طريق الحق,0
صعب تغيير القناعات,1
اعزك الله,2
دام عزك و نصرك اخي الفاضل,2
االقلب ينبض من جديد,2
دعوة حب,2
وإنك لعلى خلق عظيم,2
يامسؤولي المغرب لماذا هذا الحقد الاسود والقسوة المفرطة إنه إعدام مع وقف التنفيذ,0
أصبحنا وأصبح الملك لله والحمد لله ولاإلاه إلا الله وحده لاشريك له له الملك وله الحمد وهو على كل شيء قدير,2
هدا هو الجواب الصحيح,2
و يحدث أن يرسل الله لنا شخصا يزهر ما أذبلته الأيام في قلوبنا,2
جميل بالخير و البركة,2
مزيدا من التألق ان شاء الله,2
العفو دائما في الخدمة,2
نتظآھر ب آلقوة و لگن بدآخلنا وطن يبگي,0
نحن بخير و نسلم عليك,2
حتى عيوبك في عيوني جميله,2
إن أحسنتم أحسنتم لأنفسكم اجعلها قاعدة في حياتك أسعد مساءكم بكل خير,2
ياحبيبي لي الشرف,2
العفو,2
أنت مجتهد,2
فعلا معك حق يا قلبي,2
و كفى يالله شهيدا,1
احسنت,2
الله يحفظك,2
زمان الصمت ياعمر الحزن والشكوى,0
حنة الله يرحمها,2
الله احفظك الولد الخير,2
آمين والله يرحم الوالد ويجعل مثواه الجنة,2
شكرا على الدعاء اخي وربي يصلح حالنا اجمعين,2
معندي مشكل معا حد غير الإنسان إتستتر,2
نحن نعرف ان دولتنا جبانة و لا تملك قرارها بيدها للأسف,0
نعم يجب عليك ان تدافع عن ارضك ووطنك ضد كل من يسيء لها ويحاول تدميرها ولا يمكن ان نصف جريمة متعمدة نفذت بغباء وانتهت بفضيحة انها خطأ وببساطة نقول الجميع يخطئ,2
الله يعطيك الخير ناس الكرم,2
في بعض الأحيان أضطر لفعل ذالك وفي بعض الأحيان أشتكي لشرطيي المحطة الذين لايفعلون شيئا,0
هو كذالك أخي,2
اللهم إني أعوذ بك من الهم والحزن والعجز والكسل والبخل والجبن وضلع الدين وغلبة الرجال,1
الحقيقة مع الاسف,0
ارتفاع في أرباح مجموعة موانئ دبي العالمية,1
حرام والله حزنت عليه,0
كن من الله قريبا تبسط الحياة لك نعيمها,2
كل شيء له فرصة ثانيه إلا الثقة,1
امين الله يحفظك,2
حتى ذلك الحين لا تنسينا من صالح دعائكم دمت بخير,2
عن اي قمة اقتصادية يتحدثون الله يلعن للي ما يحشم,0
اقبل بالمكان الذي أنت به تذكر أين كنت ولكن الأكثر أهمية أن تعلم المكان الذي تريد الذهاب إليه أتمنى لك بداية جميلة ويوم رائع,2
الله على راحة الحمد لله,2
واعرة هاديك,2
وحتى اللي ارتكبت معاه اخطاء كتحاول ما تكررهم مرة اخرى مع احد ثاني,1
كل صادق بالهوى حظه قليل,0
ارادة الشعب اللي خلاتو يهدر,2
موتو بالسم موتو بالسم يا لمسمومين,2
مودتي و محبتي لكي,2
صورة معبرة للوضع الآن في مصر,1
للاسف ملعب خيب بزاف,0
ما مضى فات ولا داعي لإحيائه,1
نسأل الله أن يرد كيدهم في نحرهم مجرمون,0
نوضي تنعسي,1
امممم باين لذيذ تبارك الله عليكم وخلاص كتقاتلوا مع تمارة والله يعطينا غير شوي صبر منكم لكم مني كل التحيات والتقدير,2
الفارق الزمني ساعة و نصف اسف و ليست ساعتان,1
سمحي ليا هي قلات الأدب هو مول العقل هي مراهقة كاين طرق أخرى,0
اوا الحمد لله,2
الخط تقري تحسنيه من اسهل ما يكون فقط داومي على الكتابة و كوني متفائلة,2
أنا رجعت للدراما المكسيكية القديمة خخخ رووعة,2
انا بالمحكمة واشوف تسلط وظلم كبير,0
تطمن ما أحب الا عيونك,2
أسعدك الله أختي الفاضلة فعلا تجربة تستحق النشر جزيت خيرا,2
لا تحدثني عن الحب عاملني به,2
و الشعوب التي تعرف انها لا تخدم مصالحها و لا تحرك ساكنا تستحق ان يكذب عليها,0
عرفتك واقيلة علاش داوية هاد القنت ما واقف على حد الى مشا واحد يجيو عشرين و تستمر الحياة عادي جدا,1
يارب قد طال انتظاري فبشرني بما انتظره منك عاجلا غير آجل إنك على كل شي قدير بجاهي النبي محمد عليه الصلاة والسلام,1
امين و انت كذلك,2
الصورة لا تحتاج لتعليق,1
ربي ربي ربي يفرح قلبك هاذ الصباح ناشط مع راسي,2
وايلي نتوما ممحتاجينش الفرص باش تجيو,1
ما هي اللغات الرسمية الموجودة في المملكة المتحدة,1
اللهم أعز الإسلام والمسلمين,2
اتق الله,1
و كما العادة سيحمون المجرم الحقيقي و يقمون من يريدون نصب الكمين له,0
القاتل اعترف رسميا بانقلاب العسكر,0
صباح يقين بالله انت اجمل يا قلبي,2
لا تعطي الإحباطات اليومية القدرة على إطفاء حماسك وضعف همتك وتشتت تركيزك على إنجاز الأهداف الكبرى لأنك أكبر من تلك المعوقات,2
الحمدلله بقدر ما نضيق ونسعد الحمدلله دائما و ابدا,2
للهم إنا نسألك في هذا الصباح أن ترزق قلوبنا السكينة,2
انا بديت الاسبوع لي فات عاد كملت عييت بالتحاليل,1
الظلم الاجتماعي,0
نعم,2
تسلم يا الغالي,2
الحمدلله على نعمة المغرب,2
حصل ما حصل لا تضعف لا تبك لا تدس نفسك عن الحياة أنت لا تريد هذا لكن الله أراد أتعرف ما معنى أن يريد الله,2
هو الاصل و الباقي تقليد,2
صافي,1
حتى لو كانت الوضعية ميسورة هي لي عندها الحق تقرر او يكون داكشي بالتراضي المرآة ماشي ملك مادي يتصرف فيه الراجل كيف بغا,1
كولشي باغي فيك الخدمة,0
أحس تعبير ممكن تنهي بيه أي جدال,2
عندما تجد الأب فقيرا ويربي ابنائه احسن تربية فإنه يستحق ان نفتخر به كل الاحترام و التقدير,2
داكشي اللي بغينا,2
عندما تعيش لتسعد الاخرين سيبعث الله لك من يعيش ليسعدك,2
سافري و لكن بذكائك,2
هو الحاكم تقمع و كتم القمعة و حتى الهضرة ما جاوبوش,0
گوني قويه فالحيآه لآ تحترم الا المرأه القوية التي لا تكسرهآا التجارب الفاشله وانماا تبنيهاا,2
مع من تحب تجد في أبسط الأشياء فرحا,2
كفيت و وفيت و ما قصرت اخي الكريم و هذا من نبلك و علو اخلاقك حفظك الله و رعاك,2
اه دابا فهمت,1
أتمنى ان لا اكون واحد من هؤلاء,0
الله يرضي عليك,2
سؤال حقيقي هذا,1
اللهم كما عطرت ذكره بين خلقك عطر قبره برائحة الجنة,2
ربي يسعدكم ويفرح قلوبكم,2
الثقة غالية لا نهبها لأي كان,2
امين يارب العالمين,2
للأسف,0
حسبنا الله ونعم الوكيل مع من عايشين,0
هادشي لي عطى الله,0
لكن وقت الجد يعرفون من اين تؤكل الكتف,2
أمراض الخاطر حين تؤلم شخصيا,0
البث المباشر للبرنامج هنا,1
سؤالي كان عفوي لا تؤاخذيني,2
صافي ماكاين غير تفاؤل,2
الأخلاق لا تباع ولا تشترى ولا تصطنع الأخلاق هبه يعطيها الله لمن يحب وتظهر حتى فى ملامحه دون أن يتكلم,1
أظن دولة اروبية,1
توحشناك عم حسن الله ييسر ليك,2
الله عطاها عيون تامر وتنهي,2
أنا لا أكتب لأرضي أحد واتفق معك,1
لا صحة و لا تعليم ولا والو بلاد الموت البطيئ,0
